file_path,transcript,duration,segment_index,speaker_role
C:\Users\tssmi\OneDrive\Desktop\nlp\processed_audio\audio_3152_seg_0.wav,REDUCING ONE SIX ZERO TOWER ONE TO ONE ONE EIGHT ONE,6.84,2396,UNKNOWN
C:\Users\tssmi\OneDrive\Desktop\nlp\processed_audio\audio_3153_seg_0.wav,LUFTHANSA FOUR NOVEMBER LIMA DESCEND FLIGHT LEVEL TWO NINER ZERO CONTACT PRAHA ONE THREE FIVE DECIMAL ONE THREE FIVE GOOD BYE,5.51,2397,UNKNOWN
C:\Users\tssmi\OneDrive\Desktop\nlp\processed_audio\audio_3154_seg_0.wav,CSA SEVEN TANGO LINE UP RUNWAY THREE ONE BE READY FOR IMMEDIATE,5.34,2398,UNKNOWN
C:\Users\tssmi\OneDrive\Desktop\nlp\processed_audio\audio_3155_seg_0.wav,LUFTHANSA SEVEN ONE FOUR HELLO RADAR CONTACT CONFIRM YOU REQUEST THREE TWO ZERO CORRECTION THREE THREE ZERO,0.96,2399,UNKNOWN
C:\Users\tssmi\OneDrive\Desktop\nlp\processed_audio\audio_3156_seg_0.wav,CSA EIGHT ZERO THREE WHEN READY DESCEND FLIGHT LEVEL TWO NINER ZERO LEAVING NOW,2.72,2400,UNKNOWN
C:\Users\tssmi\OneDrive\Desktop\nlp\processed_audio\audio_3157_seg_0.wav,SKYTRAVEL THREE FIVE JULIETT TURN RIGHT HEADING ONE EIGHT ZERO VECTORING FOR SPACING,2.73,2401,UNKNOWN
C:\Users\tssmi\OneDrive\Desktop\nlp\processed_audio\audio_3158_seg_0.wav,HOTEL YANKEE HOTEL WIND ZERO FOUR ZERO DEGREES ONE ONE KNOTS RUNWAY ONE ZERO CLEARED TO LAND,2.21,2402,UNKNOWN
C:\Users\tssmi\OneDrive\Desktop\nlp\processed_audio\audio_3159_seg_0.wav,DESCEND FOUR THOUSAND FEET QNH ONE ZERO TWO THREE CLEARED ILS THREE ONE CSA,0.8,2403,UNKNOWN
C:\Users\tssmi\OneDrive\Desktop\nlp\processed_audio\audio_315_seg_0.wav,SPEED ONE SIXTY UNTIL FOUR,0.91,2404,UNKNOWN
C:\Users\tssmi\OneDrive\Desktop\nlp\processed_audio\audio_3160_seg_0.wav,CONFIRM REQUESTED DESCEND,3.07,2405,UNKNOWN
C:\Users\tssmi\OneDrive\Desktop\nlp\processed_audio\audio_3161_seg_0.wav,DESCEND LEVEL NINER ZERO CSA EIGHT THREE EIGHT WHISKEY,3.92,2406,UNKNOWN
C:\Users\tssmi\OneDrive\Desktop\nlp\processed_audio\audio_3162_seg_0.wav,ELMEK THEN NORKU TURKISH ONE NINER FIVE THREE,1.3,2407,UNKNOWN
C:\Users\tssmi\OneDrive\Desktop\nlp\processed_audio\audio_3163_seg_0.wav,CONFIRM SIX ROMEO VICTOR AFFIRM,2.42,2408,UNKNOWN
C:\Users\tssmi\OneDrive\Desktop\nlp\processed_audio\audio_3164_seg_0.wav,YES WE ARE APPROACHING TWO THOUSAND FEET LEFT DOWNWIND,3.5,2409,UNKNOWN
C:\Users\tssmi\OneDrive\Desktop\nlp\processed_audio\audio_3165_seg_0.wav,CLIMBING LEVEL THREE THREE ZERO AEROFLOT ONE TWO TWO,2.67,2410,UNKNOWN
C:\Users\tssmi\OneDrive\Desktop\nlp\processed_audio\audio_3166_seg_0.wav,THANK YOU,7.2,2411,UNKNOWN
C:\Users\tssmi\OneDrive\Desktop\nlp\processed_audio\audio_3167_seg_0.wav,DELTA OSCAR VICTORIA YOU ARE STILL ON THE BERN ARRIVAL FREQUENCY,1.25,2412,UNKNOWN
C:\Users\tssmi\OneDrive\Desktop\nlp\processed_audio\audio_3168_seg_0.wav,HELI INDIA ECHO LAND ON DISCRETION SWISS HELICOPTER WIND ZERO SEVEN ZERO DEGREES SIX KNOTS,5.5,2413,UNKNOWN
C:\Users\tssmi\OneDrive\Desktop\nlp\processed_audio\audio_3169_seg_0.wav,CIMBER THREE FIVE TWO FIVE ON PRESENT HEADING CLEARED TO INTERCEPT AND CLEARED FOR ILS APPROACH RUNWAY THREE ONE,4.02,2414,UNKNOWN
C:\Users\tssmi\OneDrive\Desktop\nlp\processed_audio\audio_316_seg_0.wav,SORRY SAY AGAIN,0.92,2415,UNKNOWN
C:\Users\tssmi\OneDrive\Desktop\nlp\processed_audio\audio_3170_seg_0.wav,ONE THREE FOUR NINER TWO FIVE BELGIAN THREE HUNDRED BYE BYE,0.79,2416,UNKNOWN
C:\Users\tssmi\OneDrive\Desktop\nlp\processed_audio\audio_3171_seg_0.wav,CONTINUE APPROACH TANGO THREE SIX SIX,4.68,2417,UNKNOWN
C:\Users\tssmi\OneDrive\Desktop\nlp\processed_audio\audio_3172_seg_0.wav,THAT'S GREAT THANK YOU DESCEND FLIGHT LEVEL ONE ZERO ZERO EASY,1.17,2418,UNKNOWN
C:\Users\tssmi\OneDrive\Desktop\nlp\processed_audio\audio_3173_seg_0.wav,CSA EIGHT ZERO THREE DESCEND FLIGHT LEVEL ONE ZERO ZERO,2.14,2419,UNKNOWN
C:\Users\tssmi\OneDrive\Desktop\nlp\processed_audio\audio_3174_seg_0.wav,ROGER MAINTAIN FOR A WHILE TRAFFIC BELLOW,2.89,2420,UNKNOWN
C:\Users\tssmi\OneDrive\Desktop\nlp\processed_audio\audio_3175_seg_0.wav,PRAHA GOOD AFTERNOON,0.73,2421,UNKNOWN
C:\Users\tssmi\OneDrive\Desktop\nlp\processed_audio\audio_3176_seg_0.wav,CSA SEVEN ECHO CHARLIE TURN LEFT PROCEED DIRECT RAPET,0.88,2422,UNKNOWN
C:\Users\tssmi\OneDrive\Desktop\nlp\processed_audio\audio_3177_seg_0.wav,STEFANIK TOWER OSCAR MIKE CHARLIE INDIA ALPHA REQUEST,3.23,2423,UNKNOWN
C:\Users\tssmi\OneDrive\Desktop\nlp\processed_audio\audio_3178_seg_0.wav,LUFTHANSA TWO ALPHA CHARLIE COMMENCE DESCEND,5.37,2424,UNKNOWN
C:\Users\tssmi\OneDrive\Desktop\nlp\processed_audio\audio_3179_seg_0.wav,LANDING ON DISCRETION FATOTWO FIVE CHARLIE ZULU,5.78,2425,UNKNOWN
C:\Users\tssmi\OneDrive\Desktop\nlp\processed_audio\audio_317_seg_0.wav,DESCENDING FLIGHT LEVEL ONE THREE ZERO CSA SIX,2.88,2426,UNKNOWN
C:\Users\tssmi\OneDrive\Desktop\nlp\processed_audio\audio_3180_seg_0.wav,TANGO OSCAR LEAVE THE FREQUENCY BYE BYE,2.76,2427,UNKNOWN
C:\Users\tssmi\OneDrive\Desktop\nlp\processed_audio\audio_3181_seg_0.wav,NOVEMBER FOUR NINER XRAY LIMA TAXI VIA DELTA LINE UP ZERO FOUR REPORT READY,6.05,2428,UNKNOWN
C:\Users\tssmi\OneDrive\Desktop\nlp\processed_audio\audio_3182_seg_0.wav,TANGO KILO ALPHA WIND ZERO FOUR ZERO DEGREES ONE ZERO KNOTS ON THE ONE ZERO CLEARED FOR TAKEOFF,4.5,2429,UNKNOWN
C:\Users\tssmi\OneDrive\Desktop\nlp\processed_audio\audio_3183_seg_0.wav,LUFTHANSA SIX LIMA LIMA ONE THREE THREE THREE NINER ZERO GOOD BYE,5.2,2430,UNKNOWN
C:\Users\tssmi\OneDrive\Desktop\nlp\processed_audio\audio_3184_seg_0.wav,AUSTRIAN SEVEN ZERO THREE,4.035,2431,UNKNOWN
C:\Users\tssmi\OneDrive\Desktop\nlp\processed_audio\audio_3185_seg_0.wav,LUFTHANSA SEVEN SIX ONE DESCEND FLIGHT LEVEL THREE ONE ZERO TO CROSS RAPET AT LEVEL,4.31,2432,UNKNOWN
C:\Users\tssmi\OneDrive\Desktop\nlp\processed_audio\audio_3186_seg_0.wav,OSCAR KILO CHARLIE ALPHA PAPA SQUAWK SEVEN THOUSAND GOOD BYE,3.03,2433,UNKNOWN
C:\Users\tssmi\OneDrive\Desktop\nlp\processed_audio\audio_3187_seg_0.wav,OSCAR KILO FOXTROT ALPHA OSCAR TAXI TO HOLDING POINT RUNWAY TWO SEVEN VIA ALPHA CHARLIE,2.74,2434,UNKNOWN
C:\Users\tssmi\OneDrive\Desktop\nlp\processed_audio\audio_3188_seg_0.wav,LEVEL ONE SIX ZERO EASY SIX EIGHT KILO PAPA,3.72,2435,UNKNOWN
C:\Users\tssmi\OneDrive\Desktop\nlp\processed_audio\audio_3189_seg_0.wav,DESCEND LEVEL ONE HUNDRED FINNAIR SEVEN FIVE WHISKEY,0.83,2436,UNKNOWN
C:\Users\tssmi\OneDrive\Desktop\nlp\processed_audio\audio_318_seg_0.wav,QLINK FOUR ZERO TWO SYDNEY TOWER GOOD MORNING,1.52,2437,UNKNOWN
C:\Users\tssmi\OneDrive\Desktop\nlp\processed_audio\audio_3190_seg_0.wav,ROGER BREAK BREAK HELI DELTA QUEBEC AFTER HOTEL WHISKEY CROSS VIA BERNE CITY THEN HOTEL ECHO,4.72,2438,UNKNOWN
C:\Users\tssmi\OneDrive\Desktop\nlp\processed_audio\audio_3191_seg_0.wav,REDUCING TWO FIFTY CSA EIGHT THREE FOXTROT,4.38,2439,UNKNOWN
C:\Users\tssmi\OneDrive\Desktop\nlp\processed_audio\audio_3192_seg_0.wav,HOTEL GOLF DELTA WIND ZERO FOUR ZERO DEGREES SEVEN KNOTS RUNWAY ONE FOUR CLEARED FOR TAKEOFF,2.81,2440,UNKNOWN
C:\Users\tssmi\OneDrive\Desktop\nlp\processed_audio\audio_3193_seg_0.wav,CATHAY ZERO SIX EIGHT,6.57,2441,UNKNOWN
C:\Users\tssmi\OneDrive\Desktop\nlp\processed_audio\audio_3194_seg_0.wav,RYANAIR THREE,0.79,2442,UNKNOWN
C:\Users\tssmi\OneDrive\Desktop\nlp\processed_audio\audio_3195_seg_0.wav,PUSH AND START APPROVED ON POSITION THREE FOXTROT ON SQUAWK FOUR FOUR ZERO TWO EUROTRANS ONE THREE JULIETT,0.85,2443,UNKNOWN
C:\Users\tssmi\OneDrive\Desktop\nlp\processed_audio\audio_3196_seg_0.wav,NOVEMBER FOUR CHARLIE GOLF CONTACT TOWER ONE ONE EIGHT DECIMAL ONE ZERO FIVE,1.35,2444,UNKNOWN
C:\Users\tssmi\OneDrive\Desktop\nlp\processed_audio\audio_3197_seg_0.wav,DESCENDING FLIGHT LEVEL NINER ZERO CSA THREE FOXTROT,3.42,2445,UNKNOWN
C:\Users\tssmi\OneDrive\Desktop\nlp\processed_audio\audio_3198_seg_0.wav,PRAHA GOOD MORNING LUFTHANSA TWO FOUR MIKE LEVEL TWO SEVEN SEVEN CLIMBING TWO EIGHT ZERO,1.65,2446,UNKNOWN
C:\Users\tssmi\OneDrive\Desktop\nlp\processed_audio\audio_3199_seg_0.wav,CSA FOUR EIGHT ZERO TURN RIGHT PROCEED DIRECT TO ARTUP,2.68,2447,UNKNOWN
C:\Users\tssmi\OneDrive\Desktop\nlp\processed_audio\audio_319_seg_0.wav,AIRFRANS TWO FOUR EIGHT TWO DESCEND FOUR THOUSAND FEET QNH ONE ZERO ONE EIGHT,0.676,2448,UNKNOWN
C:\Users\tssmi\OneDrive\Desktop\nlp\processed_audio\audio_31_seg_0.wav,DESCEND LEVEL NINER ZERO AND,3.73,2449,UNKNOWN
C:\Users\tssmi\OneDrive\Desktop\nlp\processed_audio\audio_3200_seg_0.wav,ONE SIX RIGHT CLEARED TO LAND JETEX SEVEN FOUR THREE FOUR,0.76,2450,UNKNOWN
C:\Users\tssmi\OneDrive\Desktop\nlp\processed_audio\audio_3201_seg_0.wav,LEFT HEADING ONE THREE ZERO QUALITY EIGHT NINER SIERRA,3.01,2451,UNKNOWN
C:\Users\tssmi\OneDrive\Desktop\nlp\processed_audio\audio_3202_seg_0.wav,YOU NEED TO BACKTRACK YES,1.13,2452,UNKNOWN
C:\Users\tssmi\OneDrive\Desktop\nlp\processed_audio\audio_3203_seg_0.wav,FRACTION ONE ZERO THREE MIKE WIND ONE FOUR ZERO DEGREES FOUR KNOTS RUNWAY TWO EIGHT CLEARED FOR TAKEOFF,2.53,2453,UNKNOWN
C:\Users\tssmi\OneDrive\Desktop\nlp\processed_audio\audio_3204_seg_0.wav,ROGER MILES COPIED AND FOUR THOUSAND,3.07,2454,UNKNOWN
C:\Users\tssmi\OneDrive\Desktop\nlp\processed_audio\audio_3205_seg_0.wav,ONE TWO SEVEN ONE,0.83,2455,UNKNOWN
C:\Users\tssmi\OneDrive\Desktop\nlp\processed_audio\audio_3206_seg_0.wav,COPY CONTINUE TO FINAL RUNWAY ONE THREE CSA FIVE PAPA CHARLIE,2.59,2456,UNKNOWN
C:\Users\tssmi\OneDrive\Desktop\nlp\processed_audio\audio_3207_seg_0.wav,BAUHINIA TWO ZERO ONE EIGHT CONTACT DEPARTURE GOOD NIGHT,1.75,2457,UNKNOWN
C:\Users\tssmi\OneDrive\Desktop\nlp\processed_audio\audio_3208_seg_0.wav,LOT FIVE TWO SIX TURN LEFT DIRECT TO AGAVA,3.29,2458,UNKNOWN
C:\Users\tssmi\OneDrive\Desktop\nlp\processed_audio\audio_3209_seg_0.wav,CLEARED TO LAND RUNWAY TWO FIVE MOSQUITO ONE FIVE BRAVO,4.46,2459,UNKNOWN
C:\Users\tssmi\OneDrive\Desktop\nlp\processed_audio\audio_320_seg_0.wav,HOTEL ECHO XRAY FINAL TWO FIVE FOR TOUCH AND GO,1.05,2460,UNKNOWN
C:\Users\tssmi\OneDrive\Desktop\nlp\processed_audio\audio_3210_seg_0.wav,SIX TWO MILES AND DESCEND FLIGHT LEVEL ONE ZERO ZERO,0.72,2461,UNKNOWN
C:\Users\tssmi\OneDrive\Desktop\nlp\processed_audio\audio_3211_seg_0.wav,LUFTHANSA ONE UNIFORM XRAY CLIMB FLIGHT LEVEL THREE THREE ZERO,1.95,2462,UNKNOWN
C:\Users\tssmi\OneDrive\Desktop\nlp\processed_audio\audio_3212_seg_0.wav,OSCAR KILO DELTA SIERRA INDIA TURN LEFT HEADING ONE ZERO ZERO,1.39,2463,UNKNOWN
C:\Users\tssmi\OneDrive\Desktop\nlp\processed_audio\audio_3213_seg_0.wav,ONE THREE THREE THREE NINER ZERO WITH THE HEADING SIX ONE EIGHT,3.6,2464,UNKNOWN
C:\Users\tssmi\OneDrive\Desktop\nlp\processed_audio\audio_3214_seg_0.wav,BEELINE THREE PAPA PAPA DESCEND FLIGHT LEVEL ONE THREE ZERO DESCENDING ONE THREE ZERO BEELINE THREE PAPA PAPA,1.25,2465,UNKNOWN
C:\Users\tssmi\OneDrive\Desktop\nlp\processed_audio\audio_3215_seg_0.wav,LUFTHANSA NINER VICTOR VICTOR DESCEND FLIGHT LEVEL TWO NINER ZERO NINER VICTOR VICTOR DESCENDING TWO NINER ZERO,0.79,2466,UNKNOWN
C:\Users\tssmi\OneDrive\Desktop\nlp\processed_audio\audio_3216_seg_0.wav,KLM FIVE SIX TANGO RUNWAY THREE ONE CLEARED FOR TAKEOFF WIND CALM BYE BYE,5.34,2467,UNKNOWN
C:\Users\tssmi\OneDrive\Desktop\nlp\processed_audio\audio_3217_seg_0.wav,OK THERE THERE IS SOME VFR TRAFFIC REALLY CALL YOU IN TWO MINUTES FOR DESCEND,3.49,2468,UNKNOWN
C:\Users\tssmi\OneDrive\Desktop\nlp\processed_audio\audio_3218_seg_0.wav,GERMANWINGS TWO ONE FOUR ZERO CLIMB FLIGHT LEVEL THREE FOUR ZERO,2.91,2469,UNKNOWN
C:\Users\tssmi\OneDrive\Desktop\nlp\processed_audio\audio_3219_seg_0.wav,QUALITY EIGHT NINER ZERO TURN LEFT HEADING ZERO FOUR ZERO TO BASE,2.5,2470,UNKNOWN
C:\Users\tssmi\OneDrive\Desktop\nlp\processed_audio\audio_321_seg_0.wav,DESCENDING FLIGHT LEVEL NINER ZERO,3.7,2471,UNKNOWN
C:\Users\tssmi\OneDrive\Desktop\nlp\processed_audio\audio_3220_seg_0.wav,FLIGHT LEVEL THREE FIVE ZERO,4.74,2472,UNKNOWN
C:\Users\tssmi\OneDrive\Desktop\nlp\processed_audio\audio_3221_seg_0.wav,LUFTHANSA,3.4,2473,UNKNOWN
C:\Users\tssmi\OneDrive\Desktop\nlp\processed_audio\audio_3222_seg_0.wav,ROGER THANK YOU,0.76,2474,UNKNOWN
C:\Users\tssmi\OneDrive\Desktop\nlp\processed_audio\audio_3223_seg_0.wav,TANGO THREE ONE THREE SION GROUND HELLO AGAIN TAXI APPROVED,4.75,2475,UNKNOWN
C:\Users\tssmi\OneDrive\Desktop\nlp\processed_audio\audio_3224_seg_0.wav,ONE EIGHT ZERO OR LESS,2.4,2476,UNKNOWN
C:\Users\tssmi\OneDrive\Desktop\nlp\processed_audio\audio_3225_seg_0.wav,LUFT TRANSPORT ONE FIVE FIVE CONTACT RHEIN ONE THREE THREE DECIMAL EIGHT SIX ZERO GOOD BYE,2.62,2477,UNKNOWN
C:\Users\tssmi\OneDrive\Desktop\nlp\processed_audio\audio_3226_seg_0.wav,HOTEL ECHO XRAY RECLEARED FULL STOP LANDING RUNWAY TWO FIVE,1.78,2478,UNKNOWN
C:\Users\tssmi\OneDrive\Desktop\nlp\processed_audio\audio_3227_seg_0.wav,DEPARTURE OWN DISCRETION TWO FIVE NEXT ZERO SEVEN SORRY FOR LEAVING HELI HOTEL YANKEE,4.77,2479,UNKNOWN
C:\Users\tssmi\OneDrive\Desktop\nlp\processed_audio\audio_3228_seg_0.wav,IT IS BALTU FOUR ALPHA TO CLIMB FIVE THOUSAND FEET,3.15,2480,UNKNOWN
C:\Users\tssmi\OneDrive\Desktop\nlp\processed_audio\audio_3229_seg_0.wav,SKYTRAVEL ONE TWO ZERO ONE YOU MAY EXPECT RUNWAY THREE ONE,2.31,2481,UNKNOWN
C:\Users\tssmi\OneDrive\Desktop\nlp\processed_audio\audio_322_seg_0.wav,STANDBY,2.39,2482,UNKNOWN
C:\Users\tssmi\OneDrive\Desktop\nlp\processed_audio\audio_3230_seg_0.wav,ONE ONE SEVEN HELLO BUT CALL US ON ONE THREE THREE DECIMAL THREE NINER ZERO,6.15,2483,UNKNOWN
C:\Users\tssmi\OneDrive\Desktop\nlp\processed_audio\audio_3231_seg_0.wav,VISTA JET FOUR SIX SEVEN,6.65,2484,UNKNOWN
C:\Users\tssmi\OneDrive\Desktop\nlp\processed_audio\audio_3232_seg_0.wav,CLIMB LEVEL THREE FOUR ZERO NINER EIGHT HOTEL,4.33,2485,UNKNOWN
C:\Users\tssmi\OneDrive\Desktop\nlp\processed_audio\audio_3233_seg_0.wav,CSA FIVE KILO PAPA SPEED TWO FIVE ZERO KNOTS,1.17,2486,UNKNOWN
C:\Users\tssmi\OneDrive\Desktop\nlp\processed_audio\audio_3234_seg_0.wav,LUFTHANSA EIGHT LIMA JULIETT CALL ME ON ONE THREE TWO EIGHT NINER ZERO,0.8,2487,UNKNOWN
C:\Users\tssmi\OneDrive\Desktop\nlp\processed_audio\audio_3235_seg_0.wav,LUFTHANSA SEVEN THREE EIGHT CONFIRM THREE THREE ZERO REQUESTED,3.34,2488,UNKNOWN
C:\Users\tssmi\OneDrive\Desktop\nlp\processed_audio\audio_3236_seg_0.wav,GOOD DAY ONE TWO ZERO FIVE TWO FIVE BYE,5.36,2489,UNKNOWN
C:\Users\tssmi\OneDrive\Desktop\nlp\processed_audio\audio_3237_seg_0.wav,CLIMB FLIGHT LEVEL THREE FOUR ZERO EASY FOUR SIX ZERO BRAVO,2.32,2490,UNKNOWN
C:\Users\tssmi\OneDrive\Desktop\nlp\processed_audio\audio_3238_seg_0.wav,GERMAN WINGS SEVEN PAPA ESTABLISHED INBOUND TRACK,0.97,2491,UNKNOWN
C:\Users\tssmi\OneDrive\Desktop\nlp\processed_audio\audio_3239_seg_0.wav,ONE ONE NINER TWO,3.23,2492,UNKNOWN
C:\Users\tssmi\OneDrive\Desktop\nlp\processed_audio\audio_323_seg_0.wav,QUALITY EIGHT NINER SIERRA TAXI ZULU HOTEL HOLD SHORT OF LIMA,2.04,2493,UNKNOWN
C:\Users\tssmi\OneDrive\Desktop\nlp\processed_audio\audio_3240_seg_0.wav,CSA FIVE KILO PAPA DESCEND FLIGHT LEVEL NINER ZERO DESCEND FLIGHT LEVEL ONE NINER ZERO CSA FIVE KILO PAPA,3.19,2494,UNKNOWN
C:\Users\tssmi\OneDrive\Desktop\nlp\processed_audio\audio_3241_seg_0.wav,APPROACH HELLO AUSTRIAN SEVEN ZERO SEVEN PAPA ONE FIVE ZERO DESCENDING ONE ONE ZERO INFORMATION NOVEMBER,2.75,2495,UNKNOWN
C:\Users\tssmi\OneDrive\Desktop\nlp\processed_audio\audio_3242_seg_0.wav,TURN RIGHT DIRECT ARTUP CSA FOUR EIGHT ZERO,4.68,2496,UNKNOWN
C:\Users\tssmi\OneDrive\Desktop\nlp\processed_audio\audio_3243_seg_0.wav,DESCENDING FLIGHT LEVEL ONE ZERO ZERO HIGH SPEED APPROVED CHECK OSCAR CSA THREE CHARLIE ZULU,1.85,2497,UNKNOWN
C:\Users\tssmi\OneDrive\Desktop\nlp\processed_audio\audio_3244_seg_0.wav,SIERRA DELTA MIKE TWO TWO TWO PRAHA RADAR RADAR CONTACT CLIMB FLIGHT LEVEL ONE TWO ZERO,2.62,2498,UNKNOWN
C:\Users\tssmi\OneDrive\Desktop\nlp\processed_audio\audio_3245_seg_0.wav,VICTOR ROMEO JULIETT SEVEN HUNDRED DESCEND TO FLIGHT LEVEL THREE FIVE ZERO RATE ONE THOUSAND FIVE HUNDRED OR GREATER,3.0,2499,UNKNOWN
C:\Users\tssmi\OneDrive\Desktop\nlp\processed_audio\audio_3246_seg_0.wav,CSA FIVE CHARLIE TANGO CONTACT RUZYNE RADAR ONE ONE NINER DECIMAL,2.95,2500,UNKNOWN
C:\Users\tssmi\OneDrive\Desktop\nlp\processed_audio\audio_3247_seg_0.wav,TAKEOFF RUNWAY TWO FOUR CSA,1.14,2501,UNKNOWN
C:\Users\tssmi\OneDrive\Desktop\nlp\processed_audio\audio_3248_seg_0.wav,GOOD DAY KLM ONE EIGHT FOUR ZERO PASSING FLIGHT LEVEL TWO FIVE THREE CLIMBING FLIGHT LEVEL TWO EIGHT ZERO,5.32,2502,UNKNOWN
C:\Users\tssmi\OneDrive\Desktop\nlp\processed_audio\audio_324_seg_0.wav,GOLF FIVE TWO ONE VACATE VIA ROMEO EXPEDITE,2.78,2503,UNKNOWN
C:\Users\tssmi\OneDrive\Desktop\nlp\processed_audio\audio_325_seg_0.wav,ONE THREE TWO ONE FIVE FIVE LUFTHANSA CARGO EIGHT FOUR SIX THREE BYE BYE,5.12,2504,UNKNOWN
C:\Users\tssmi\OneDrive\Desktop\nlp\processed_audio\audio_326_seg_0.wav,CSA EIGHT EIGHT ONE,2.308,2505,UNKNOWN
C:\Users\tssmi\OneDrive\Desktop\nlp\processed_audio\audio_327_seg_0.wav,SAY AGAIN,1.8,2506,UNKNOWN
C:\Users\tssmi\OneDrive\Desktop\nlp\processed_audio\audio_328_seg_0.wav,ONE TWO ONE DECIMAL NINER,6.69,2507,UNKNOWN
C:\Users\tssmi\OneDrive\Desktop\nlp\processed_audio\audio_329_seg_0.wav,DESCENDING LEVEL TWO NINER ZERO AIR BERLIN SEVEN,4.39,2508,UNKNOWN
C:\Users\tssmi\OneDrive\Desktop\nlp\processed_audio\audio_32_seg_0.wav,LUFTHANSA TWO FIVE TWO EIGHT SQUAWK ONE FOUR SEVEN TWO CLIMB FLIGHT LEVEL THREE TWO ZERO,3.14,2509,UNKNOWN
C:\Users\tssmi\OneDrive\Desktop\nlp\processed_audio\audio_330_seg_0.wav,DIRECT VENOX CSA FIVE ZERO FOUR,1.04,2510,UNKNOWN
C:\Users\tssmi\OneDrive\Desktop\nlp\processed_audio\audio_331_seg_0.wav,SEVEN FIVE GOOD BYE,4.01,2511,UNKNOWN
C:\Users\tssmi\OneDrive\Desktop\nlp\processed_audio\audio_332_seg_0.wav,CSA FOUR YANKEE ALPHA RUNWAY THREE ONE CLEARED TO LAND WIND ONE NINER ZERO DEGREES TWO KNOTS,3.83,2512,UNKNOWN
C:\Users\tssmi\OneDrive\Desktop\nlp\processed_audio\audio_333_seg_0.wav,OSCAR ECHO MIKE ECHO PAPA PRAHA RADAR RADAR CONTACT CONTACT,4.33,2513,UNKNOWN
C:\Users\tssmi\OneDrive\Desktop\nlp\processed_audio\audio_334_seg_0.wav,ROGER STANDBY,5.19,2514,UNKNOWN
C:\Users\tssmi\OneDrive\Desktop\nlp\processed_audio\audio_335_seg_0.wav,CONTINUE APPROACH CSA FIVE MIKE BRAVO,1.9,2515,UNKNOWN
C:\Users\tssmi\OneDrive\Desktop\nlp\processed_audio\audio_336_seg_0.wav,AEROFLOT ONE FIVE ZERO RADAR RADAR CONTACT CLIMB TO FLIGHT LEVEL ONE SIX ZERO,2.92,2516,UNKNOWN
C:\Users\tssmi\OneDrive\Desktop\nlp\processed_audio\audio_337_seg_0.wav,HELLO AIR MALTA FIVE TWO NINER RUZYNE TOWER ROGER,3.47,2517,UNKNOWN
C:\Users\tssmi\OneDrive\Desktop\nlp\processed_audio\audio_338_seg_0.wav,KLM ONE EIGHT FOUR,4.22,2518,UNKNOWN
C:\Users\tssmi\OneDrive\Desktop\nlp\processed_audio\audio_339_seg_0.wav,LUFTHANSA SEVEN ONE FIVE PROCEED DIRECT LANDU,1.8,2519,UNKNOWN
C:\Users\tssmi\OneDrive\Desktop\nlp\processed_audio\audio_33_seg_0.wav,EASY FOUR SIX ZERO BRAVO CALL PRAHA ONE THREE THREE,4.12,2520,UNKNOWN
C:\Users\tssmi\OneDrive\Desktop\nlp\processed_audio\audio_340_seg_0.wav,PRAHA GOOD DAY KLM ONE EIGHT SEVEN EIGHT MAINTAINING THREE FOUR ZERO INBOUND MAVOR,2.47,2521,UNKNOWN
C:\Users\tssmi\OneDrive\Desktop\nlp\processed_audio\audio_341_seg_0.wav,SIX FOUR ZERO FIVE BLUE TRANSPORT TWO ZERO FIVE BYE BYE,0.95,2522,UNKNOWN
C:\Users\tssmi\OneDrive\Desktop\nlp\processed_audio\audio_342_seg_0.wav,ROGER,3.235,2523,UNKNOWN
C:\Users\tssmi\OneDrive\Desktop\nlp\processed_audio\audio_343_seg_0.wav,DESCENDING FLIGHT LEVEL ONE THREE ZERO SPEED TWO FIVE ZERO KNOTS OR LESS CSA SEVEN TWO SEVEN,4.93,2524,UNKNOWN
C:\Users\tssmi\OneDrive\Desktop\nlp\processed_audio\audio_344_seg_0.wav,EASY EIGHT THREE WHISKEY GOLF DESCEND FLIGHT LEVEL SEVEN ZERO,2.89,2525,UNKNOWN
C:\Users\tssmi\OneDrive\Desktop\nlp\processed_audio\audio_345_seg_0.wav,CLEARED FOR TAKEOFF THREE ONE SKYTRAVEL ONE ZERO ONE ZERO,0.74,2526,UNKNOWN
C:\Users\tssmi\OneDrive\Desktop\nlp\processed_audio\audio_346_seg_0.wav,IF IS ANY CHANCE FOR,2.67,2527,UNKNOWN
C:\Users\tssmi\OneDrive\Desktop\nlp\processed_audio\audio_347_seg_0.wav,LINING UP ONE THREE SKYTRAVEL,5.24,2528,UNKNOWN
C:\Users\tssmi\OneDrive\Desktop\nlp\processed_audio\audio_348_seg_0.wav,PRAHA,1.12,2529,UNKNOWN
C:\Users\tssmi\OneDrive\Desktop\nlp\processed_audio\audio_349_seg_0.wav,TWO FOUR THREE FOUR CLIMBING LEVEL THREE FOUR ZERO,0.76,2530,UNKNOWN
C:\Users\tssmi\OneDrive\Desktop\nlp\processed_audio\audio_34_seg_0.wav,ONE TWO SEVEN EIGHT TWO FIVE BYE,1.854,2531,UNKNOWN
C:\Users\tssmi\OneDrive\Desktop\nlp\processed_audio\audio_350_seg_0.wav,FLIGHT LEVEL ONE SIX ZERO,2.92,2532,UNKNOWN
C:\Users\tssmi\OneDrive\Desktop\nlp\processed_audio\audio_351_seg_0.wav,AND LUFTHANSA NINER ALPHA HOTEL REQUESTING FLIGHT LEVEL THREE FIVE ZERO ROGER STANDBY,2.87,2533,UNKNOWN
C:\Users\tssmi\OneDrive\Desktop\nlp\processed_audio\audio_352_seg_0.wav,CSA THREE SIERRA LIMA REDUCE SPEED TO TWO THREE ZERO KNOTS PREVIOUS TRAFFIC DESCENDING,0.94,2534,UNKNOWN
C:\Users\tssmi\OneDrive\Desktop\nlp\processed_audio\audio_353_seg_0.wav,LOT FIVE TWO SEVEN TRAFFIC INFORMATION ABOUT TWO MILES LEFT OF AXIS RUNWAY THREE ONE THERE IS LOW VFR TRAFFIC,1.74,2535,UNKNOWN
C:\Users\tssmi\OneDrive\Desktop\nlp\processed_audio\audio_354_seg_0.wav,ONE ZERO ZERO CLEARED ILS,7.14,2536,UNKNOWN
C:\Users\tssmi\OneDrive\Desktop\nlp\processed_audio\audio_355_seg_0.wav,PRAHA HELLO FINNAIR EIGHT ZERO FOUR MIKE FLIGHT LEVEL THREE ONE ZERO ON,0.96,2537,UNKNOWN
C:\Users\tssmi\OneDrive\Desktop\nlp\processed_audio\audio_356_seg_0.wav,AEROFLOT ONE TWO FOUR GOOD EVENING RADAR CONTACT ILL CALL YOU,4.86,2538,UNKNOWN
C:\Users\tssmi\OneDrive\Desktop\nlp\processed_audio\audio_357_seg_0.wav,TO LAND RUNWAY THREE ONE TWIN STAR EIGHT EIGHT,5.98,2539,UNKNOWN
C:\Users\tssmi\OneDrive\Desktop\nlp\processed_audio\audio_358_seg_0.wav,BEELINE ONE CHARLIE LIMA DESCEND FLIGHT LEVEL TWO NINER ZERO DESCENDING FLIGHT LEVEL TWO NINER ZERO BEELINE ONE CHARLIE LIMA,0.91,2540,UNKNOWN
C:\Users\tssmi\OneDrive\Desktop\nlp\processed_audio\audio_359_seg_0.wav,LEFT THREE THREE ZERO CLEARED FOR THE ILS CALL YOU AND REDUCING SWISS ONE TWO FOUR BRAVO,4.46,2541,UNKNOWN
C:\Users\tssmi\OneDrive\Desktop\nlp\processed_audio\audio_35_seg_0.wav,AUSTRIAN THREE TWO FIVE GOLF CLIMB FLIGHT LEVEL THREE FOUR ZERO,4.88,2542,UNKNOWN
C:\Users\tssmi\OneDrive\Desktop\nlp\processed_audio\audio_360_seg_0.wav,VIA GOLF ONE TWO ONE NINER,6.22,2543,UNKNOWN
C:\Users\tssmi\OneDrive\Desktop\nlp\processed_audio\audio_361_seg_0.wav,YES SPEED AS PUBLISHED PRESENTLY NUMBER THREE,4.01,2544,UNKNOWN
C:\Users\tssmi\OneDrive\Desktop\nlp\processed_audio\audio_362_seg_0.wav,CONFIRM QNH ONE ZERO ONE NINER,1.36,2545,UNKNOWN
C:\Users\tssmi\OneDrive\Desktop\nlp\processed_audio\audio_363_seg_0.wav,SKY THREE ONE THREE HELLO RADAR CONTACT DIRECT RAPET,2.98,2546,UNKNOWN
C:\Users\tssmi\OneDrive\Desktop\nlp\processed_audio\audio_364_seg_0.wav,BLINE NINER NINER ZERO EIGHT RUZYNE TOWER GOOD AFTERNOON ROGER LINE UP RUNWAY THREE ONE,5.09,2547,UNKNOWN
C:\Users\tssmi\OneDrive\Desktop\nlp\processed_audio\audio_365_seg_0.wav,CROSS ABRACK AT LEVEL TWO NINER ZERO AND CONTACT PRAHA ONE TWO SEVEN DECIMAL ONE TWO FIVE GOOD,0.71,2548,UNKNOWN
C:\Users\tssmi\OneDrive\Desktop\nlp\processed_audio\audio_366_seg_0.wav,SKYTRAVEL ONE ZERO ONE ZERO RUZYNE TOWER GOOD MORNING,2.9,2549,UNKNOWN
C:\Users\tssmi\OneDrive\Desktop\nlp\processed_audio\audio_367_seg_0.wav,CLEARED TO LAND RUNWAY THREE ONE CSA,0.8,2550,UNKNOWN
C:\Users\tssmi\OneDrive\Desktop\nlp\processed_audio\audio_368_seg_0.wav,CSA THREE SEVEN BRAVO DESCEND TO FLIGHT LEVEL ONE ZERO ZERO PLEASE,4.94,2551,UNKNOWN
C:\Users\tssmi\OneDrive\Desktop\nlp\processed_audio\audio_369_seg_0.wav,FOR TAKEOFF BYE BYE,3.87,2552,UNKNOWN
C:\Users\tssmi\OneDrive\Desktop\nlp\processed_audio\audio_36_seg_0.wav,NOR SHUTTLE THREE FIVE EIGHT ONE RUNWAY THREE ONE CLEARED FOR TAKEOFF WIND TWO TWO ZERO DEGREES SIX KNOTS GOOD BYE,8.09,2553,UNKNOWN
C:\Users\tssmi\OneDrive\Desktop\nlp\processed_audio\audio_370_seg_0.wav,LUFTHANSA EIGHT ECHO PAPA CLIMB FLIGHT LEVEL THREE FOUR ZERO,3.34,2554,UNKNOWN
C:\Users\tssmi\OneDrive\Desktop\nlp\processed_audio\audio_371_seg_0.wav,JADE CARGO SEVEN FOUR FOUR THREE PROCEED TO ELMEK,4.4,2555,UNKNOWN
C:\Users\tssmi\OneDrive\Desktop\nlp\processed_audio\audio_372_seg_0.wav,CAN FORCE,0.73,2556,UNKNOWN
C:\Users\tssmi\OneDrive\Desktop\nlp\processed_audio\audio_373_seg_0.wav,TOWER HELLO GERMAN WINGS SEVEN HOTEL READY FOR,5.775,2557,UNKNOWN
C:\Users\tssmi\OneDrive\Desktop\nlp\processed_audio\audio_374_seg_0.wav,ROGER QUALITY EIGHT TWO FIVE BRAVO THANK YOU BYE BYE,1.09,2558,UNKNOWN
C:\Users\tssmi\OneDrive\Desktop\nlp\processed_audio\audio_375_seg_0.wav,LUFTHANSA FIVE ALPHA HOTEL RHEIN ONE THREE THREE TWO EIGHT FIVE GOOD BYE,2.15,2559,UNKNOWN
C:\Users\tssmi\OneDrive\Desktop\nlp\processed_audio\audio_376_seg_0.wav,QNH IS ONE ZERO ONE EIGHT WIND IS ZERO SIX ZERO FIVE KNOTS STANDBY,1.28,2560,UNKNOWN
C:\Users\tssmi\OneDrive\Desktop\nlp\processed_audio\audio_377_seg_0.wav,CSA EIGHT THREE FIVE RUNWAY ONE THREE CLEARED TO LAND WIND ZERO TWO ZERO DEGREES SIX KNOTS,2.22,2561,UNKNOWN
C:\Users\tssmi\OneDrive\Desktop\nlp\processed_audio\audio_378_seg_0.wav,AEROFLOT ONE FOUR NINER RUNWAY THREE ONE CLEARED TO LAND WIND ONE EIGHT ZERO DEGREES THREE KNOTS,2.51,2562,UNKNOWN
C:\Users\tssmi\OneDrive\Desktop\nlp\processed_audio\audio_379_seg_0.wav,ONE THREE FIVE ONE THREE FIVE LUFTHANSA ONE ROMEO PAPA GOOD BYE,5.5,2563,UNKNOWN
C:\Users\tssmi\OneDrive\Desktop\nlp\processed_audio\audio_37_seg_0.wav,LUFTHANSA SEVEN ONE EIGHT HELLO RADAR CONTACT,2.06,2564,UNKNOWN
C:\Users\tssmi\OneDrive\Desktop\nlp\processed_audio\audio_380_seg_0.wav,FOUR MILES AND,5.51,2565,UNKNOWN
C:\Users\tssmi\OneDrive\Desktop\nlp\processed_audio\audio_381_seg_0.wav,LUFTHANSA TWO NOVEMBER MIKE,4.35,2566,UNKNOWN
C:\Users\tssmi\OneDrive\Desktop\nlp\processed_audio\audio_382_seg_0.wav,RUSSIA TWO TWO ONE TURN RIGHT HEADING TWO EIGHT ZERO CLEARED FOR ILS APPROACH RUNWAY THREE ONE REDUCE SPEED TWO ZERO ZERO KNOTS,5.83,2567,UNKNOWN
C:\Users\tssmi\OneDrive\Desktop\nlp\processed_audio\audio_383_seg_0.wav,DESCENDING LEVEL TWO NINER,2.46,2568,UNKNOWN
C:\Users\tssmi\OneDrive\Desktop\nlp\processed_audio\audio_384_seg_0.wav,AND READY,4.61,2569,UNKNOWN
