file_path,transcript,duration,segment_index,speaker_role
C:\Users\tssmi\OneDrive\Desktop\nlp\processed_audio\audio_1620_seg_0.wav,EUROWINGS ONE TANGO KILO RUZYNE TOWER GOOD AFTERNOON GO AHEAD,8.59,690,UNKNOWN
C:\Users\tssmi\OneDrive\Desktop\nlp\processed_audio\audio_1621_seg_0.wav,SYDNEY TOWER QANTAS SIX FORTY TWO,6.77,691,UNKNOWN
C:\Users\tssmi\OneDrive\Desktop\nlp\processed_audio\audio_1622_seg_0.wav,AIR BERLIN NINER NINER,3.35,692,UNKNOWN
C:\Users\tssmi\OneDrive\Desktop\nlp\processed_audio\audio_1623_seg_0.wav,LUFTHANSA EIGHT NOVEMBER ECHO LINING UP THREE ONE AND WAIT,6.41,693,UNKNOWN
C:\Users\tssmi\OneDrive\Desktop\nlp\processed_audio\audio_1624_seg_0.wav,DIRECT BUDEX THANK YOU AUSTRIAN NINER TWO CHARLIE VICTOR,1.95,694,UNKNOWN
C:\Users\tssmi\OneDrive\Desktop\nlp\processed_audio\audio_1625_seg_0.wav,QUALITY NINER ONE ROMEO DESCEND FLIGHT LEVEL SIX ZERO,6.8,695,UNKNOWN
C:\Users\tssmi\OneDrive\Desktop\nlp\processed_audio\audio_1626_seg_0.wav,LANDING ON MY DISCRETION THREE FOUR TWO SIX,1.12,696,UNKNOWN
C:\Users\tssmi\OneDrive\Desktop\nlp\processed_audio\audio_1627_seg_0.wav,HOTEL XRAY QUEBEC ROGER FREQUENCY CHANGE APPROVED TALK TO YOU LATER,1.42,697,UNKNOWN
C:\Users\tssmi\OneDrive\Desktop\nlp\processed_audio\audio_1628_seg_0.wav,CSA ONE DELTA ZULU ROGER CONTACT RUZYNE TOWER ONE THREE FOUR DECIMAL FIVE SIX ZERO,5.165,698,UNKNOWN
C:\Users\tssmi\OneDrive\Desktop\nlp\processed_audio\audio_1629_seg_0.wav,CZECH FORCE FIVE TWO ONE DESCEND FLIGHT LEVEL NINER ZERO,5.32,699,UNKNOWN
C:\Users\tssmi\OneDrive\Desktop\nlp\processed_audio\audio_162_seg_0.wav,CATHAY ZERO SIX EIGHT HELLO RADAR CONTACT,4.92,700,UNKNOWN
C:\Users\tssmi\OneDrive\Desktop\nlp\processed_audio\audio_1630_seg_0.wav,FOUR ZERO GOOD BYE ADRIA NINER THREE WHISKEY,3.21,701,UNKNOWN
C:\Users\tssmi\OneDrive\Desktop\nlp\processed_audio\audio_1631_seg_0.wav,VIA GOLF,2.28,702,UNKNOWN
C:\Users\tssmi\OneDrive\Desktop\nlp\processed_audio\audio_1632_seg_0.wav,CLIMB FLIGHT LEVEL THREE ONE ZERO CZECH HOLIDAYS SEVEN FOUR TWO ZERO,0.92,703,UNKNOWN
C:\Users\tssmi\OneDrive\Desktop\nlp\processed_audio\audio_1633_seg_0.wav,DOWN LEVEL ONE SEVEN ZERO,2.0,704,UNKNOWN
C:\Users\tssmi\OneDrive\Desktop\nlp\processed_audio\audio_1634_seg_0.wav,NOR SHUTTLE ONE FIVE ONE FOUR SPEED ONE SIX ZERO KNOTS TILL FOUR MILES FINAL AND REPORT LOCALIZER ESTABLISHED,3.03,705,UNKNOWN
C:\Users\tssmi\OneDrive\Desktop\nlp\processed_audio\audio_1635_seg_0.wav,LUFTHANSA NINER KILO YANKEE DESCEND,9.08,706,UNKNOWN
C:\Users\tssmi\OneDrive\Desktop\nlp\processed_audio\audio_1636_seg_0.wav,TOWER HELLO SWISS ONE TWO FIVE VICTOR IS,7.25,707,UNKNOWN
C:\Users\tssmi\OneDrive\Desktop\nlp\processed_audio\audio_1637_seg_0.wav,SIERRA PAPA ALPHA VICTOR ALPHA ROGER DESCEND FLIGHT LEVEL ONE TWO ZERO,4.59,708,UNKNOWN
C:\Users\tssmi\OneDrive\Desktop\nlp\processed_audio\audio_1638_seg_0.wav,DONAVIA THREE ZERO FIVE DESCEND TO ALTITUDE FOUR THOUSAND FEET QNH ONE ZERO TWO ONE CLEARED FOR ILS APPROACH RUNWAY THREE ONE,4.72,709,UNKNOWN
C:\Users\tssmi\OneDrive\Desktop\nlp\processed_audio\audio_1639_seg_0.wav,RIGHT TURN RAPET CONTRACT ONE ROMEO GOLF CSA NINER SIX SEVEN DESCEND ALTITUDE FOUR THOUSAND FEET QNH ONE ZERO ONE EIGHT,3.13,710,UNKNOWN
C:\Users\tssmi\OneDrive\Desktop\nlp\processed_audio\audio_163_seg_0.wav,CSA SIX ONE NINER PRESENT HEADING DESCEND FOUR THOUSAND FEET QNH ONE ZERO ONE EIGHT,1.685,711,UNKNOWN
C:\Users\tssmi\OneDrive\Desktop\nlp\processed_audio\audio_1640_seg_0.wav,AIRFRANS ONE THREE TWO RIGHT HEADING,5.22,712,UNKNOWN
C:\Users\tssmi\OneDrive\Desktop\nlp\processed_audio\audio_1641_seg_0.wav,SKYTRAVEL ONE ZERO THREE EIGHT LINE UP RUNWAY THREE ONE LINE UP RUNWAY THREE ONE SKYTRAVEL ONE ZERO THREE EIGHT,4.59,713,UNKNOWN
C:\Users\tssmi\OneDrive\Desktop\nlp\processed_audio\audio_1642_seg_0.wav,LUXAIR FIVE FOUR EIGHT TWO GOOD MORNING ROGER HOLD POSITION,3.82,714,UNKNOWN
C:\Users\tssmi\OneDrive\Desktop\nlp\processed_audio\audio_1643_seg_0.wav,CSA SIX ONE NINER,2.97,715,UNKNOWN
C:\Users\tssmi\OneDrive\Desktop\nlp\processed_audio\audio_1644_seg_0.wav,LUFTHANSA SEVEN ECHO LIMA CONTACT PRAHA RADAR ONE TWO ZERO DECIMAL TWO SEVEN FIVE,4.04,716,UNKNOWN
C:\Users\tssmi\OneDrive\Desktop\nlp\processed_audio\audio_1645_seg_0.wav,CSA FOUR YANKEE ALPHA REDUCE SPEED TO ONE EIGHT ZERO OR LESS,2.55,717,UNKNOWN
C:\Users\tssmi\OneDrive\Desktop\nlp\processed_audio\audio_1646_seg_0.wav,CORRECT AND KLM FIVE FIVE TANGO DIRECT ARVEK,1.142,718,UNKNOWN
C:\Users\tssmi\OneDrive\Desktop\nlp\processed_audio\audio_1647_seg_0.wav,CSA FOUR CHARLIE ZULU LEFT HEADING THREE ONE ZERO,3.555,719,UNKNOWN
C:\Users\tssmi\OneDrive\Desktop\nlp\processed_audio\audio_1648_seg_0.wav,CSA SIX THREE FOUR CLIMB FLIGHT LEVEL NINER ZERO AND,5.04,720,UNKNOWN
C:\Users\tssmi\OneDrive\Desktop\nlp\processed_audio\audio_1649_seg_0.wav,STANDBY,1.94,721,UNKNOWN
C:\Users\tssmi\OneDrive\Desktop\nlp\processed_audio\audio_164_seg_0.wav,ROGER CLIMB TO FLIGHT LEVEL THREE FOUR ZERO NOW,3.34,722,UNKNOWN
C:\Users\tssmi\OneDrive\Desktop\nlp\processed_audio\audio_1650_seg_0.wav,CONTACT VIA ROMEO GOLF CONTACT PRAHA RADAR ONE TWO ZERO DECIMAL TWO SEVEN FIVE GOOD BYE,5.76,723,UNKNOWN
C:\Users\tssmi\OneDrive\Desktop\nlp\processed_audio\audio_1651_seg_0.wav,AIRFRANS TWO FOUR EIGHT TWO RUNWAY ONE THREE CLEARED TO LAND WIND ZERO SIX ZERO SEVEN KNOTS,1.8,724,UNKNOWN
C:\Users\tssmi\OneDrive\Desktop\nlp\processed_audio\audio_1652_seg_0.wav,ONE TWO SEVEN,3.6,725,UNKNOWN
C:\Users\tssmi\OneDrive\Desktop\nlp\processed_audio\audio_1653_seg_0.wav,BEELINE FOUR ZERO VICTOR CONTACT RADAR ONE TWO ZERO DECIMAL TWO SEVEN FIVE GOOD DAY TWO SEVEN FIVE FOUR ZERO VICTOR BYE BYE,2.52,726,UNKNOWN
C:\Users\tssmi\OneDrive\Desktop\nlp\processed_audio\audio_1654_seg_0.wav,FLIGHT LEVEL THREE FOUR ZERO THAI NINER TWO ONE,7.26,727,UNKNOWN
C:\Users\tssmi\OneDrive\Desktop\nlp\processed_audio\audio_1655_seg_0.wav,PAKISTAN SEVEN ZERO NINER PROCEED DIRECT VARIK,1.93,728,UNKNOWN
C:\Users\tssmi\OneDrive\Desktop\nlp\processed_audio\audio_1656_seg_0.wav,PRAHA APPROACH GOOD MORNING HOTEL,4.68,729,UNKNOWN
C:\Users\tssmi\OneDrive\Desktop\nlp\processed_audio\audio_1657_seg_0.wav,AIR BERLIN EIGHT SEVEN VICTOR PROCEED TO DELTA CHARLIE FOUR FIVE SIX,5.815,730,UNKNOWN
C:\Users\tssmi\OneDrive\Desktop\nlp\processed_audio\audio_1658_seg_0.wav,CONTRACT TWO ROMEO GOLF DESCEND FLIGHT LEVEL SEVEN ZERO,5.35,731,UNKNOWN
C:\Users\tssmi\OneDrive\Desktop\nlp\processed_audio\audio_1659_seg_0.wav,SIX EIGHT DESCENDING FLIGHT LEVEL ONE,6.26,732,UNKNOWN
C:\Users\tssmi\OneDrive\Desktop\nlp\processed_audio\audio_165_seg_0.wav,ZULU SUNEXPRESS,3.475,733,UNKNOWN
C:\Users\tssmi\OneDrive\Desktop\nlp\processed_audio\audio_1660_seg_0.wav,ONE TWO FIVE GOOD DAY MIKE SIERRA FOUR,6.51,734,UNKNOWN
C:\Users\tssmi\OneDrive\Desktop\nlp\processed_audio\audio_1661_seg_0.wav,CZECH HOLIDAYS SEVEN FOUR TWO ZERO LINE UP RUNWAY THREE ONE AND YOU ARE CLEARED FOR TAKEOFF WIND ONE FOUR ZERO FIVE KNOTS,5.28,735,UNKNOWN
C:\Users\tssmi\OneDrive\Desktop\nlp\processed_audio\audio_1662_seg_0.wav,SKYTRAVEL SIX SIX ONE TURN LEFT HEADING ONE SIX ZERO,3.55,736,UNKNOWN
C:\Users\tssmi\OneDrive\Desktop\nlp\processed_audio\audio_1663_seg_0.wav,VIA LEFT TURN DIRECT OSCAR,4.34,737,UNKNOWN
C:\Users\tssmi\OneDrive\Desktop\nlp\processed_audio\audio_1664_seg_0.wav,SKYTRAVEL ONE ZERO THREE FOUR PROCEED DIRECT TO RAPET,5.25,738,UNKNOWN
C:\Users\tssmi\OneDrive\Desktop\nlp\processed_audio\audio_1665_seg_0.wav,GOOD MORNING PRAGUE MALAYSIAN NINER FOUR NINER CLIMBING TWO NINER ZERO,4.38,739,UNKNOWN
C:\Users\tssmi\OneDrive\Desktop\nlp\processed_audio\audio_1666_seg_0.wav,AIR BERLIN EIGHT SEVEN VICTOR PRAHA HOW DO YOU READ,4.07,740,UNKNOWN
C:\Users\tssmi\OneDrive\Desktop\nlp\processed_audio\audio_1667_seg_0.wav,CLIMBING LEVEL THREE ONE ZERO CLEARED TO DIRECT PEMUR AEROFLOT ONE TWO TWO,10.0,741,UNKNOWN
C:\Users\tssmi\OneDrive\Desktop\nlp\processed_audio\audio_1667_seg_1.wav,GOOD EVENING AUSTRIAN THREE ZERO FOUR CHARLIE PRAHA RADAR CONTACT DESCEND FLIGHT LEVEL TWO NINER ZERO LEVEL BY ABRACK,5.27,742,UNKNOWN
C:\Users\tssmi\OneDrive\Desktop\nlp\processed_audio\audio_1668_seg_0.wav,EMIRATES ONE FOUR ZERO HEAVY PRAHA RADAR HELLO RADAR CONTACT CLIMB FLIGHT LEVEL ONE TWO ZERO,4.19,743,UNKNOWN
C:\Users\tssmi\OneDrive\Desktop\nlp\processed_audio\audio_1669_seg_0.wav,LUFTHANSA NINER ZERO EIGHT CHARLIE CLEARED TO LAND RUNWAY,4.14,744,UNKNOWN
C:\Users\tssmi\OneDrive\Desktop\nlp\processed_audio\audio_166_seg_0.wav,LUFTHANSA SEVEN EIGHT SEVEN CONTACT PRAHA RADAR ONE TWO ZERO DECIMAL TWO SEVEN FIVE GOOD BYE,5.5,745,UNKNOWN
C:\Users\tssmi\OneDrive\Desktop\nlp\processed_audio\audio_1670_seg_0.wav,RUZYNE TOWER GOOD DAY AUSTRIAN SEVEN ZERO SIX PAPA ON LIMA AUSTRIAN SEVEN ZERO SIX PAPA TOWER GOOD MORNING,4.61,746,UNKNOWN
C:\Users\tssmi\OneDrive\Desktop\nlp\processed_audio\audio_1671_seg_0.wav,FOUR ZERO MILES TO GO,2.34,747,UNKNOWN
C:\Users\tssmi\OneDrive\Desktop\nlp\processed_audio\audio_1672_seg_0.wav,RUZYNE TOWER FOR NOR SHUTTLE ONE FIVE ONE FIVE,7.2,748,UNKNOWN
C:\Users\tssmi\OneDrive\Desktop\nlp\processed_audio\audio_1673_seg_0.wav,STANDBY,1.38,749,UNKNOWN
C:\Users\tssmi\OneDrive\Desktop\nlp\processed_audio\audio_1674_seg_0.wav,SIX FOUR TWO SQUAWK ONE FOUR SEVEN THREE,3.695,750,UNKNOWN
C:\Users\tssmi\OneDrive\Desktop\nlp\processed_audio\audio_1675_seg_0.wav,AUSTRIAN ONE SEVEN FIVE JULIETT HELLO RADAR CONTACT CLIMB FLIGHT LEVEL THREE FOUR ZERO,0.85,751,UNKNOWN
C:\Users\tssmi\OneDrive\Desktop\nlp\processed_audio\audio_1676_seg_0.wav,LOUD AND CLEARED CALL RHEIN ONE TWO EIGHT DECIMAL ZERO SEVEN FIVE BYE,3.72,752,UNKNOWN
C:\Users\tssmi\OneDrive\Desktop\nlp\processed_audio\audio_1677_seg_0.wav,SKYTRAVEL SIX EIGHT TWO DIRECT,0.74,753,UNKNOWN
C:\Users\tssmi\OneDrive\Desktop\nlp\processed_audio\audio_1678_seg_0.wav,LEVEL TWO EIGHT ZERO,5.78,754,UNKNOWN
C:\Users\tssmi\OneDrive\Desktop\nlp\processed_audio\audio_1679_seg_0.wav,AIR MALTA FIVE THREE NINER READY FOR IMMEDIATE DEPARTURE,2.95,755,UNKNOWN
C:\Users\tssmi\OneDrive\Desktop\nlp\processed_audio\audio_167_seg_0.wav,LUFTHANSA SEVEN SEVEN PAPA ONE THREE SIX FOUR ZERO FIVE THANK YOU BYE BYE,7.66,756,UNKNOWN
C:\Users\tssmi\OneDrive\Desktop\nlp\processed_audio\audio_1680_seg_0.wav,KILO KILO DESCENDING,0.96,757,UNKNOWN
C:\Users\tssmi\OneDrive\Desktop\nlp\processed_audio\audio_1681_seg_0.wav,NIKI EIGHT ZERO ONE SEVEN,2.85,758,UNKNOWN
C:\Users\tssmi\OneDrive\Desktop\nlp\processed_audio\audio_1682_seg_0.wav,FLY NIKI EIGHT FOUR NINER ZERO CONTACT PRAHA ONE THREE FOUR DECIMAL FIVE NINER ZERO GOOD,3.24,759,UNKNOWN
C:\Users\tssmi\OneDrive\Desktop\nlp\processed_audio\audio_1683_seg_0.wav,CLIMB FLIGHT LEVEL ONE FOUR ZERO CSA SEVEN,1.19,760,UNKNOWN
C:\Users\tssmi\OneDrive\Desktop\nlp\processed_audio\audio_1684_seg_0.wav,EXPECT HIGHER FROM WIEN IN FOUR MINUTES,4.34,761,UNKNOWN
C:\Users\tssmi\OneDrive\Desktop\nlp\processed_audio\audio_1685_seg_0.wav,CSA FIVE FOUR FOUR LINE UP RUNWAY ONE THREE LINE UP RUNWAY ONE THREE CSA FIVE FOUR FOUR,5.93,762,UNKNOWN
C:\Users\tssmi\OneDrive\Desktop\nlp\processed_audio\audio_1686_seg_0.wav,LUFTHANSA TWO FIVE FOUR ZERO CLIMB FLIGHT LEVEL THREE FOUR ZERO,4.12,763,UNKNOWN
C:\Users\tssmi\OneDrive\Desktop\nlp\processed_audio\audio_1687_seg_0.wav,AT LEAST IN ONE MINUTE,4.38,764,UNKNOWN
C:\Users\tssmi\OneDrive\Desktop\nlp\processed_audio\audio_1688_seg_0.wav,NIKI EIGHT ZERO ONE SIX PRAHA HELLO RADAR CONTACT,2.43,765,UNKNOWN
C:\Users\tssmi\OneDrive\Desktop\nlp\processed_audio\audio_1689_seg_0.wav,PRAHA AIRFRANS ONE NINER EIGHT ROMEO FIVE THOUSAND FEET AIRFRANS ONE NINER EIGHT ROMEO CLIMB FLIGHT LEVEL NINER ZERO,2.4,766,UNKNOWN
C:\Users\tssmi\OneDrive\Desktop\nlp\processed_audio\audio_168_seg_0.wav,PRAGUE CAN YOU CONFIRM THE FREQUENCY FOR LUFTHANSA FOUR CHARLIE KILO,3.84,767,UNKNOWN
C:\Users\tssmi\OneDrive\Desktop\nlp\processed_audio\audio_1690_seg_0.wav,ONE THREE FOUR DECIMAL NINER TWO FIVE GOOD BYE,7.84,768,UNKNOWN
C:\Users\tssmi\OneDrive\Desktop\nlp\processed_audio\audio_1691_seg_0.wav,ONE ZERO TWO ONE CIMBER THREE FIVE TWO FIVE,2.76,769,UNKNOWN
C:\Users\tssmi\OneDrive\Desktop\nlp\processed_audio\audio_1692_seg_0.wav,SKYTRAVEL ONE ZERO THREE SEVEN TO THE RIGHT HEADING ONE ZERO ZERO CLEARED FOR ILS APPROACH RUNWAY ONE THREE,3.64,770,UNKNOWN
C:\Users\tssmi\OneDrive\Desktop\nlp\processed_audio\audio_1693_seg_0.wav,RHEIN ONE THREE THREE DECIMAL TWO EIGHT FIVE,1.21,771,UNKNOWN
C:\Users\tssmi\OneDrive\Desktop\nlp\processed_audio\audio_1694_seg_0.wav,REACH ONE NINER NINER CONTACT BRATISLAVA ONE THREE FOUR DECIMAL FOUR SEVEN FIVE GOOD BYE,0.82,772,UNKNOWN
C:\Users\tssmi\OneDrive\Desktop\nlp\processed_audio\audio_1695_seg_0.wav,DESCENDING FOUR THOUSAND FEET QNH ONE ZERO ONE EIGHT AIRFRANS TWO FOUR EIGHT TWO,1.36,773,UNKNOWN
C:\Users\tssmi\OneDrive\Desktop\nlp\processed_audio\audio_1696_seg_0.wav,AUSTRIAN SEVEN ONE CLIMB FLIGHT LEVEL THREE THREE ZERO,3.18,774,UNKNOWN
C:\Users\tssmi\OneDrive\Desktop\nlp\processed_audio\audio_1697_seg_0.wav,LUFTHANSA FIVE MIKE ECHO DESCEND FLIGHT LEVEL SIX ZERO,6.22,775,UNKNOWN
C:\Users\tssmi\OneDrive\Desktop\nlp\processed_audio\audio_1698_seg_0.wav,THREE ZERO THREE FOUR THREE,2.41,776,UNKNOWN
C:\Users\tssmi\OneDrive\Desktop\nlp\processed_audio\audio_1699_seg_0.wav,LUFTHANSA ONE UNIFORM XRAY CLIMB FLIGHT LEVEL THREE ONE ZERO,7.5,777,UNKNOWN
C:\Users\tssmi\OneDrive\Desktop\nlp\processed_audio\audio_169_seg_0.wav,OSCAR SIERRA JULIETT TURN LEFT HEADING THREE FOUR ZERO CLEARED ILS APPROACH RUNWAY THREE ONE REPORT WHEN ESTABLISHED,2.59,778,UNKNOWN
C:\Users\tssmi\OneDrive\Desktop\nlp\processed_audio\audio_16_seg_0.wav,CSA NINER TWO ONE REDUCE TWO THREE ZERO KNOTS,4.53,779,UNKNOWN
C:\Users\tssmi\OneDrive\Desktop\nlp\processed_audio\audio_1700_seg_0.wav,AFFIRM,3.25,780,UNKNOWN
C:\Users\tssmi\OneDrive\Desktop\nlp\processed_audio\audio_1701_seg_0.wav,CSA ZERO TWO FIVE SORRY RUNWAY ONE THREE IS NOW,2.58,781,UNKNOWN
C:\Users\tssmi\OneDrive\Desktop\nlp\processed_audio\audio_1702_seg_0.wav,CSA TWO EIGHT WHISKEY RESUME OWN NAVIGATION TO,1.62,782,UNKNOWN
C:\Users\tssmi\OneDrive\Desktop\nlp\processed_audio\audio_1703_seg_0.wav,CIMBER ZERO THREE SEVEN CONTACT BRATISLAVA ONE THREE FOUR FOUR SEVEN FIVE GOOD DAY,2.488,783,UNKNOWN
C:\Users\tssmi\OneDrive\Desktop\nlp\processed_audio\audio_1704_seg_0.wav,CSA TWO MIKE DELTA CLIMB TO FLIGHT LEVEL ONE ZERO ZERO AND TURN RIGHT WITH RIGHT TURN RESUME OWN NAVIGATION TO CERNO,4.85,784,UNKNOWN
C:\Users\tssmi\OneDrive\Desktop\nlp\processed_audio\audio_1705_seg_0.wav,LUFTHANSA ONE YANKEE HOTEL PRAHA GOOD EVENING RADAR CONTACT,4.5,785,UNKNOWN
C:\Users\tssmi\OneDrive\Desktop\nlp\processed_audio\audio_1706_seg_0.wav,CSA THREE FOXTROT RUNWAY THREE ONE CLEARED TO LAND WIND ONE FIVE ZERO DEGREES FOUR KNOTS,5.25,786,UNKNOWN
C:\Users\tssmi\OneDrive\Desktop\nlp\processed_audio\audio_1707_seg_0.wav,SPEED TWO TWO ZERO KNOTS DESCENDING FLIGHT LEVEL ONE ZERO ZERO CSA FIVE SIX ONE,1.59,787,UNKNOWN
C:\Users\tssmi\OneDrive\Desktop\nlp\processed_audio\audio_1708_seg_0.wav,OSCAR KILO DELTA SIERRA JULIETT PRAHA HELLO RADAR CONTACT CONFIRM REQUESTED CRUISING LEVEL,2.34,788,UNKNOWN
C:\Users\tssmi\OneDrive\Desktop\nlp\processed_audio\audio_1709_seg_0.wav,ONE ONE EIGHT THREE SEVEN FIVE SIERRA ALPHA ECHO BYE,2.67,789,UNKNOWN
C:\Users\tssmi\OneDrive\Desktop\nlp\processed_audio\audio_170_seg_0.wav,SIX EIGHT,3.75,790,UNKNOWN
C:\Users\tssmi\OneDrive\Desktop\nlp\processed_audio\audio_1710_seg_0.wav,AUSTRIAN SEVEN ONE ONE ZULU TURN LEFT HEADING THREE ONE ZERO,1.43,791,UNKNOWN
C:\Users\tssmi\OneDrive\Desktop\nlp\processed_audio\audio_1711_seg_0.wav,MAY WE EXPECT ANY DELAY,3.83,792,UNKNOWN
C:\Users\tssmi\OneDrive\Desktop\nlp\processed_audio\audio_1712_seg_0.wav,AUSTRIAN NINER THREE CONTACT RHEIN ONE THREE THREE DECIMAL EIGHT,2.39,793,UNKNOWN
C:\Users\tssmi\OneDrive\Desktop\nlp\processed_audio\audio_1713_seg_0.wav,EUROTRANS SIX ZERO ONE ONE CONTACT BRATISLAVA ONE THREE FOUR DECIMAL FOUR SEVEN FIVE GOOD DAY,3.36,794,UNKNOWN
C:\Users\tssmi\OneDrive\Desktop\nlp\processed_audio\audio_1714_seg_0.wav,HEADING TWO SEVEN ZERO EL AL FIVE,0.76,795,UNKNOWN
C:\Users\tssmi\OneDrive\Desktop\nlp\processed_audio\audio_1715_seg_0.wav,CERNO THREE ONE ZERO OR ABOVE AIR BERLIN TWO TWO ZERO ZERO,1.28,796,UNKNOWN
C:\Users\tssmi\OneDrive\Desktop\nlp\processed_audio\audio_1716_seg_0.wav,CSA ZERO TWO FOUR LINE UP RUNWAY THREE ONE,2.84,797,UNKNOWN
C:\Users\tssmi\OneDrive\Desktop\nlp\processed_audio\audio_1717_seg_0.wav,CSA SEVEN SEVEN THREE DESCEND TO FLIGHT LEVEL NINER ZERO,4.9,798,UNKNOWN
C:\Users\tssmi\OneDrive\Desktop\nlp\processed_audio\audio_1718_seg_0.wav,STANDBY,2.91,799,UNKNOWN
C:\Users\tssmi\OneDrive\Desktop\nlp\processed_audio\audio_1719_seg_0.wav,PRAHA RADAR LUFTHANSA TWO FIVE FIVE ZERO PASSING LEVEL TWO THREE THREE CLIMBING LEVEL TWO EIGHT ZERO,1.9,800,UNKNOWN
C:\Users\tssmi\OneDrive\Desktop\nlp\processed_audio\audio_171_seg_0.wav,THANK YOU,2.15,801,UNKNOWN
C:\Users\tssmi\OneDrive\Desktop\nlp\processed_audio\audio_1720_seg_0.wav,ONE THREE THREE THREE NINER ZERO SINGAPORE THREE TWO FIVE CONFIRM,4.28,802,UNKNOWN
C:\Users\tssmi\OneDrive\Desktop\nlp\processed_audio\audio_1721_seg_0.wav,HELI OSCAR BRAVO ARE YOU READY FOR EXPEDITION CROSSING OTHERWISE YOU HAVE TO HOLD ON,2.52,803,UNKNOWN
C:\Users\tssmi\OneDrive\Desktop\nlp\processed_audio\audio_1722_seg_0.wav,AND KLM SEVEN THREE WHISKEY REDUCE SPEED ONE SIX ZERO KNOTS TILL FOUR DME,2.8,804,UNKNOWN
C:\Users\tssmi\OneDrive\Desktop\nlp\processed_audio\audio_1723_seg_0.wav,YES GO AHEAD,5.72,805,UNKNOWN
C:\Users\tssmi\OneDrive\Desktop\nlp\processed_audio\audio_1724_seg_0.wav,HOTEL HOTEL LIMA ECHO WE ARE AT DME APPROACH RUNWAY TWO FOUR CIRCLING ZERO SIX REPORT ESTABLISHED,1.63,806,UNKNOWN
C:\Users\tssmi\OneDrive\Desktop\nlp\processed_audio\audio_1725_seg_0.wav,GO AHEAD,3.79,807,UNKNOWN
C:\Users\tssmi\OneDrive\Desktop\nlp\processed_audio\audio_1726_seg_0.wav,TWO VICTOR CHARLIE LEFT TURN HEADING ZERO SIX,6.03,808,UNKNOWN
C:\Users\tssmi\OneDrive\Desktop\nlp\processed_audio\audio_1727_seg_0.wav,TOWER SPEEDBIRD THREE ZERO CHARLIE READY,3.73,809,UNKNOWN
C:\Users\tssmi\OneDrive\Desktop\nlp\processed_audio\audio_1728_seg_0.wav,LUFTHANSA SIX TANGO ROMEO CONTACT RHEIN ONE THREE THREE DECIMAL TWO EIGHT FIVE,4.71,810,UNKNOWN
C:\Users\tssmi\OneDrive\Desktop\nlp\processed_audio\audio_1729_seg_0.wav,OSCAR BRAVO FOXTROT DESCEND FLIGHT LEVEL ONE THREE ZERO,4.93,811,UNKNOWN
C:\Users\tssmi\OneDrive\Desktop\nlp\processed_audio\audio_172_seg_0.wav,CONTINUE VIA LIMA AND CONTACT GROUND ONE POINT NINER,4.61,812,UNKNOWN
C:\Users\tssmi\OneDrive\Desktop\nlp\processed_audio\audio_1730_seg_0.wav,EMIRATES ONE THREE NINER CONTACT RUZYNE TOWER ONE ONE EIGHT DECIMAL ONE GOOD BYE,1.855,813,UNKNOWN
C:\Users\tssmi\OneDrive\Desktop\nlp\processed_audio\audio_1731_seg_0.wav,AND REPORT READY FOR DEPARTURE ONCE YOUR'RE CLEAR AFTER INBOUND HOTEL DELTA LIMA,3.11,814,UNKNOWN
C:\Users\tssmi\OneDrive\Desktop\nlp\processed_audio\audio_1732_seg_0.wav,SIXTY TILL FOUR AND EIGHTEEN,3.3,815,UNKNOWN
C:\Users\tssmi\OneDrive\Desktop\nlp\processed_audio\audio_1733_seg_0.wav,MIKE ECHO MIKE LIMA INDIA LINE UP RUNWAY THREE ONE AND WAIT,3.13,816,UNKNOWN
C:\Users\tssmi\OneDrive\Desktop\nlp\processed_audio\audio_1734_seg_0.wav,CSA FIVE FOUR FIVE SPEED TWO TWO ZERO NEXT DESCEND IN A MINUTE,2.66,817,UNKNOWN
C:\Users\tssmi\OneDrive\Desktop\nlp\processed_audio\audio_1735_seg_0.wav,INSTRUCTION GOLF RUNWAY ZERO SEVEN QNH ONE ZERO ONE EIGHT TANGO THREE SIX FIVE,0.78,818,UNKNOWN
C:\Users\tssmi\OneDrive\Desktop\nlp\processed_audio\audio_1736_seg_0.wav,CSA FIVE ZERO FOUR BEHIND LANDING TRAFFIC WILL LINE UP RUNWAY THREE ONE BEHIND,1.7,819,UNKNOWN
C:\Users\tssmi\OneDrive\Desktop\nlp\processed_audio\audio_1737_seg_0.wav,TANGO SEVEN CHARLIE LIMA MIKE SION,2.44,820,UNKNOWN
C:\Users\tssmi\OneDrive\Desktop\nlp\processed_audio\audio_1738_seg_0.wav,ROGER STANDBY FOR CLIMB,5.0,821,UNKNOWN
C:\Users\tssmi\OneDrive\Desktop\nlp\processed_audio\audio_1739_seg_0.wav,FOUR THOUSAND BY ONE ZERO ONE EIGHT MALEV EIGHT,2.78,822,UNKNOWN
C:\Users\tssmi\OneDrive\Desktop\nlp\processed_audio\audio_173_seg_0.wav,GERMAN WINGS SEVEN PAPA DESCEND FLIGHT LEVEL ONE ZERO ZERO,3.6,823,UNKNOWN
C:\Users\tssmi\OneDrive\Desktop\nlp\processed_audio\audio_1740_seg_0.wav,EMIRATES NINER NINER EIGHT SEVEN CONTACT RHEIN ONE THREE THREE DECIMAL EIGHT SIX ZERO GOOD BYE,4.33,824,UNKNOWN
C:\Users\tssmi\OneDrive\Desktop\nlp\processed_audio\audio_1741_seg_0.wav,LUFTHANSA FIVE PAPA JULIETT ONE THREE ONE ZERO FIVE FIVE BYE BYE,7.86,825,UNKNOWN
C:\Users\tssmi\OneDrive\Desktop\nlp\processed_audio\audio_1742_seg_0.wav,MALEV EIGHT TWO FOUR ILS ESTABLISHED RUNWAY ONE THREE,4.0,826,UNKNOWN
C:\Users\tssmi\OneDrive\Desktop\nlp\processed_audio\audio_1743_seg_0.wav,LEVEL ZERO NINER ZERO BYE BYE LUFTHANSA FOUR YANKEE MIKE,2.58,827,UNKNOWN
C:\Users\tssmi\OneDrive\Desktop\nlp\processed_audio\audio_1744_seg_0.wav,GOOD EVENING LUFTHANSA EIGHT HOTEL ROMEO PASSING TWO THOUSAND FIVE HUNDRED CLIMBING FIVE THOUSAND,2.77,828,UNKNOWN
C:\Users\tssmi\OneDrive\Desktop\nlp\processed_audio\audio_1745_seg_0.wav,HOTEL GOLF BRAVO STRAIGHT IN TWO FIVE NUMBER ONE,2.33,829,UNKNOWN
C:\Users\tssmi\OneDrive\Desktop\nlp\processed_audio\audio_1746_seg_0.wav,HOTEL YANKEE XRAY MAKE ONE ORBIT TO THE LEFT REPORT COMPLETED,2.23,830,UNKNOWN
C:\Users\tssmi\OneDrive\Desktop\nlp\processed_audio\audio_1747_seg_0.wav,ALPHA CLEARED LEVEL IS TWO,0.76,831,UNKNOWN
C:\Users\tssmi\OneDrive\Desktop\nlp\processed_audio\audio_1748_seg_0.wav,CSA NINER TWO TWO LINE UP RUNWAY THREE ONE,2.68,832,UNKNOWN
C:\Users\tssmi\OneDrive\Desktop\nlp\processed_audio\audio_1749_seg_0.wav,CONDOR FIVE TWO TWO PRAHA HELLO RADAR CONTACT CLIMB FLIGHT LEVEL THREE THREE ZERO,1.705,833,UNKNOWN
C:\Users\tssmi\OneDrive\Desktop\nlp\processed_audio\audio_174_seg_0.wav,FRACTION FIVE SEVEN SIX HOTEL DESCEND TO FOUR THOUSAND FEET CLEARED ARP APPROACH RUNWAY ONE FOUR REPORT AIRBORNE TRACK ESTABLISHED,2.62,834,UNKNOWN
C:\Users\tssmi\OneDrive\Desktop\nlp\processed_audio\audio_1750_seg_0.wav,PRAHA LUFTHANSA FOUR JULIETT ALPHA,2.23,835,UNKNOWN
C:\Users\tssmi\OneDrive\Desktop\nlp\processed_audio\audio_1751_seg_0.wav,SINGAPORE,6.61,836,UNKNOWN
C:\Users\tssmi\OneDrive\Desktop\nlp\processed_audio\audio_1752_seg_0.wav,POINT THREE ONE,4.53,837,UNKNOWN
C:\Users\tssmi\OneDrive\Desktop\nlp\processed_audio\audio_1753_seg_0.wav,AIRFRANS ONE ZERO EIGHT ZULU,2.81,838,UNKNOWN
C:\Users\tssmi\OneDrive\Desktop\nlp\processed_audio\audio_1754_seg_0.wav,HOTEL SIERRA FOUR DESCEND FLIGHT LEVEL TWO NINER ZERO,3.74,839,UNKNOWN
C:\Users\tssmi\OneDrive\Desktop\nlp\processed_audio\audio_1755_seg_0.wav,LUFTHANSA NINER ALPHA FOXTROT DESCEND FLIGHT LEVEL TWO NINER ZERO,1.11,840,UNKNOWN
C:\Users\tssmi\OneDrive\Desktop\nlp\processed_audio\audio_1756_seg_0.wav,HOTEL OSCAR FOXTROT FREQUENCY CHANGE APPROVED,1.8,841,UNKNOWN
C:\Users\tssmi\OneDrive\Desktop\nlp\processed_audio\audio_1757_seg_0.wav,MOSQUITO ONE FIVE BRAVO CORRECT AND KEEP AN EYES FOR GLIDER ACTIVITY NORTH OF THE FIELD,0.76,842,UNKNOWN
C:\Users\tssmi\OneDrive\Desktop\nlp\processed_audio\audio_1758_seg_0.wav,GOOD AFTERNOON VICTOR PAPA BRAVO DELTA XRAY PRAHA RADAR CONTACT,1.17,843,UNKNOWN
C:\Users\tssmi\OneDrive\Desktop\nlp\processed_audio\audio_1759_seg_0.wav,RUNWAY THREE FOUR LEFT CLEARED TO LAND QUANTAS ONE FORTY SIX,2.52,844,UNKNOWN
C:\Users\tssmi\OneDrive\Desktop\nlp\processed_audio\audio_175_seg_0.wav,HI THREE TWO CLEARED TAKEOFF SWISS AMBULANCE SIX ONE,3.53,845,UNKNOWN
C:\Users\tssmi\OneDrive\Desktop\nlp\processed_audio\audio_1760_seg_0.wav,DESCENDING FLIGHT LEVEL ONE THREE ZERO FOR THREE ONE CSA THREE MIKE ZULU,0.98,846,UNKNOWN
C:\Users\tssmi\OneDrive\Desktop\nlp\processed_audio\audio_1761_seg_0.wav,LUFTHANSA SEVEN ONE FOUR ONE FOUR SIX ONE IS COMING DOWN,4.23,847,UNKNOWN
C:\Users\tssmi\OneDrive\Desktop\nlp\processed_audio\audio_1762_seg_0.wav,RIGHT TURNS DIRECT TO KOLAD LUFTHANSA NINER ECHO LIMA THANK YOU WELCOME,0.78,848,UNKNOWN
C:\Users\tssmi\OneDrive\Desktop\nlp\processed_audio\audio_1763_seg_0.wav,HOTEL BRAVO SIERRA CHARLIE TANGO BERN TOWER HELLO TAXI VIA KILO TO TERMINAL NORTH,3.07,849,UNKNOWN
C:\Users\tssmi\OneDrive\Desktop\nlp\processed_audio\audio_1764_seg_0.wav,HOTEL BRAVO GOLF KILO ECHO ONE FOUR THOUSAND FEET,2.31,850,UNKNOWN
C:\Users\tssmi\OneDrive\Desktop\nlp\processed_audio\audio_1765_seg_0.wav,GOOD AFTERNOON AIRFRANS ONE NINER EIGHT,4.68,851,UNKNOWN
C:\Users\tssmi\OneDrive\Desktop\nlp\processed_audio\audio_1766_seg_0.wav,MALAYSIAN SIX PRAHA GOOD MORNING RADAR CONTACT DESCEND FLIGHT LEVEL THREE HUNDRED CROSS RAPET AT LEVEL,2.79,852,UNKNOWN
C:\Users\tssmi\OneDrive\Desktop\nlp\processed_audio\audio_1767_seg_0.wav,SEVEN SEVEN ZERO GOOD NIGHT,5.32,853,UNKNOWN
C:\Users\tssmi\OneDrive\Desktop\nlp\processed_audio\audio_1768_seg_0.wav,RADAR GROSJET SEVEN WHISKEY CONFIRM FLIGHT LEVEL ONE SIX ZERO,1.07,854,UNKNOWN
C:\Users\tssmi\OneDrive\Desktop\nlp\processed_audio\audio_1769_seg_0.wav,ONE THREE FIVE ONE CAN YOU SAY IT AGAIN,1.08,855,UNKNOWN
C:\Users\tssmi\OneDrive\Desktop\nlp\processed_audio\audio_176_seg_0.wav,OSCAR KILO KILO UNIFORM NOVEMBER PROCEED DIRECT BALTU,4.91,856,UNKNOWN
C:\Users\tssmi\OneDrive\Desktop\nlp\processed_audio\audio_1770_seg_0.wav,NAV CHECKER FIVE ONE ONE GO AROUND CLIMBING FIVE SEVEN THOUSAND FEET,4.67,857,UNKNOWN
C:\Users\tssmi\OneDrive\Desktop\nlp\processed_audio\audio_1771_seg_0.wav,SWISS AMBULANCE SIX ONE WIND ZERO THREE ZERO DEGREES FOUR KNOTS RUNWAY THREE TWO CLEARED TAKEOFF,3.21,858,UNKNOWN
C:\Users\tssmi\OneDrive\Desktop\nlp\processed_audio\audio_1772_seg_0.wav,RUNWAY ONE SIX RIGHT CLEARED TO LAND JETSTAR FIVE ZERO EIGHT,5.2,859,UNKNOWN
C:\Users\tssmi\OneDrive\Desktop\nlp\processed_audio\audio_1773_seg_0.wav,TOWER LUFTHANSA NINER LIMA CHARLIE HELLO WE ARE READY,2.1,860,UNKNOWN
C:\Users\tssmi\OneDrive\Desktop\nlp\processed_audio\audio_1774_seg_0.wav,ONE CSA FIVE ZERO NINER,2.65,861,UNKNOWN
C:\Users\tssmi\OneDrive\Desktop\nlp\processed_audio\audio_1775_seg_0.wav,QATARI SIX ZERO TWO THREE WHEN READY DESCEND FLIGHT LEVEL THREE ZERO ZERO REACH LEVEL BY RAPET,5.48,862,UNKNOWN
