file_path,transcript,duration,segment_index,speaker_role
C:\Users\tssmi\OneDrive\Desktop\nlp\processed_audio\audio_2388_seg_0.wav,COPIED THAT THANK YOU LOT THREE ZERO SIX CONTACT PRAHA ONE TWO SEVEN DECIMAL ONE TWO FIVE GOOD BYE,5.96,1544,UNKNOWN
C:\Users\tssmi\OneDrive\Desktop\nlp\processed_audio\audio_2389_seg_0.wav,SPEED ONE NINER ZERO TIMEAIR SIX ONE TWO PAPA,3.24,1545,UNKNOWN
C:\Users\tssmi\OneDrive\Desktop\nlp\processed_audio\audio_238_seg_0.wav,LUFTHANSA SIX KILO VICTOR CALL MUNICH ONE THREE TWO POINT ONE FIVE FIVE GOOD BYE TWO EIGHT ZERO,2.45,1546,UNKNOWN
C:\Users\tssmi\OneDrive\Desktop\nlp\processed_audio\audio_2390_seg_0.wav,YANKEE LEVEL,6.71,1547,UNKNOWN
C:\Users\tssmi\OneDrive\Desktop\nlp\processed_audio\audio_2391_seg_0.wav,CSA SEVEN THREE CHARLIE RUNWAY THREE ONE THREE CLEARED TO LAND WIND ZERO TWO ZERO DEGREES NINER KNOTS,6.49,1548,UNKNOWN
C:\Users\tssmi\OneDrive\Desktop\nlp\processed_audio\audio_2392_seg_0.wav,AND TOWER SKYTRAVEL ONE ONE NINER TWO,1.96,1549,UNKNOWN
C:\Users\tssmi\OneDrive\Desktop\nlp\processed_audio\audio_2393_seg_0.wav,OSCAR KILO KILO UNIFORM NOVEMBER,2.31,1550,UNKNOWN
C:\Users\tssmi\OneDrive\Desktop\nlp\processed_audio\audio_2394_seg_0.wav,EXPECT RUNWAY THREE ONE FOR DEPARTURE,2.32,1551,UNKNOWN
C:\Users\tssmi\OneDrive\Desktop\nlp\processed_audio\audio_2395_seg_0.wav,EMIRATES ONE ZERO PRAHA RADAR GOOD EVENING RADAR CONTACT NEW SQUAWK ONE FOUR SEVEN FOUR,2.62,1552,UNKNOWN
C:\Users\tssmi\OneDrive\Desktop\nlp\processed_audio\audio_2396_seg_0.wav,DESCEND FLIGHT LEVEL TWO NINER ZERO CSA THREE SIERRA LIMA MAY WE DESCEND WHEN READY,4.2,1553,UNKNOWN
C:\Users\tssmi\OneDrive\Desktop\nlp\processed_audio\audio_2397_seg_0.wav,DELTA INDIA KILO ALPHA HOTEL DESCEND FLIGHT LEVEL TWO NINER ZERO,7.06,1554,UNKNOWN
C:\Users\tssmi\OneDrive\Desktop\nlp\processed_audio\audio_2398_seg_0.wav,PRAHA GOOD EVENING SPEEDBIRD ONE FIVE FLIGHT LEVEL THREE THREE ZERO REACHING,2.93,1555,UNKNOWN
C:\Users\tssmi\OneDrive\Desktop\nlp\processed_audio\audio_2399_seg_0.wav,LUFTHANSA ONE KILO KILO RIGHT TURN,5.96,1556,UNKNOWN
C:\Users\tssmi\OneDrive\Desktop\nlp\processed_audio\audio_239_seg_0.wav,REDUCING SPEED ONE FIFTY CSA FIVE VICTOR PAPA,4.02,1557,UNKNOWN
C:\Users\tssmi\OneDrive\Desktop\nlp\processed_audio\audio_23_seg_0.wav,DIRECT TO SOPAV AND SQUAWK ONE FOUR SEVEN FOUR THAI NINER THREE ONE,1.42,1558,UNKNOWN
C:\Users\tssmi\OneDrive\Desktop\nlp\processed_audio\audio_2400_seg_0.wav,NOR SHUTTLE ONE FIVE ZERO THREE HELLO RUZYNE TOWER ARE YOU READY,4.77,1559,UNKNOWN
C:\Users\tssmi\OneDrive\Desktop\nlp\processed_audio\audio_2401_seg_0.wav,LUFTHANSA THREE CHARLIE HOTEL DESCEND FLIGHT LEVEL TWO NINER ZERO,4.2,1560,UNKNOWN
C:\Users\tssmi\OneDrive\Desktop\nlp\processed_audio\audio_2402_seg_0.wav,CSA TWO SEVEN ZERO CONTACT PRAHA RADAR ONE TWO SEVEN DECIMAL EIGHT TWO,6.65,1561,UNKNOWN
C:\Users\tssmi\OneDrive\Desktop\nlp\processed_audio\audio_2403_seg_0.wav,ONE TWO ONE DECIMAL NINER CSA,5.59,1562,UNKNOWN
C:\Users\tssmi\OneDrive\Desktop\nlp\processed_audio\audio_2404_seg_0.wav,TWO EIGHTY MAXIMUM,1.97,1563,UNKNOWN
C:\Users\tssmi\OneDrive\Desktop\nlp\processed_audio\audio_2405_seg_0.wav,TWINSTAR EIGHT EIGHT SEVEN PROCEED DIRECT ARVEK,1.62,1564,UNKNOWN
C:\Users\tssmi\OneDrive\Desktop\nlp\processed_audio\audio_2406_seg_0.wav,CSA TWO ZULU ALPHA DESCEND FLIGHT LEVEL NINER ZERO CONTACT RUZYNE RADAR ONE ONE NINER ZERO,2.33,1565,UNKNOWN
C:\Users\tssmi\OneDrive\Desktop\nlp\processed_audio\audio_2407_seg_0.wav,ROGER CLIMB FLIGHT LEVEL THREE FOUR ZERO REQUEST CLIMB FOUR ZERO ZERO IF AVAILABLE ROGER,2.91,1566,UNKNOWN
C:\Users\tssmi\OneDrive\Desktop\nlp\processed_audio\audio_2408_seg_0.wav,TO HOTEL,3.2,1567,UNKNOWN
C:\Users\tssmi\OneDrive\Desktop\nlp\processed_audio\audio_2409_seg_0.wav,LUFTHANSA FOUR HOTEL HOTEL PRAHA CORRECTION LUFTHANSA EIGHT HOTEL HOTEL PRAHA MORNING RADAR CONTACT CLIMB FLIGHT LEVEL THREE HUNDRED,3.51,1568,UNKNOWN
C:\Users\tssmi\OneDrive\Desktop\nlp\processed_audio\audio_240_seg_0.wav,BYE BYE,3.92,1569,UNKNOWN
C:\Users\tssmi\OneDrive\Desktop\nlp\processed_audio\audio_2410_seg_0.wav,PASSING THREE THOUSAND CLIMBING FIVE THOUSAND,2.51,1570,UNKNOWN
C:\Users\tssmi\OneDrive\Desktop\nlp\processed_audio\audio_2411_seg_0.wav,TWIN STAR EIGHT EIGHT SEVEN RUNWAY THREE ONE CLEARED TO LAND WIND ONE FOUR ZERO DEGREES FOUR KNOTS,0.96,1571,UNKNOWN
C:\Users\tssmi\OneDrive\Desktop\nlp\processed_audio\audio_2412_seg_0.wav,GERMAN WINGS SEVEN FIVE FIVE PRAHA HELLO RADAR CONTACT STANDBY FOR CLIMB,3.6,1572,UNKNOWN
C:\Users\tssmi\OneDrive\Desktop\nlp\processed_audio\audio_2413_seg_0.wav,CSA,4.58,1573,UNKNOWN
C:\Users\tssmi\OneDrive\Desktop\nlp\processed_audio\audio_2414_seg_0.wav,BYE BYE,4.47,1574,UNKNOWN
C:\Users\tssmi\OneDrive\Desktop\nlp\processed_audio\audio_2415_seg_0.wav,RUZYNE TOWER EASY SIX EIGHT KILO PAPA GOOD EVENING TAXIING FOXTROT ONE THREE READY HELLO EASY SIX EIGHT KILO PAPA RUZYNE TOWER STOP AT HOLDING POINT NUMBER TWO,1.11,1575,UNKNOWN
C:\Users\tssmi\OneDrive\Desktop\nlp\processed_audio\audio_2416_seg_0.wav,HELICOPTER APPROACHING AIRFIELD FROM THE NORTH NOT CROSSING AXIS OF RUNWAY THREE ONE,4.32,1576,UNKNOWN
C:\Users\tssmi\OneDrive\Desktop\nlp\processed_audio\audio_2417_seg_0.wav,RYANAIR SEVEN FOUR ZULU FOXTROT HELLO PRAHA RADAR CONTACT DESCEND FLIGHT LEVEL TWO NINER ZERO,2.43,1577,UNKNOWN
C:\Users\tssmi\OneDrive\Desktop\nlp\processed_audio\audio_2418_seg_0.wav,CSA FOUR BRAVO ECHO LINE UP RUNWAY THREE ONE LINING UP RUNWAY THREE ONE CSA FOUR BRAVO ECHO,3.09,1578,UNKNOWN
C:\Users\tssmi\OneDrive\Desktop\nlp\processed_audio\audio_2419_seg_0.wav,CZECH AIR FORCE FIVE TWO ONE DESCEND FLIGHT LEVEL TWO NINER ZERO,2.33,1579,UNKNOWN
C:\Users\tssmi\OneDrive\Desktop\nlp\processed_audio\audio_241_seg_0.wav,EMIRATES NINER NINER EIGHT SEVEN HELLO RADAR CONTACT PROCEED TO VARIK,2.89,1580,UNKNOWN
C:\Users\tssmi\OneDrive\Desktop\nlp\processed_audio\audio_2420_seg_0.wav,THREE THREE DECIMAL THREE SIX ZERO EUROTRANS,2.62,1581,UNKNOWN
C:\Users\tssmi\OneDrive\Desktop\nlp\processed_audio\audio_2421_seg_0.wav,EMIRATES FOUR PRAHA ROGER CLIMB TO FLIGHT LEVEL THREE NINER ZERO,1.34,1582,UNKNOWN
C:\Users\tssmi\OneDrive\Desktop\nlp\processed_audio\audio_2422_seg_0.wav,AUSTRIAN SEVEN ZERO EIGHT PAPA ROGER,3.69,1583,UNKNOWN
C:\Users\tssmi\OneDrive\Desktop\nlp\processed_audio\audio_2423_seg_0.wav,LUFTHANSA SEVEN EIGHT SEVEN WE HAVE TWO,4.44,1584,UNKNOWN
C:\Users\tssmi\OneDrive\Desktop\nlp\processed_audio\audio_2424_seg_0.wav,SEVEN FIVE EIGHT ONE TWO FIVE NINER SIX FIVE,2.57,1585,UNKNOWN
C:\Users\tssmi\OneDrive\Desktop\nlp\processed_audio\audio_2425_seg_0.wav,LEAVING LEVEL THREE FIVE ZERO FOR LEVEL TWO NINER ZERO TO BE LEVEL AT ABRACK AUSTRIAN ONE SEVEN TWO PAPA,2.64,1586,UNKNOWN
C:\Users\tssmi\OneDrive\Desktop\nlp\processed_audio\audio_2426_seg_0.wav,EASY SIX SEVEN KILO PAPA RUZYNE TOWER GOOD AFTERNOON RUNWAY ONE THREE CLEARED TO LAND WIND ZERO TWO ZERO DEGREES FIVE KNOTS,2.26,1587,UNKNOWN
C:\Users\tssmi\OneDrive\Desktop\nlp\processed_audio\audio_2427_seg_0.wav,RUSSIA TWO FIVE SEVEN DESCEND FLIGHT LEVEL TWO NINER ZERO,1.55,1588,UNKNOWN
C:\Users\tssmi\OneDrive\Desktop\nlp\processed_audio\audio_2428_seg_0.wav,SIERRA PAPA SIERRA DESCEND FLIGHT LEVEL SEVEN ZERO,5.48,1589,UNKNOWN
C:\Users\tssmi\OneDrive\Desktop\nlp\processed_audio\audio_2429_seg_0.wav,PASSING FLIGHT LEVEL TWO SEVEN ZERO CLIMBING FLIGHT LEVEL TWO NINER ZERO,4.59,1590,UNKNOWN
C:\Users\tssmi\OneDrive\Desktop\nlp\processed_audio\audio_242_seg_0.wav,DESCEND FLIGHT LEVEL ONE ZERO ZERO,2.91,1591,UNKNOWN
C:\Users\tssmi\OneDrive\Desktop\nlp\processed_audio\audio_2430_seg_0.wav,TWO SEVEN,3.25,1592,UNKNOWN
C:\Users\tssmi\OneDrive\Desktop\nlp\processed_audio\audio_2431_seg_0.wav,RUNWAY ONE THREE CLEARED TO LAND CSA ZERO TWO FIVE,2.6,1593,UNKNOWN
C:\Users\tssmi\OneDrive\Desktop\nlp\processed_audio\audio_2432_seg_0.wav,PRAGUE RADAR OSCAR KILO DELTA SIERRA JULIETT GOOD MORNING CLIMBING FLIGHT LEVEL TWO EIGHT ZERO INBOUND CERNO,5.23,1594,UNKNOWN
C:\Users\tssmi\OneDrive\Desktop\nlp\processed_audio\audio_2433_seg_0.wav,EASY NINER CHARLIE LIMA TURN LEFT HEADING ZERO FOUR ZERO,2.97,1595,UNKNOWN
C:\Users\tssmi\OneDrive\Desktop\nlp\processed_audio\audio_2434_seg_0.wav,LEVEL THREE FIVE,5.36,1596,UNKNOWN
C:\Users\tssmi\OneDrive\Desktop\nlp\processed_audio\audio_2435_seg_0.wav,FOUR FIVE TWO,2.735,1597,UNKNOWN
C:\Users\tssmi\OneDrive\Desktop\nlp\processed_audio\audio_2436_seg_0.wav,THREE FIVE ONE THREE FIVE THREE WHISKEY WHISKEY TO PRAHA,2.39,1598,UNKNOWN
C:\Users\tssmi\OneDrive\Desktop\nlp\processed_audio\audio_2437_seg_0.wav,THREE ONE THREE MALEV EIGHT TWO FIVE,2.638,1599,UNKNOWN
C:\Users\tssmi\OneDrive\Desktop\nlp\processed_audio\audio_2438_seg_0.wav,AIRFRANS ONE ZERO EIGHT TWO RUNWAY ONE THREE CLEARED TO LAND WIND ONE FIVE ZERO DEGREES THREE KNOTS CLEARED TO LAND ON RUNWAY ONE THREE AIRFRANS ONE ZERO EIGHT,6.76,1600,UNKNOWN
C:\Users\tssmi\OneDrive\Desktop\nlp\processed_audio\audio_2439_seg_0.wav,LUFTHANSA SIX TANGO ROMEO EXPECT FURTHER CLIMB IN FEW MINUTES FROM RHEIN CONTROL,2.31,1601,UNKNOWN
C:\Users\tssmi\OneDrive\Desktop\nlp\processed_audio\audio_243_seg_0.wav,EMIRATES FOUR DIRECT NARKA DIRECT NARKA EMIRATES FOUR,1.13,1602,UNKNOWN
C:\Users\tssmi\OneDrive\Desktop\nlp\processed_audio\audio_2440_seg_0.wav,LUFTHANSA SIX JULIETT TANGO ONE THREE THREE THREE NINER ZERO BYE BYE,5.78,1603,UNKNOWN
C:\Users\tssmi\OneDrive\Desktop\nlp\processed_audio\audio_2441_seg_0.wav,CSA SEVEN FIVE EIGHT LINE UP,1.91,1604,UNKNOWN
C:\Users\tssmi\OneDrive\Desktop\nlp\processed_audio\audio_2442_seg_0.wav,CSA SEVEN ZERO TWO RUNWAY ONE THREE CLEARED FOR TAKEOFF WIND ZERO SIX ZERO DEGREES,0.73,1605,UNKNOWN
C:\Users\tssmi\OneDrive\Desktop\nlp\processed_audio\audio_2443_seg_0.wav,WHISKEY GOLF PAPA,6.12,1606,UNKNOWN
C:\Users\tssmi\OneDrive\Desktop\nlp\processed_audio\audio_2444_seg_0.wav,CONTINUE CLIMB TO FLIGHT LEVEL THREE FOUR ZERO OSCAR SIERRA JULIETT,3.76,1607,UNKNOWN
C:\Users\tssmi\OneDrive\Desktop\nlp\processed_audio\audio_2445_seg_0.wav,GOOD AFTERNOON HOTEL ZULU MIKE FOXTROT THREE RUZYNE TOWER CONTINUE APPROACH NUMBER THREE,2.41,1608,UNKNOWN
C:\Users\tssmi\OneDrive\Desktop\nlp\processed_audio\audio_2446_seg_0.wav,LUFTHANSA FIVE MIKE ECHO RUNWAY THREE ONE CLEARED TO LAND WIND ONE EIGHT ZERO DEGREES THREE KNOTS,3.29,1609,UNKNOWN
C:\Users\tssmi\OneDrive\Desktop\nlp\processed_audio\audio_2447_seg_0.wav,LUFTHANSA SIX,2.6,1610,UNKNOWN
C:\Users\tssmi\OneDrive\Desktop\nlp\processed_audio\audio_2448_seg_0.wav,PRAHA THAI NINER TWO TWO GOOD EVENING DESCEND LEVEL THREE FIVE ZERO,3.56,1611,UNKNOWN
C:\Users\tssmi\OneDrive\Desktop\nlp\processed_audio\audio_2449_seg_0.wav,GERMANIA SEVEN SIX FOUR FOUR CLIMB FLIGHT LEVEL THREE ONE ZERO,1.48,1612,UNKNOWN
C:\Users\tssmi\OneDrive\Desktop\nlp\processed_audio\audio_244_seg_0.wav,SPEEDBIRD EIGHT FIVE FIVE LINE UP RUNWAY THREE ONE AND WAIT,1.61,1613,UNKNOWN
C:\Users\tssmi\OneDrive\Desktop\nlp\processed_audio\audio_2450_seg_0.wav,HOTEL ECHO XRAY WIND CALM RUNWAY TWO FIVE CLEARED TOUCH AND GO,2.87,1614,UNKNOWN
C:\Users\tssmi\OneDrive\Desktop\nlp\processed_audio\audio_2451_seg_0.wav,WELL THERE'S MARCHALL ON IT'S WAY AND IN ZURICH IT IS HANDLED LIKE THIS ALL THE TIME BUT IT'S ANY SECOND WITH YOU,2.69,1615,UNKNOWN
C:\Users\tssmi\OneDrive\Desktop\nlp\processed_audio\audio_2452_seg_0.wav,FLIGHT LEVEL ONE SIX ZERO FLIGHT LEVEL ONE SIX,1.5,1616,UNKNOWN
C:\Users\tssmi\OneDrive\Desktop\nlp\processed_audio\audio_2453_seg_0.wav,HOTEL XRAY,5.36,1617,UNKNOWN
C:\Users\tssmi\OneDrive\Desktop\nlp\processed_audio\audio_2454_seg_0.wav,RUNWAY TWO FIVE CLEARED TOUCH AND GO HOTEL ECHO XRAY,1.67,1618,UNKNOWN
C:\Users\tssmi\OneDrive\Desktop\nlp\processed_audio\audio_2455_seg_0.wav,CZECH HOLIDAY SEVEN FOUR TWO ONE HELLO PRAHA RADAR CONTACT,0.78,1619,UNKNOWN
C:\Users\tssmi\OneDrive\Desktop\nlp\processed_audio\audio_2456_seg_0.wav,DREAM TEAM FOUR ZERO FOUR KILO TAXI CHARLIE LIMA AND QUEBEC BEHIND FOLLOW ME CAR TO STAND SIERRA THREE,6.42,1620,UNKNOWN
C:\Users\tssmi\OneDrive\Desktop\nlp\processed_audio\audio_2457_seg_0.wav,EUROTRANS SIX EIGHT ZERO TWO CLIMB FLIGHT LEVEL TWO NINER ZERO EUROTRANS SIX EIGHT ZERO CLIMBING TWO NINER ZERO INITIALLY,2.69,1621,UNKNOWN
C:\Users\tssmi\OneDrive\Desktop\nlp\processed_audio\audio_2458_seg_0.wav,SPEED ONE SIXTY TILL FOUR AND RUZYNE TOWER ONE ONE EIGHT DECIMAL ONE GOOD BYE,2.44,1622,UNKNOWN
C:\Users\tssmi\OneDrive\Desktop\nlp\processed_audio\audio_2459_seg_0.wav,RUZYNE TOWER GOOD EVENING AEROFLOT ONE FOUR THREE ILS ESTABLISHED RUNWAY ONE THREE AEROFLOT ONE FOUR THREE GOOD EVENING CONTINUE APPROACH,2.06,1623,UNKNOWN
C:\Users\tssmi\OneDrive\Desktop\nlp\processed_audio\audio_245_seg_0.wav,HOTEL ECHO XRAY NUMBER ONE RUNWAY TWO FIVE,2.33,1624,UNKNOWN
C:\Users\tssmi\OneDrive\Desktop\nlp\processed_audio\audio_2460_seg_0.wav,GERMAN CARGO FIVE THREE ZERO NEW SQUAWK ONE FOUR FIVE ZERO AND CLIMB FLIGHT LEVEL THREE HUNDRED TO ROMIS,2.17,1625,UNKNOWN
C:\Users\tssmi\OneDrive\Desktop\nlp\processed_audio\audio_2461_seg_0.wav,ILS THREE ONE,2.88,1626,UNKNOWN
C:\Users\tssmi\OneDrive\Desktop\nlp\processed_audio\audio_2462_seg_0.wav,DIRECT TO PADKA SINGAPORE,3.69,1627,UNKNOWN
C:\Users\tssmi\OneDrive\Desktop\nlp\processed_audio\audio_2463_seg_0.wav,DESCEND FLIGHT LEVEL ONE THREE ZERO PROCEED DIRECT TO SOMIS HIGHER SPEED,3.48,1628,UNKNOWN
C:\Users\tssmi\OneDrive\Desktop\nlp\processed_audio\audio_2464_seg_0.wav,REDUCING SPEED ONE SEVEN ZERO KNOTS TO FOUR MILE AND TOWER ONE ONE EIGHT ONE AUSTRIAN SEVEN ZERO THREE,3.23,1629,UNKNOWN
C:\Users\tssmi\OneDrive\Desktop\nlp\processed_audio\audio_2465_seg_0.wav,EASY TWO FOUR SEVEN FOXTROT REPORT REQUESTED FLIGHT LEVEL,5.74,1630,UNKNOWN
C:\Users\tssmi\OneDrive\Desktop\nlp\processed_audio\audio_2466_seg_0.wav,CSA SIX NINER ZERO PASSING ONE THOUSAND,5.57,1631,UNKNOWN
C:\Users\tssmi\OneDrive\Desktop\nlp\processed_audio\audio_2467_seg_0.wav,ROGER,3.87,1632,UNKNOWN
C:\Users\tssmi\OneDrive\Desktop\nlp\processed_audio\audio_2468_seg_0.wav,LUFTHANSA THREE ROMEO KILO CLEARED TO LAND ONE,4.41,1633,UNKNOWN
C:\Users\tssmi\OneDrive\Desktop\nlp\processed_audio\audio_2469_seg_0.wav,ONE THREE THREE THREE NINER ZERO THREE TWO NINER GOOD BYE,3.77,1634,UNKNOWN
C:\Users\tssmi\OneDrive\Desktop\nlp\processed_audio\audio_246_seg_0.wav,GOOD EVENING EUROTRANS ONE THREE JULIETT STARTUP AND PUSH BACK APPROVED POSITION TO FOXTROT SQUAWK FOUR FOUR TWO FIVE,2.84,1635,UNKNOWN
C:\Users\tssmi\OneDrive\Desktop\nlp\processed_audio\audio_2470_seg_0.wav,SYDNEY TOWER GOOD DAY CHINA EASTERN SEVEN FIVE SIX ONE ESTABLISH OUR LOCALIZER RUNWAY ONE SIX RIGHT,2.93,1636,UNKNOWN
C:\Users\tssmi\OneDrive\Desktop\nlp\processed_audio\audio_2471_seg_0.wav,WERE LOOKING FOR THREE SEVEN ZERO AT THE MOMENT CSA NINER TWO TWO ROGER,1.31,1637,UNKNOWN
C:\Users\tssmi\OneDrive\Desktop\nlp\processed_audio\audio_2472_seg_0.wav,CLEARED TAKEOFF RUNWAY ONE THREE SKYTRAVEL ONE ZERO THREE,2.19,1638,UNKNOWN
C:\Users\tssmi\OneDrive\Desktop\nlp\processed_audio\audio_2473_seg_0.wav,LUFTHANSA FIVE ALPHA HOTEL CLIMB FLIGHT LEVEL THREE ONE ZERO,0.79,1639,UNKNOWN
C:\Users\tssmi\OneDrive\Desktop\nlp\processed_audio\audio_2474_seg_0.wav,LOT FIVE TWO FIVE TO THE LEFT HEADING TWO ZERO ZERO HEADING TWO HUNDRED LOT FIVE TWO FIVE,1.55,1640,UNKNOWN
C:\Users\tssmi\OneDrive\Desktop\nlp\processed_audio\audio_2475_seg_0.wav,AEROFLOT ONE FIVE ZERO PLEASE CONFIRM WE ARE CLEARED TO LINE UP VIA ROMEO,2.35,1641,UNKNOWN
C:\Users\tssmi\OneDrive\Desktop\nlp\processed_audio\audio_2476_seg_0.wav,SKYTRAVEL SIX EIGHT TWO CLIMB FLIGHT LEVEL THREE FIVE ZERO,0.93,1642,UNKNOWN
C:\Users\tssmi\OneDrive\Desktop\nlp\processed_audio\audio_2477_seg_0.wav,JETSTAR FOUR ZERO NINER APPROVED ROUTE TO BRAVO FOUR,5.26,1643,UNKNOWN
C:\Users\tssmi\OneDrive\Desktop\nlp\processed_audio\audio_2478_seg_0.wav,FOUR DOUBLE ECHO DESCENDING FLIGHT LEVEL THREE FIVE ZERO TO OSCAR KILO FOXTROT,2.62,1644,UNKNOWN
C:\Users\tssmi\OneDrive\Desktop\nlp\processed_audio\audio_2479_seg_0.wav,SQUAWK FIVE ONE SEVEN SIX,4.66,1645,UNKNOWN
C:\Users\tssmi\OneDrive\Desktop\nlp\processed_audio\audio_247_seg_0.wav,SIX SEVEN FOUR SIX,3.47,1646,UNKNOWN
C:\Users\tssmi\OneDrive\Desktop\nlp\processed_audio\audio_2480_seg_0.wav,ONE TWO SEVEN ONE TWO FIVE RYANAIR SIX SEVEN TWO EIGHT THANK YOU BYE BYE,4.39,1647,UNKNOWN
C:\Users\tssmi\OneDrive\Desktop\nlp\processed_audio\audio_2481_seg_0.wav,LOT THREE SIX TWO SQUAWK ONE FOUR SIX SIX CLIMB FLIGHT LEVEL THREE THREE ZERO,3.05,1648,UNKNOWN
C:\Users\tssmi\OneDrive\Desktop\nlp\processed_audio\audio_2482_seg_0.wav,PRAHA RADAR GOOD MORNING ASTERIX FOUR,0.86,1649,UNKNOWN
C:\Users\tssmi\OneDrive\Desktop\nlp\processed_audio\audio_2483_seg_0.wav,QUALITY FOUR ZERO EIGHT NINER TURANY TOWER GOOD MORNING RUNWAY ZERO NINER CLEARED TO LAND WIND IS CALM,4.55,1650,UNKNOWN
C:\Users\tssmi\OneDrive\Desktop\nlp\processed_audio\audio_2484_seg_0.wav,SKYTRAVEL ONE ZERO THREE NINER WE,1.06,1651,UNKNOWN
C:\Users\tssmi\OneDrive\Desktop\nlp\processed_audio\audio_2485_seg_0.wav,AEROFLOT ONE FOUR NINER DESCEND FIVE THOUSAND FEET QNH ONE ZERO TWO TWO,2.06,1652,UNKNOWN
C:\Users\tssmi\OneDrive\Desktop\nlp\processed_audio\audio_2486_seg_0.wav,LUFTHANSA FOUR NOVEMBER LIMA DIRECT TO KOLAD,2.3,1653,UNKNOWN
C:\Users\tssmi\OneDrive\Desktop\nlp\processed_audio\audio_2487_seg_0.wav,QATARI ZERO TWO MIKE ON TAXIWAY JULIETT CROSS RUNWAY ONE ZERO CONTACT APRON ONE TWO ONE DECIMAL SEVEN FIVE FIVE GOOD BYE,3.43,1654,UNKNOWN
C:\Users\tssmi\OneDrive\Desktop\nlp\processed_audio\audio_2488_seg_0.wav,PROCEEDING CSA SIX TWO THREE,3.38,1655,UNKNOWN
C:\Users\tssmi\OneDrive\Desktop\nlp\processed_audio\audio_2489_seg_0.wav,CSA NINER ONE EIGHT TAXI HOLDING POINT RUNWAY TWO FOUR TO THE RIGHT VIA DELTA BRAVO,2.17,1656,UNKNOWN
C:\Users\tssmi\OneDrive\Desktop\nlp\processed_audio\audio_248_seg_0.wav,CSA SEVEN ZERO TWO CLIMB FLIGHT LEVEL ONE SIX ZERO CLIMBING FLIGHT LEVEL ONE SIX ZERO CSA SEVEN ZERO TWO,10.0,1657,UNKNOWN
C:\Users\tssmi\OneDrive\Desktop\nlp\processed_audio\audio_248_seg_1.wav,TANGO THREE SIX FIVE ENTERING VAL D'HEREN FOUR THOUSAND THREE HUNDRED FEET CLIMBING QNH ONE ZERO ONE SEVEN SIX,4.51,1658,UNKNOWN
C:\Users\tssmi\OneDrive\Desktop\nlp\processed_audio\audio_2490_seg_0.wav,AIR BERLIN EIGHT SEVEN VICTOR CONTACT MUNICH ONE TWO FIVE DECIMAL SIX TWO FIVE,3.19,1659,UNKNOWN
C:\Users\tssmi\OneDrive\Desktop\nlp\processed_audio\audio_2491_seg_0.wav,HOTEL GOLF SIERRA AFTER ECHO ONE JOIN RIGHT HAND BASE RUNWAY THREE TWO AS NUMBER ONE AND EXPECT LEFT HAND CIRCUIT,2.26,1660,UNKNOWN
C:\Users\tssmi\OneDrive\Desktop\nlp\processed_audio\audio_2492_seg_0.wav,OK DESCEND FOUR THOUSAND FEET QNH ONE ZERO ONE EIGHT AND DESCEND,0.96,1661,UNKNOWN
C:\Users\tssmi\OneDrive\Desktop\nlp\processed_audio\audio_2493_seg_0.wav,AEROFLOT ONE TWO THREE LEAVING TWO FOUR ZERO LEVEL TWO NINER ZERO,3.61,1662,UNKNOWN
C:\Users\tssmi\OneDrive\Desktop\nlp\processed_audio\audio_2494_seg_0.wav,OSCAR SIERRA JULIETT CONTACT PRAHA ONE THREE THREE DECIMAL THREE NINER ZERO,5.43,1663,UNKNOWN
C:\Users\tssmi\OneDrive\Desktop\nlp\processed_audio\audio_2495_seg_0.wav,ROGER CONTINUE APPROACH EXPECT TO LAND VACATE GOLF DYNASTY ZERO FIVE ONE,5.54,1664,UNKNOWN
C:\Users\tssmi\OneDrive\Desktop\nlp\processed_audio\audio_2496_seg_0.wav,EASY THREE ZERO SIX FIVE RUNWAY ONE THREE CLEARED TO LAND WIND ZERO SIX ZERO SEVEN KNOTS,2.5,1665,UNKNOWN
C:\Users\tssmi\OneDrive\Desktop\nlp\processed_audio\audio_2497_seg_0.wav,SIX ONE TWO PAPA EXPECT SHORTCUT IN FIVE OR SIX MINUTES,4.09,1666,UNKNOWN
C:\Users\tssmi\OneDrive\Desktop\nlp\processed_audio\audio_2498_seg_0.wav,SLOVAK GOVERNMENT ZERO ZERO FOUR INFORMATION MIKE TIME FIVE SEVEN QNH ONE ZERO ZERO EIGHT CLEARED TO KOSICE FROM RUNWAY ONE THREE VIA NITRA ONE YANKEE DEPARTURE INITIALLY CLIMB ALTITUDE FIVE THOUSAND FEET STARTUP APPROVED SQUAWK SIX SEVEN FOUR SIX,4.49,1667,UNKNOWN
C:\Users\tssmi\OneDrive\Desktop\nlp\processed_audio\audio_2499_seg_0.wav,NAV CHECKER FIVE ONE ONE ROGER QNH ONE ZERO ONE SEVEN REPORTED IN AND GO,6.39,1668,UNKNOWN
C:\Users\tssmi\OneDrive\Desktop\nlp\processed_audio\audio_249_seg_0.wav,COPY SEVEN SEVEN TAXI ON ZULU AND BRAVO HOLD SHORT RUNWAY ONE SIX,3.4,1669,UNKNOWN
C:\Users\tssmi\OneDrive\Desktop\nlp\processed_audio\audio_24_seg_0.wav,LOT THREE NINER PAPA PROCEED TO AGAVA SQUAWK ONE FOUR FIVE TWO,0.74,1670,UNKNOWN
C:\Users\tssmi\OneDrive\Desktop\nlp\processed_audio\audio_2500_seg_0.wav,CLIMBING FLIGHT LEVEL NINER ZERO CSA SEVEN FOUR TWO,2.87,1671,UNKNOWN
C:\Users\tssmi\OneDrive\Desktop\nlp\processed_audio\audio_2501_seg_0.wav,QATARI SIX ZERO FIVE SIX HELLO RADAR CONTACT SQUAWK FIVE ONE SEVEN FOUR FIVE ONE SEVEN FOUR QATARI SIX ZERO FIVE SIX,2.34,1672,UNKNOWN
C:\Users\tssmi\OneDrive\Desktop\nlp\processed_audio\audio_2502_seg_0.wav,REDUCING ONE SIXTY,5.515,1673,UNKNOWN
C:\Users\tssmi\OneDrive\Desktop\nlp\processed_audio\audio_2503_seg_0.wav,VIA DELTA AND GROUND TWO ONE NINER BYE BYE SEVENAIR EIGHT FIVE ZERO ZERO,2.54,1674,UNKNOWN
C:\Users\tssmi\OneDrive\Desktop\nlp\processed_audio\audio_2504_seg_0.wav,BRITAIR NINER ZERO TWO,3.69,1675,UNKNOWN
C:\Users\tssmi\OneDrive\Desktop\nlp\processed_audio\audio_2505_seg_0.wav,TANGO THREE THREE ONE NUMBER ONE IS NOW ON THE RIGHT BASE,1.2,1676,UNKNOWN
C:\Users\tssmi\OneDrive\Desktop\nlp\processed_audio\audio_2506_seg_0.wav,LOMKI,0.82,1677,UNKNOWN
C:\Users\tssmi\OneDrive\Desktop\nlp\processed_audio\audio_2507_seg_0.wav,THAI NINER TWO ZERO PRAHA GOOD MORNING RADAR CONTACT DESCEND TO FLIGHT LEVEL THREE ZERO ZERO REACH LEVEL BY RAPET,1.95,1678,UNKNOWN
C:\Users\tssmi\OneDrive\Desktop\nlp\processed_audio\audio_2508_seg_0.wav,AIR BERLIN EIGHT SEVEN VICTOR PRAHA HELLO RADAR CONTACT,2.52,1679,UNKNOWN
C:\Users\tssmi\OneDrive\Desktop\nlp\processed_audio\audio_2509_seg_0.wav,ROGER,5.93,1680,UNKNOWN
C:\Users\tssmi\OneDrive\Desktop\nlp\processed_audio\audio_250_seg_0.wav,EXPECT CLIMB IN TWO MINUTES OPPOSITE TRAFFIC,3.15,1681,UNKNOWN
C:\Users\tssmi\OneDrive\Desktop\nlp\processed_audio\audio_2510_seg_0.wav,RUNWAY ONE SIX RIGHT CLEARED TO LAND QANTAS SEVENTY SEVEN ZERO ONE,1.7,1682,UNKNOWN
C:\Users\tssmi\OneDrive\Desktop\nlp\processed_audio\audio_2511_seg_0.wav,CLEARED TO LINE UP RUNWAY,0.76,1683,UNKNOWN
C:\Users\tssmi\OneDrive\Desktop\nlp\processed_audio\audio_2512_seg_0.wav,SPEEDBIRD EIGHT SIX ZERO CONTACT RUZYNE GROUND ONE TWO ONE DECIMAL NINER BYE BYE,4.66,1684,UNKNOWN
C:\Users\tssmi\OneDrive\Desktop\nlp\processed_audio\audio_2513_seg_0.wav,EIGHTEEN ONE CIMBER THREE FIVE TWO FIVE CSA FOUR NINER THREE DESCEND ALTITUDE FOUR THOUSAND FEET QNH ONE ZERO TWO ONE,3.83,1685,UNKNOWN
C:\Users\tssmi\OneDrive\Desktop\nlp\processed_audio\audio_2514_seg_0.wav,ONE THREE FOUR FOUR SEVEN FIVE ARIANA SEVEN ZERO THREE GOOD BYE,1.11,1686,UNKNOWN
C:\Users\tssmi\OneDrive\Desktop\nlp\processed_audio\audio_2515_seg_0.wav,TOWER HELLO AGAIN AIR PORTUGAL NINER TWO SIX APPROACHING RIGHT TWO EIGHT KILO,1.66,1687,UNKNOWN
C:\Users\tssmi\OneDrive\Desktop\nlp\processed_audio\audio_2516_seg_0.wav,HOTEL ECHO XRAY DOWNWIND TWO FIVE FOR TOUCH AND GO,3.85,1688,UNKNOWN
C:\Users\tssmi\OneDrive\Desktop\nlp\processed_audio\audio_2517_seg_0.wav,BAIR NINER FIVE ONE STAND BY CALL YOU BACK,2.78,1689,UNKNOWN
C:\Users\tssmi\OneDrive\Desktop\nlp\processed_audio\audio_2518_seg_0.wav,EMIRATES ONE THREE NINER TAXI VIA FOXTROT CROSS RUNWAY ONE TWO GOLF JULIETT STAND ONE FOUR ALPHA,1.39,1690,UNKNOWN
C:\Users\tssmi\OneDrive\Desktop\nlp\processed_audio\audio_2519_seg_0.wav,HOTEL CHARLIE PAPA BELOW FLIGHT LEVEL ONE HUNDRED,2.84,1691,UNKNOWN
C:\Users\tssmi\OneDrive\Desktop\nlp\processed_audio\audio_251_seg_0.wav,WIND TWO FIVE ZERO DEGREES TWO TWO KNOTS RUNWAY TWO FIVE CLEARED TO LAND,2.46,1692,UNKNOWN
C:\Users\tssmi\OneDrive\Desktop\nlp\processed_audio\audio_2520_seg_0.wav,TO EVENING,2.88,1693,UNKNOWN
C:\Users\tssmi\OneDrive\Desktop\nlp\processed_audio\audio_2521_seg_0.wav,SIX ZERO,3.49,1694,UNKNOWN
C:\Users\tssmi\OneDrive\Desktop\nlp\processed_audio\audio_2522_seg_0.wav,ONE THREE FOUR EIGHT SEVEN FIVE,2.64,1695,UNKNOWN
C:\Users\tssmi\OneDrive\Desktop\nlp\processed_audio\audio_2523_seg_0.wav,NAV CHECKER FIVE ONE ONE TOWER HELLO AGAIN REPORT GOING AROUND,0.91,1696,UNKNOWN
C:\Users\tssmi\OneDrive\Desktop\nlp\processed_audio\audio_2524_seg_0.wav,LUFTHANSA EIGHT HOTEL HOTEL SQUAWK ONE FOUR SEVEN THREE CONTACT PRAHA ONE THREE THREE POINT THREE NINER ZERO GOOD BYE,4.31,1697,UNKNOWN
C:\Users\tssmi\OneDrive\Desktop\nlp\processed_audio\audio_2525_seg_0.wav,HOTEL GOLF PAPA FREQUENCY CHANGE APPROVED GOOD BYE,3.3,1698,UNKNOWN
C:\Users\tssmi\OneDrive\Desktop\nlp\processed_audio\audio_2526_seg_0.wav,FOXTROT LIMA DELTA SION BONJOUR QNH ONE ZERO TWO THREE WIND CALM RUNWAY TWO FIVE CLEARED FOR TAKEOFF REPORT NOVEMBER WHISKEY,2.85,1699,UNKNOWN
C:\Users\tssmi\OneDrive\Desktop\nlp\processed_audio\audio_2527_seg_0.wav,NOR SHUTTLE ONE FIVE ONE FOUR TURN RIGHT HEADING TWO ONE ZERO,1.39,1700,UNKNOWN
C:\Users\tssmi\OneDrive\Desktop\nlp\processed_audio\audio_2528_seg_0.wav,LOOKING OUT FOR A TRAFFIC OSCAR MIKE KILO LIMA LIMA,1.36,1701,UNKNOWN
C:\Users\tssmi\OneDrive\Desktop\nlp\processed_audio\audio_2529_seg_0.wav,LOOKING OUT HOTEL OSCAR DELTA,0.88,1702,UNKNOWN
C:\Users\tssmi\OneDrive\Desktop\nlp\processed_audio\audio_252_seg_0.wav,CLEARED TO LAND RUNWAY ONE FOUR DELTA HOTEL GOLF,3.44,1703,UNKNOWN
C:\Users\tssmi\OneDrive\Desktop\nlp\processed_audio\audio_2530_seg_0.wav,ROGER JUST TRAFFIC IS ON YOUR ELEVEN O'CLOCK ONE MILE,2.03,1704,UNKNOWN
C:\Users\tssmi\OneDrive\Desktop\nlp\processed_audio\audio_2531_seg_0.wav,ROGER HOTEL FOXTROT KILO REPORT WHISKEY QNH ONE ZERO TWO THREE,2.06,1705,UNKNOWN
C:\Users\tssmi\OneDrive\Desktop\nlp\processed_audio\audio_2532_seg_0.wav,DESCENDING FLIGHT LEVEL ONE ZERO ZERO KEEP SPEED,1.39,1706,UNKNOWN
C:\Users\tssmi\OneDrive\Desktop\nlp\processed_audio\audio_2533_seg_0.wav,ROGER START AND PUSH APPROVED,5.54,1707,UNKNOWN
C:\Users\tssmi\OneDrive\Desktop\nlp\processed_audio\audio_2534_seg_0.wav,AT FLIGHT LEVEL ONE ZERO ZERO NO SPEED RESTRICTIONS AND,5.68,1708,UNKNOWN
C:\Users\tssmi\OneDrive\Desktop\nlp\processed_audio\audio_2535_seg_0.wav,BEAIR ONE FOUR ZERO INTERCEPT LOCALIZER RUNWAY THREE ONE,7.095,1709,UNKNOWN
