segment_index,duration,file_path,speaker_role,stress_score,transcript,alert_level,alert_reason
835,2.23,C:\Users\tssmi\OneDrive\Desktop\nlp\processed_audio\audio_1750_seg_0.wav,UNKNOWN,37.79404666043347,PRAHA LUFTHANSA FOUR JULIETT ALPHA,Routine,
836,6.61,C:\Users\tssmi\OneDrive\Desktop\nlp\processed_audio\audio_1751_seg_0.wav,UNKNOWN,54.63620264429898,SINGAPORE,Routine,
837,4.53,C:\Users\tssmi\OneDrive\Desktop\nlp\processed_audio\audio_1752_seg_0.wav,UNKNOWN,36.41286121803235,POINT THREE ONE,Routine,
838,2.81,C:\Users\tssmi\OneDrive\Desktop\nlp\processed_audio\audio_1753_seg_0.wav,UNKNOWN,77.74051653756025,AIRFRANS ONE ZERO EIGHT ZULU,Elevated Risk,High Stress (Score: 77)
839,3.74,C:\Users\tssmi\OneDrive\Desktop\nlp\processed_audio\audio_1754_seg_0.wav,UNKNOWN,42.0475288864491,HOTEL SIERRA FOUR DESCEND FLIGHT LEVEL TWO NINER ZERO,Minor Anomaly,Potential Communication Hesitation/Anomaly
840,1.11,C:\Users\tssmi\OneDrive\Desktop\nlp\processed_audio\audio_1755_seg_0.wav,UNKNOWN,25.378694352658197,LUFTHANSA NINER ALPHA FOXTROT DESCEND FLIGHT LEVEL TWO NINER ZERO,Routine,
841,1.8,C:\Users\tssmi\OneDrive\Desktop\nlp\processed_audio\audio_1756_seg_0.wav,UNKNOWN,86.41033567664456,HOTEL OSCAR FOXTROT FREQUENCY CHANGE APPROVED,EMERGENCY,Severe Stress Spike (Score: 86)
842,0.76,C:\Users\tssmi\OneDrive\Desktop\nlp\processed_audio\audio_1757_seg_0.wav,UNKNOWN,74.58714336036786,MOSQUITO ONE FIVE BRAVO CORRECT AND KEEP AN EYES FOR GLIDER ACTIVITY NORTH OF THE FIELD,Elevated Risk,High Stress (Score: 74)
843,1.17,C:\Users\tssmi\OneDrive\Desktop\nlp\processed_audio\audio_1758_seg_0.wav,UNKNOWN,34.31908242041378,GOOD AFTERNOON VICTOR PAPA BRAVO DELTA XRAY PRAHA RADAR CONTACT,Routine,
844,2.52,C:\Users\tssmi\OneDrive\Desktop\nlp\processed_audio\audio_1759_seg_0.wav,UNKNOWN,36.06129287507133,RUNWAY THREE FOUR LEFT CLEARED TO LAND QUANTAS ONE FORTY SIX,Routine,
845,3.53,C:\Users\tssmi\OneDrive\Desktop\nlp\processed_audio\audio_175_seg_0.wav,UNKNOWN,7.096108516594221,HI THREE TWO CLEARED TAKEOFF SWISS AMBULANCE SIX ONE,Routine,
846,0.98,C:\Users\tssmi\OneDrive\Desktop\nlp\processed_audio\audio_1760_seg_0.wav,UNKNOWN,32.87234422795908,DESCENDING FLIGHT LEVEL ONE THREE ZERO FOR THREE ONE CSA THREE MIKE ZULU,Routine,
847,4.23,C:\Users\tssmi\OneDrive\Desktop\nlp\processed_audio\audio_1761_seg_0.wav,UNKNOWN,11.430758379276142,LUFTHANSA SEVEN ONE FOUR ONE FOUR SIX ONE IS COMING DOWN,Routine,
848,0.78,C:\Users\tssmi\OneDrive\Desktop\nlp\processed_audio\audio_1762_seg_0.wav,UNKNOWN,55.80241381249804,RIGHT TURNS DIRECT TO KOLAD LUFTHANSA NINER ECHO LIMA THANK YOU WELCOME,Routine,
849,3.07,C:\Users\tssmi\OneDrive\Desktop\nlp\processed_audio\audio_1763_seg_0.wav,UNKNOWN,18.198697783540798,HOTEL BRAVO SIERRA CHARLIE TANGO BERN TOWER HELLO TAXI VIA KILO TO TERMINAL NORTH,Minor Anomaly,Potential Communication Hesitation/Anomaly
850,2.31,C:\Users\tssmi\OneDrive\Desktop\nlp\processed_audio\audio_1764_seg_0.wav,UNKNOWN,41.08854722048927,HOTEL BRAVO GOLF KILO ECHO ONE FOUR THOUSAND FEET,Routine,
851,4.68,C:\Users\tssmi\OneDrive\Desktop\nlp\processed_audio\audio_1765_seg_0.wav,UNKNOWN,27.55675117701693,GOOD AFTERNOON AIRFRANS ONE NINER EIGHT,Routine,
852,2.79,C:\Users\tssmi\OneDrive\Desktop\nlp\processed_audio\audio_1766_seg_0.wav,UNKNOWN,39.13461655200992,MALAYSIAN SIX PRAHA GOOD MORNING RADAR CONTACT DESCEND FLIGHT LEVEL THREE HUNDRED CROSS RAPET AT LEVEL,Routine,
853,5.32,C:\Users\tssmi\OneDrive\Desktop\nlp\processed_audio\audio_1767_seg_0.wav,UNKNOWN,10.472073850123708,SEVEN SEVEN ZERO GOOD NIGHT,Routine,
854,1.07,C:\Users\tssmi\OneDrive\Desktop\nlp\processed_audio\audio_1768_seg_0.wav,UNKNOWN,54.46992083522584,RADAR GROSJET SEVEN WHISKEY CONFIRM FLIGHT LEVEL ONE SIX ZERO,Routine,
855,1.08,C:\Users\tssmi\OneDrive\Desktop\nlp\processed_audio\audio_1769_seg_0.wav,UNKNOWN,100.0,ONE THREE FIVE ONE CAN YOU SAY IT AGAIN,EMERGENCY,Severe Stress Spike (Score: 100)
856,4.91,C:\Users\tssmi\OneDrive\Desktop\nlp\processed_audio\audio_176_seg_0.wav,UNKNOWN,28.86862757358513,OSCAR KILO KILO UNIFORM NOVEMBER PROCEED DIRECT BALTU,Routine,
857,4.67,C:\Users\tssmi\OneDrive\Desktop\nlp\processed_audio\audio_1770_seg_0.wav,UNKNOWN,6.113346376751998,NAV CHECKER FIVE ONE ONE GO AROUND CLIMBING FIVE SEVEN THOUSAND FEET,Routine,
858,3.21,C:\Users\tssmi\OneDrive\Desktop\nlp\processed_audio\audio_1771_seg_0.wav,UNKNOWN,95.99016848542296,SWISS AMBULANCE SIX ONE WIND ZERO THREE ZERO DEGREES FOUR KNOTS RUNWAY THREE TWO CLEARED TAKEOFF,EMERGENCY,Severe Stress Spike (Score: 95)
859,5.2,C:\Users\tssmi\OneDrive\Desktop\nlp\processed_audio\audio_1772_seg_0.wav,UNKNOWN,31.951357621193612,RUNWAY ONE SIX RIGHT CLEARED TO LAND JETSTAR FIVE ZERO EIGHT,Routine,
860,2.1,C:\Users\tssmi\OneDrive\Desktop\nlp\processed_audio\audio_1773_seg_0.wav,UNKNOWN,60.98026315323892,TOWER LUFTHANSA NINER LIMA CHARLIE HELLO WE ARE READY,Routine,
861,2.65,C:\Users\tssmi\OneDrive\Desktop\nlp\processed_audio\audio_1774_seg_0.wav,UNKNOWN,53.771783515869856,ONE CSA FIVE ZERO NINER,Routine,
862,5.48,C:\Users\tssmi\OneDrive\Desktop\nlp\processed_audio\audio_1775_seg_0.wav,UNKNOWN,28.921379401757736,QATARI SIX ZERO TWO THREE WHEN READY DESCEND FLIGHT LEVEL THREE ZERO ZERO REACH LEVEL BY RAPET,Routine,
863,3.52,C:\Users\tssmi\OneDrive\Desktop\nlp\processed_audio\audio_1776_seg_0.wav,UNKNOWN,42.22938725316154,NOVEMBER AND,Routine,
864,3.96,C:\Users\tssmi\OneDrive\Desktop\nlp\processed_audio\audio_1777_seg_0.wav,UNKNOWN,13.627428320059812,NEXT IS BRAVO NAV CHECKER FIVE ONE ONE,Routine,
865,2.78,C:\Users\tssmi\OneDrive\Desktop\nlp\processed_audio\audio_1778_seg_0.wav,UNKNOWN,57.60010750420066,THREE THREE FOUR ONE ZERO BYE TURKISH ONE NINER FIVE FIVE,Routine,
866,1.64,C:\Users\tssmi\OneDrive\Desktop\nlp\processed_audio\audio_1779_seg_0.wav,UNKNOWN,65.92610613779806,LANDING ON DISCRETION FIVE TWO TWO FIVE HOTEL YANKEE,Routine,
867,0.76,C:\Users\tssmi\OneDrive\Desktop\nlp\processed_audio\audio_177_seg_0.wav,UNKNOWN,18.634069099840406,CSA FOUR NINER FOUR RUNWAY ONE THREE CLEARED FOR,Routine,
868,2.08,C:\Users\tssmi\OneDrive\Desktop\nlp\processed_audio\audio_1780_seg_0.wav,UNKNOWN,3.479045749523252,PAKISTAN SEVEN ZERO NINER CONTACT RHEIN ONE THREE THREE DECIMAL EIGHT SIX ZERO GOOD,Routine,
869,3.26,C:\Users\tssmi\OneDrive\Desktop\nlp\processed_audio\audio_1781_seg_0.wav,UNKNOWN,69.50988545961465,LUFTHANSA TWO FOUR THREE FIVE ONE THREE FIVE ONE THREE FIVE BYE,Routine,
870,0.73,C:\Users\tssmi\OneDrive\Desktop\nlp\processed_audio\audio_1782_seg_0.wav,UNKNOWN,63.77524960626472,HOTEL BRAVO VICTOR ROGER AFTER WHISKEY ONE PROCEED DIRECT SIERRA,Minor Anomaly,Potential Communication Hesitation/Anomaly
871,1.27,C:\Users\tssmi\OneDrive\Desktop\nlp\processed_audio\audio_1783_seg_0.wav,UNKNOWN,28.260118397951324,ONE TWO ONE DECIMAL EIGHT FIVE FIVE SWISS TWO ZERO SIX SEVEN,Routine,
872,3.2,C:\Users\tssmi\OneDrive\Desktop\nlp\processed_audio\audio_1784_seg_0.wav,UNKNOWN,50.257938906070976,RIGA QUEBEC LIMA TRAFFIC SINGLE ENGINE AT YOUR TEN O'CLOCK POSITION FOUR MILES CROSSING FROM LEFT TO RIGHT AT FIVE THOUSAND FIVE HUNDRED FEET,Routine,
873,3.82,C:\Users\tssmi\OneDrive\Desktop\nlp\processed_audio\audio_1785_seg_0.wav,UNKNOWN,65.92050588885678,TAKE,Routine,
874,1.73,C:\Users\tssmi\OneDrive\Desktop\nlp\processed_audio\audio_1786_seg_0.wav,UNKNOWN,20.734523269855494,AEROFLOT ONE FOUR THREE,Routine,
875,3.19,C:\Users\tssmi\OneDrive\Desktop\nlp\processed_audio\audio_1787_seg_0.wav,UNKNOWN,31.84259599093722,ONE TWO FIVE BYE BYE,Routine,
876,1.62,C:\Users\tssmi\OneDrive\Desktop\nlp\processed_audio\audio_1788_seg_0.wav,UNKNOWN,45.13244800528394,TOWER BEELINE SEVEN ZERO VICTOR WE CAN ACCEPT ROMEO DEPARTURE,Routine,
877,2.49,C:\Users\tssmi\OneDrive\Desktop\nlp\processed_audio\audio_1789_seg_0.wav,UNKNOWN,62.32189392764092,EMIRATES EIGHT EIGHT WIND ZERO FOUR ZERO THREE IS NINER KNOTS RUNWAY ONE ZERO CLEARED FOR TAKEOFF,Routine,
878,6.35,C:\Users\tssmi\OneDrive\Desktop\nlp\processed_audio\audio_178_seg_0.wav,UNKNOWN,19.78360389658465,STOP AT THE HOLDING POINT,Routine,
879,4.68,C:\Users\tssmi\OneDrive\Desktop\nlp\processed_audio\audio_1790_seg_0.wav,UNKNOWN,0.0,FIVE TWO THREE DIRECT HOTEL OSCAR HOTEL DELTA OSCAR,Routine,
880,1.04,C:\Users\tssmi\OneDrive\Desktop\nlp\processed_audio\audio_1791_seg_0.wav,UNKNOWN,8.049809518001219,PRAHA APPROACH,Routine,
881,2.43,C:\Users\tssmi\OneDrive\Desktop\nlp\processed_audio\audio_1792_seg_0.wav,UNKNOWN,100.0,THAT'S CORRECT,EMERGENCY,Severe Stress Spike (Score: 100)
882,7.09,C:\Users\tssmi\OneDrive\Desktop\nlp\processed_audio\audio_1793_seg_0.wav,UNKNOWN,67.61281065405674,TOWER GOOD AFTERNOON EMIRATES NINER TWO FOUR TWO CLEARED ILS THREE FOUR LEFT SEVEN MILES FINAL,Routine,
883,2.46,C:\Users\tssmi\OneDrive\Desktop\nlp\processed_audio\audio_1794_seg_0.wav,UNKNOWN,21.013426500795173,SIX ZERO TWO THREE CALL YOU WHEN LEAVING,Routine,
884,0.96,C:\Users\tssmi\OneDrive\Desktop\nlp\processed_audio\audio_1795_seg_0.wav,UNKNOWN,27.476168946793784,ZERO PAPA ONE,Routine,
885,1.02,C:\Users\tssmi\OneDrive\Desktop\nlp\processed_audio\audio_1796_seg_0.wav,UNKNOWN,20.59163158887988,SIX YANKEE HELLO RUZYNE TOWER HOLD,Routine,
886,3.65,C:\Users\tssmi\OneDrive\Desktop\nlp\processed_audio\audio_1797_seg_0.wav,UNKNOWN,100.0,SKYTRAVEL TWO EIGHT TWO SEVEN AND THERE IS CLOSED ECHO AIRSPACE BELOW FLIGHT LEVEL ONE HUNDRED SO IF YOU WISH TO AVOID CLASS ECHO AIRSPACE NEXT DESCEND IN TWO ZERO MILES,EMERGENCY,Severe Stress Spike (Score: 100)
887,5.83,C:\Users\tssmi\OneDrive\Desktop\nlp\processed_audio\audio_1798_seg_0.wav,UNKNOWN,100.0,CLIMB FLIGHT LEVEL EIGHT ZERO CSA THREE KILO FOXTROT,EMERGENCY,Severe Stress Spike (Score: 100)
888,6.14,C:\Users\tssmi\OneDrive\Desktop\nlp\processed_audio\audio_1799_seg_0.wav,UNKNOWN,49.81610011724406,SILVER ARROWS ONE ONE XRAY PAPA CONTACT PRAHA ONE THREE THREE DECIMAL THREE NINER ZERO GOOD BYE,Routine,
889,1.34,C:\Users\tssmi\OneDrive\Desktop\nlp\processed_audio\audio_179_seg_0.wav,UNKNOWN,32.3958146534231,CONTINUE APPROACH THREE FOUR ELEVEN VACATE VIA ALPHA TWO SINGAPORE TWO THIRTY ONE,Routine,
890,4.12,C:\Users\tssmi\OneDrive\Desktop\nlp\processed_audio\audio_17_seg_0.wav,UNKNOWN,62.13477542310221,HOTEL OSCAR QNH ONE ZERO THREE TAXI THREE TWO INTERSECTION FOXTROT,Routine,
891,0.71,C:\Users\tssmi\OneDrive\Desktop\nlp\processed_audio\audio_1800_seg_0.wav,UNKNOWN,100.0,THREE ONE CLEARED TO LAND CSA EIGHT TANGO,EMERGENCY,Severe Stress Spike (Score: 100)
892,3.4,C:\Users\tssmi\OneDrive\Desktop\nlp\processed_audio\audio_1801_seg_0.wav,UNKNOWN,62.71228718564562,THREE FOUR ZERO ON THE HEADING CLEARED ILS RUNWAY THREE ONE,Routine,
893,2.79,C:\Users\tssmi\OneDrive\Desktop\nlp\processed_audio\audio_1802_seg_0.wav,UNKNOWN,87.20232713889853,TOWER CONNIE EIGHT THIRTY FIVE ON THE ILS ONE SIX THREE,EMERGENCY,Severe Stress Spike (Score: 87)
894,2.99,C:\Users\tssmi\OneDrive\Desktop\nlp\processed_audio\audio_1803_seg_0.wav,UNKNOWN,56.99574346437479,OH AND INTERCEPT LOCALIZER RUNWAY THREE ONE,Routine,
895,2.36,C:\Users\tssmi\OneDrive\Desktop\nlp\processed_audio\audio_1804_seg_0.wav,UNKNOWN,35.16757749894072,RUNWAY THREE ONE,Routine,
896,0.76,C:\Users\tssmi\OneDrive\Desktop\nlp\processed_audio\audio_1805_seg_0.wav,UNKNOWN,11.00103378083118,MOSQUITO SIX ZERO ECHO READY TO CHECK,Routine,
897,6.03,C:\Users\tssmi\OneDrive\Desktop\nlp\processed_audio\audio_1806_seg_0.wav,UNKNOWN,21.239431459820292,ROGER BRAVO THREE ZERO FOUR THREE AFFIRM CLIMB MAXIMUM FIVE THOUSAND FIVE HUNDRED FEET,Routine,
898,0.96,C:\Users\tssmi\OneDrive\Desktop\nlp\processed_audio\audio_1807_seg_0.wav,UNKNOWN,9.111988388903413,SION VICTOR OSCAR HOOK MISSION COMPLETED NOW LANDING VICTOR CALL YOU BEFORE DEPARTURE,Routine,
899,2.67,C:\Users\tssmi\OneDrive\Desktop\nlp\processed_audio\audio_1808_seg_0.wav,UNKNOWN,74.62188799012566,EIGHT EIGHT SEVEN FULLY,Elevated Risk,High Stress (Score: 74)
900,3.28,C:\Users\tssmi\OneDrive\Desktop\nlp\processed_audio\audio_1809_seg_0.wav,UNKNOWN,25.448242476087177,CLIMB FLIGHT LEVEL THREE THREE ZERO LUFTHANSA ONE UNIFORM XRAY,Routine,
901,1.45,C:\Users\tssmi\OneDrive\Desktop\nlp\processed_audio\audio_180_seg_0.wav,UNKNOWN,3.389203787115449,CSA SIX EIGHT EIGHT LINE UP RUNWAY THREE ONE LINE UP THREE ONE CSA SIX EIGHT EIGHT,Routine,
902,3.62,C:\Users\tssmi\OneDrive\Desktop\nlp\processed_audio\audio_1810_seg_0.wav,UNKNOWN,37.870409570703146,CONTINUE DOWN TO FOUR THOUSAND FEET QNH ONE ZERO TWO TWO RUSSIA TWO TWO ONE,Routine,
903,4.61,C:\Users\tssmi\OneDrive\Desktop\nlp\processed_audio\audio_1811_seg_0.wav,UNKNOWN,94.4901068774746,HELI HOTEL YANKEE WIND TWO FOUR ZERO DEGREES ONE FIVE KNOTS FIVE TWO TWO FIVE LANDING ON DISCRETION,EMERGENCY,Severe Stress Spike (Score: 94)
904,3.875,C:\Users\tssmi\OneDrive\Desktop\nlp\processed_audio\audio_1812_seg_0.wav,UNKNOWN,11.111407232311002,FIVE DEGREES TO THE LEFT CSA SEVEN KILO GOLF,Routine,
905,4.155,C:\Users\tssmi\OneDrive\Desktop\nlp\processed_audio\audio_1813_seg_0.wav,UNKNOWN,4.996529458592136,CONTACTING PRAHA ONE THREE FIVE DECIMAL ONE THREE FIVE AIR BERLIN FIVE THREE ONE GOOD DAY,Routine,
906,0.85,C:\Users\tssmi\OneDrive\Desktop\nlp\processed_audio\audio_1814_seg_0.wav,UNKNOWN,47.45988614111128,LUFTHANSA TWO ECHO KILO DESCEND FLIGHT LEVEL TWO NINER ZERO RATE ONE THOUSAND OR GREATER,Routine,
907,3.6,C:\Users\tssmi\OneDrive\Desktop\nlp\processed_audio\audio_1815_seg_0.wav,UNKNOWN,93.60676729996554,CLIMBING UP LEVEL THREE THREE ZERO AUSTRIAN THREE ZERO ONE HOTEL,EMERGENCY,Severe Stress Spike (Score: 93)
908,6.0,C:\Users\tssmi\OneDrive\Desktop\nlp\processed_audio\audio_1816_seg_0.wav,UNKNOWN,98.49630353907652,STARTUP OWN DISCRETION EUROTRANS ONE THREE JULIETT,EMERGENCY,Severe Stress Spike (Score: 98)
909,2.4,C:\Users\tssmi\OneDrive\Desktop\nlp\processed_audio\audio_1817_seg_0.wav,UNKNOWN,16.053711844985806,CSA NINER TWO ONE DESCEND TO FLIGHT LEVEL TWO THREE ZERO,Routine,
910,2.29,C:\Users\tssmi\OneDrive\Desktop\nlp\processed_audio\audio_1818_seg_0.wav,UNKNOWN,31.51936983119068,QANTAS SIX FORTY TWO SYDNEY TOWER GOOD DAY,Routine,
911,2.14,C:\Users\tssmi\OneDrive\Desktop\nlp\processed_audio\audio_1819_seg_0.wav,UNKNOWN,100.0,EUROTRANS ONE THREE JULIETT STARTUP APPROVED OWN DISCRETION,EMERGENCY,Severe Stress Spike (Score: 100)
912,5.52,C:\Users\tssmi\OneDrive\Desktop\nlp\processed_audio\audio_181_seg_0.wav,UNKNOWN,63.22933425953425,NAV CHECKER FIVE ONE ONE REPORTING ONE THOUSAND TEN THOUSAND FEET,Routine,
913,6.48,C:\Users\tssmi\OneDrive\Desktop\nlp\processed_audio\audio_1820_seg_0.wav,UNKNOWN,53.19239873350086,SWISS FOUR SIX ONE FOXTROT RADAR RADAR CONTACT CLIMB TO FLIGHT LEVEL NINER ZERO,Routine,
914,4.44,C:\Users\tssmi\OneDrive\Desktop\nlp\processed_audio\audio_1821_seg_0.wav,UNKNOWN,88.80359723357148,HOTEL LIMA HOLD SHORT OF TWO FOUR SKYTRAVEL,EMERGENCY,Severe Stress Spike (Score: 88)
915,3.6,C:\Users\tssmi\OneDrive\Desktop\nlp\processed_audio\audio_1822_seg_0.wav,UNKNOWN,64.7936571862389,AUSTRIAN SEVEN ZERO NINER DESCEND FLIGHT LEVEL ONE ZERO ZERO DESCENDING FLIGHT LEVEL ONE HUNDRED AUSTRIAN SEVEN ZERO NINER,Routine,
916,1.84,C:\Users\tssmi\OneDrive\Desktop\nlp\processed_audio\audio_1823_seg_0.wav,UNKNOWN,27.15225516418625,LUFTHANSA TWO JULIETT WHISKEY BEHIND LANDING TRAFFIC SHORT FINAL DASH LINE UP RUNWAY THREE ONE BEHIND,Routine,
917,6.36,C:\Users\tssmi\OneDrive\Desktop\nlp\processed_audio\audio_1824_seg_0.wav,UNKNOWN,87.30706765756254,LINE UP ONE THREE AUSTRIAN SEVEN ONE TWO ZULU,EMERGENCY,Severe Stress Spike (Score: 87)
918,4.84,C:\Users\tssmi\OneDrive\Desktop\nlp\processed_audio\audio_1825_seg_0.wav,UNKNOWN,88.19568584642144,PRAHA RADAR JET AIRWAYS ONE ONE NINER GOOD MORNING MAINTAINING FLIGHT LEVEL THREE THREE ZERO DIRECT TO INITA,EMERGENCY,Severe Stress Spike (Score: 88)
919,1.94,C:\Users\tssmi\OneDrive\Desktop\nlp\processed_audio\audio_1826_seg_0.wav,UNKNOWN,100.0,GERMANWINGS TWO ONE ZERO CLIMB LEVEL THREE FOUR ZERO,EMERGENCY,Severe Stress Spike (Score: 100)
920,3.82,C:\Users\tssmi\OneDrive\Desktop\nlp\processed_audio\audio_1827_seg_0.wav,UNKNOWN,100.0,ONE ONE EIGHT THREE SEVEN FIVE AEROFLOT ONE FIVE ZERO THANK YOU BYE,EMERGENCY,Severe Stress Spike (Score: 100)
921,2.45,C:\Users\tssmi\OneDrive\Desktop\nlp\processed_audio\audio_1828_seg_0.wav,UNKNOWN,84.45165193652473,HELLO RADAR SKYTRAVEL ONE ONE NINER TWO PASSING ONE THOUSAND SIX,Elevated Risk,High Stress (Score: 84)
922,0.73,C:\Users\tssmi\OneDrive\Desktop\nlp\processed_audio\audio_1829_seg_0.wav,UNKNOWN,28.993785737551462,YEAH JUST FROM HERE DELIVERY START IN ONE HOUR OK,Routine,
923,2.97,C:\Users\tssmi\OneDrive\Desktop\nlp\processed_audio\audio_182_seg_0.wav,UNKNOWN,42.796262160104845,CLIMB LEVEL THREE ONE ZERO SCANDINAVIAN TWO SIX SIX TWO,Routine,
924,2.55,C:\Users\tssmi\OneDrive\Desktop\nlp\processed_audio\audio_1830_seg_0.wav,UNKNOWN,54.513483886306666,GO AHEAD,Routine,
925,1.59,C:\Users\tssmi\OneDrive\Desktop\nlp\processed_audio\audio_1831_seg_0.wav,UNKNOWN,81.32531855525896,LUFTHANSA SEVEN EIGHT SEVEN RUNWAY THREE ONE CLEARED TO LAND WIND ONE EIGHT ZERO DEGREES TWO KNOTS LUFTHANSA SEVEN EIGHT SEVEN RUNWAY THREE ONE CLEARED TO LAND,Elevated Risk,High Stress (Score: 81)
926,6.77,C:\Users\tssmi\OneDrive\Desktop\nlp\processed_audio\audio_1832_seg_0.wav,UNKNOWN,83.5017080664093,PRAHA RADAR SKYTRAVEL ONE TWO ZERO ONE DIRECTION,Elevated Risk,High Stress (Score: 83)
927,5.57,C:\Users\tssmi\OneDrive\Desktop\nlp\processed_audio\audio_1833_seg_0.wav,UNKNOWN,100.0,CSA NINER SIX SEVEN DESCEND FLIGHT LEVEL ONE ZERO ZERO,EMERGENCY,Severe Stress Spike (Score: 100)
928,3.76,C:\Users\tssmi\OneDrive\Desktop\nlp\processed_audio\audio_1834_seg_0.wav,UNKNOWN,77.70809943873132,TOWER CSA,Elevated Risk,High Stress (Score: 77)
929,2.41,C:\Users\tssmi\OneDrive\Desktop\nlp\processed_audio\audio_1835_seg_0.wav,UNKNOWN,100.0,PRAHA GOOD AFTERNOON MALAYSIAN TWO ONE FLIGHT LEVEL THREE THREE ZERO SQUAWKING ZERO SIX FOUR SEVEN MALAYSIAN TWO ONE HELLO RADAR CONTACT MAINTAIN FLIGHT LEVEL THREE THREE ZERO,EMERGENCY,Severe Stress Spike (Score: 100)
930,2.21,C:\Users\tssmi\OneDrive\Desktop\nlp\processed_audio\audio_1836_seg_0.wav,UNKNOWN,48.46191005460776,LINE UP RUNWAY THREE ONE AND WAIT AT NUMBER TWO CSA EIGHT,Routine,
931,5.36,C:\Users\tssmi\OneDrive\Desktop\nlp\processed_audio\audio_1837_seg_0.wav,UNKNOWN,81.41348972620591,DESCENDING FOUR THOUSAND ONE ZERO TWO THREE CLEARED ILS THREE ONE CLEARED ESTABLISH MALEV EIGHT TWO ZERO,Elevated Risk,High Stress (Score: 81)
932,5.08,C:\Users\tssmi\OneDrive\Desktop\nlp\processed_audio\audio_1838_seg_0.wav,UNKNOWN,32.00845190745412,AIRFRANS ONE ZERO EIGHT TWO TURN RIGHT HEADING ONE ZERO ZERO CLEARED FOR ILS APPROACH RUNWAY ONE THREE,Routine,
933,4.32,C:\Users\tssmi\OneDrive\Desktop\nlp\processed_audio\audio_1839_seg_0.wav,UNKNOWN,68.32367031258923,NOR SHUTTLE ONE FIVE ZERO TWO DESCEND FLIGHT LEVEL ONE ZERO ZERO,Routine,
934,4.22,C:\Users\tssmi\OneDrive\Desktop\nlp\processed_audio\audio_183_seg_0.wav,UNKNOWN,23.56282170090057,AIRFRANS TWO TWO FIVE CONTACT RHEIN ONE THREE SIX DECIMAL FOUR ZERO FIVE GOOD DAY,Routine,
935,4.39,C:\Users\tssmi\OneDrive\Desktop\nlp\processed_audio\audio_1840_seg_0.wav,UNKNOWN,0.1596806749428978,PRAHA RADAR GOOD MORNING DELTA CHARLIE VICTOR HOTEL ALPHA FLIGHT LEVEL THREE ONE ZERO ON COURSE OSCAR KILO GOLF,Routine,
936,0.7,C:\Users\tssmi\OneDrive\Desktop\nlp\processed_audio\audio_1841_seg_0.wav,UNKNOWN,100.0,GOOD AFTERNOON LUFTHANSA SEVEN,EMERGENCY,Severe Stress Spike (Score: 100)
937,3.32,C:\Users\tssmi\OneDrive\Desktop\nlp\processed_audio\audio_1842_seg_0.wav,UNKNOWN,11.684309869645574,PRAHA GOOD MORNING,Routine,
938,5.64,C:\Users\tssmi\OneDrive\Desktop\nlp\processed_audio\audio_1843_seg_0.wav,UNKNOWN,100.0,CSA SIX THREE ONE PROCEED PAPA ROMEO NINER ONE FOUR,EMERGENCY,Severe Stress Spike (Score: 100)
939,6.22,C:\Users\tssmi\OneDrive\Desktop\nlp\processed_audio\audio_1844_seg_0.wav,UNKNOWN,80.63789888958495,SKYTRAVEL ONE ONE ZERO THREE DESCEND FLIGHT LEVEL NINER ZERO CONTACT RADAR ONE ONE NINER DECIMAL ZERO GOOD BYE,Elevated Risk,High Stress (Score: 80)
940,2.43,C:\Users\tssmi\OneDrive\Desktop\nlp\processed_audio\audio_1845_seg_0.wav,UNKNOWN,88.89242799767797,QUALITY ZERO TWO SEVEN GOOD MORNING CALL US ON ONE THREE THREE DECIMAL THREE NINER ZERO,EMERGENCY,Severe Stress Spike (Score: 88)
941,4.09,C:\Users\tssmi\OneDrive\Desktop\nlp\processed_audio\audio_1846_seg_0.wav,UNKNOWN,76.44741688626894,TWO THOUSAND FEET,Elevated Risk,High Stress (Score: 76)
942,2.552,C:\Users\tssmi\OneDrive\Desktop\nlp\processed_audio\audio_1847_seg_0.wav,UNKNOWN,100.0,CORRECT REPORT YOUR ESTIMATE FOR PRIBRAM,EMERGENCY,Severe Stress Spike (Score: 100)
943,3.64,C:\Users\tssmi\OneDrive\Desktop\nlp\processed_audio\audio_1848_seg_0.wav,UNKNOWN,88.21885337317195,ONE THREE FOUR EIGHT SEVEN FIVE SEVEN EIGHT BYE BYE,EMERGENCY,Severe Stress Spike (Score: 88)
944,5.53,C:\Users\tssmi\OneDrive\Desktop\nlp\processed_audio\audio_1849_seg_0.wav,UNKNOWN,81.65479769390538,CSA EIGHT ZERO TWO FOR FURTHER CLIMB CONTACT PRAHA ONE THREE THREE DECIMAL FOUR ONE ZERO GOOD BYE,Elevated Risk,High Stress (Score: 81)
945,1.51,C:\Users\tssmi\OneDrive\Desktop\nlp\processed_audio\audio_184_seg_0.wav,UNKNOWN,0.2636901961706854,RUZYNE RADAR GOOD AFTERNOON DONAVIA THREE ZERO SIX PASSING TWO THOUSAND FEET CLIMBING FIVE THOUSAND FEET,Routine,
946,4.66,C:\Users\tssmi\OneDrive\Desktop\nlp\processed_audio\audio_1850_seg_0.wav,UNKNOWN,51.57769949702172,PRAHA RADAR GOOD DAY LUFTHANSA TWO FIVE TWO SEVEN LEVEL THREE FOUR ZERO,Routine,
947,7.23,C:\Users\tssmi\OneDrive\Desktop\nlp\processed_audio\audio_1851_seg_0.wav,UNKNOWN,26.718398948807117,NINER ZERO CSA NINER SIX ZERO,Routine,
948,6.41,C:\Users\tssmi\OneDrive\Desktop\nlp\processed_audio\audio_1852_seg_0.wav,UNKNOWN,5.823251950698989,LUFTHANSA SEVEN EIGHT SEVEN TOWER GOOD MORNING ROGER,Routine,
949,4.18,C:\Users\tssmi\OneDrive\Desktop\nlp\processed_audio\audio_1853_seg_0.wav,UNKNOWN,92.23925690890704,DESCEND LEVEL ONE HUNDRED WE HAVE INFORMATION OSCAR AND SAY AGAIN SWEDESTAR ZERO FIVE ONE,EMERGENCY,Severe Stress Spike (Score: 92); Potential Communication Hesitation/Anomaly
950,4.62,C:\Users\tssmi\OneDrive\Desktop\nlp\processed_audio\audio_1854_seg_0.wav,UNKNOWN,18.138304470064536,LUFTHANSA FIVE JULIETT WHISKEY CONTACT PRAHA ONE THREE THREE THREE NINER ZERO BYE BYE,Routine,
951,0.8,C:\Users\tssmi\OneDrive\Desktop\nlp\processed_audio\audio_1855_seg_0.wav,UNKNOWN,58.23267813673914,AIR BERLIN FIVE THREE ONE DESCEND FLIGHT LEVEL TWO NINER ZERO,Routine,
952,1.96,C:\Users\tssmi\OneDrive\Desktop\nlp\processed_audio\audio_1856_seg_0.wav,UNKNOWN,38.19450377300973,SIX TWO ONE,Routine,
953,2.49,C:\Users\tssmi\OneDrive\Desktop\nlp\processed_audio\audio_1857_seg_0.wav,UNKNOWN,66.23265430727403,AIR BERLIN TWO EIGHT TWO GOLF DESCEND FLIGHT LEVEL,Routine,
954,3.75,C:\Users\tssmi\OneDrive\Desktop\nlp\processed_audio\audio_1858_seg_0.wav,UNKNOWN,79.38166163648611,SEVEN THREE EIGHT PATKA APPROVED,Elevated Risk,High Stress (Score: 79)
955,4.21,C:\Users\tssmi\OneDrive\Desktop\nlp\processed_audio\audio_1859_seg_0.wav,UNKNOWN,78.94768144546414,CSA SEVEN ALPHA JULIETT REDUCE SPEED ONE EIGHT ZERO,Elevated Risk,High Stress (Score: 78)
956,4.11,C:\Users\tssmi\OneDrive\Desktop\nlp\processed_audio\audio_185_seg_0.wav,UNKNOWN,37.45417974911269,YANGZTE RIVER SEVEN,Routine,
957,2.44,C:\Users\tssmi\OneDrive\Desktop\nlp\processed_audio\audio_1860_seg_0.wav,UNKNOWN,46.15841010757234,AFFIRM YOUR FLIGHT PLAN HAS EXPIRED NOW SO SEND DELAY MESSAGE PLEASE,Routine,
958,4.38,C:\Users\tssmi\OneDrive\Desktop\nlp\processed_audio\audio_1861_seg_0.wav,UNKNOWN,40.12997507872154,LUFTHANSA EIGHT WHISKEY TANGO DESCEND FLIGHT LEVEL TWO NINER ZERO,Routine,
959,5.07,C:\Users\tssmi\OneDrive\Desktop\nlp\processed_audio\audio_1862_seg_0.wav,UNKNOWN,16.992517195467258,KLM FIVE FIVE TANGO TURN RIGHT HEADING TWO FOUR ZERO RIGHT HEADING TWO FOUR ZERO KLM FIVE FIVE TANGO,Routine,
960,2.02,C:\Users\tssmi\OneDrive\Desktop\nlp\processed_audio\audio_1863_seg_0.wav,UNKNOWN,75.69852472764532,NOR SHUTTLE ONE FIVE ZERO TWO TURN RIGHT HEADING TWO SEVEN ZERO CLEARED FOR ILS APPROACH RUNWAY THREE ONE,Elevated Risk,High Stress (Score: 75)
961,4.68,C:\Users\tssmi\OneDrive\Desktop\nlp\processed_audio\audio_1864_seg_0.wav,UNKNOWN,76.63918863958085,BYE,Elevated Risk,High Stress (Score: 76)
962,0.71,C:\Users\tssmi\OneDrive\Desktop\nlp\processed_audio\audio_1865_seg_0.wav,UNKNOWN,61.33072758693016,LUFTHANSA CARGO EIGHT FOUR SIX THREE DESCEND,Routine,
963,5.95,C:\Users\tssmi\OneDrive\Desktop\nlp\processed_audio\audio_1866_seg_0.wav,UNKNOWN,88.24194460639336,AIR BERLIN TWO NINER EIGHT VICTOR CONTACT RHEIN ONE THREE THREE DECIMAL TWO EIGHT FIVE GOOD BYE,EMERGENCY,Severe Stress Spike (Score: 88)
964,2.33,C:\Users\tssmi\OneDrive\Desktop\nlp\processed_audio\audio_1867_seg_0.wav,UNKNOWN,15.614622431684772,OPERA THREE ZERO ZERO ROGER RUNWAY ONE THREE LINE UP CLEARED FOR TAKEOFF WIND THREE FIVE ZERO TWO KNOTS,Routine,
965,4.84,C:\Users\tssmi\OneDrive\Desktop\nlp\processed_audio\audio_1868_seg_0.wav,UNKNOWN,2.711956896940073,ONE THREE THREE EIGHT SIX ZERO BYE BYE,Routine,
966,2.04,C:\Users\tssmi\OneDrive\Desktop\nlp\processed_audio\audio_1869_seg_0.wav,UNKNOWN,100.0,CSA ONE ZULU ALPHA RUNWAY THREE ONE CLEARED FOR IMMEDIATE TAKEOFF WIND ONE SEVEN ZERO DEGREES FOUR KNOTS,EMERGENCY,Severe Stress Spike (Score: 100)
967,3.54,C:\Users\tssmi\OneDrive\Desktop\nlp\processed_audio\audio_186_seg_0.wav,UNKNOWN,64.67552961413168,CSA SEVEN TANGO CLIMB TO FLIGHT LEVEL ONE ONE ZERO,Routine,
968,2.33,C:\Users\tssmi\OneDrive\Desktop\nlp\processed_audio\audio_1870_seg_0.wav,UNKNOWN,31.669795762923226,EASY SIX EIGHT KILO PAPA GOOD EVENING RADAR RADAR CONTACT CLIMB FLIGHT LEVEL ONE SIX ZERO,Routine,
969,3.0,C:\Users\tssmi\OneDrive\Desktop\nlp\processed_audio\audio_1871_seg_0.wav,UNKNOWN,30.514001069826392,VIA LIMA AND GROUND,Routine,
970,3.64,C:\Users\tssmi\OneDrive\Desktop\nlp\processed_audio\audio_1872_seg_0.wav,UNKNOWN,85.39321902207443,AUSTRIAN THREE TWO SIX GOLF RATE TWO THOUSAND OR MORE,EMERGENCY,Severe Stress Spike (Score: 85)
