segment_index,duration,file_path,speaker_role,stress_score,transcript,alert_level,alert_reason
2355,3.61,C:\Users\tssmi\OneDrive\Desktop\nlp\processed_audio\audio_3115_seg_0.wav,UNKNOWN,49.23796142882042,FOUR SIX TWO CIMBER ZERO FIVE TWO EIGHT,Routine,
2356,4.005,C:\Users\tssmi\OneDrive\Desktop\nlp\processed_audio\audio_3116_seg_0.wav,UNKNOWN,27.640633348706032,DESCEND FLIGHT LEVEL ONE,Routine,
2357,2.74,C:\Users\tssmi\OneDrive\Desktop\nlp\processed_audio\audio_3117_seg_0.wav,UNKNOWN,8.020802709610727,AIRFRANS ONE SEVEN EIGHT TWO RUNWAY THREE ONE CLEARED TO LAND WIND ONE NINER ZERO DEGREES FIVE KNOTS,Routine,
2358,2.9,C:\Users\tssmi\OneDrive\Desktop\nlp\processed_audio\audio_3118_seg_0.wav,UNKNOWN,10.0315067874609,CLIMB FLIGHT LEVEL ONE THREE ZERO SIERRA VICTOR ALPHA,Minor Anomaly,Potential Communication Hesitation/Anomaly
2359,5.72,C:\Users\tssmi\OneDrive\Desktop\nlp\processed_audio\audio_3119_seg_0.wav,UNKNOWN,3.062100150040088,ROGER STANDBY FOR SHORTCUT,Routine,
2360,3.42,C:\Users\tssmi\OneDrive\Desktop\nlp\processed_audio\audio_311_seg_0.wav,UNKNOWN,68.1245059643284,AEROFLOT ONE TWO TWO CLIMB TO FLIGHT LEVEL THREE THREE ZERO,Routine,
2361,2.2,C:\Users\tssmi\OneDrive\Desktop\nlp\processed_audio\audio_3120_seg_0.wav,UNKNOWN,45.221510906492064,AIRFRANS ONE NINER EIGHT ROMEO RESUME OWN NAVIGATION PROCEED TO RAPET AND CONTACT PRAHA RADAR ONE TWO ZERO DECIMAL TWO SEVEN FIVE GOOD BYE,Routine,
2362,0.82,C:\Users\tssmi\OneDrive\Desktop\nlp\processed_audio\audio_3121_seg_0.wav,UNKNOWN,61.62016468286368,TURKISH ONE SEVEN SEVEN ZERO CONFIRM READY,Routine,
2363,1.83,C:\Users\tssmi\OneDrive\Desktop\nlp\processed_audio\audio_3122_seg_0.wav,UNKNOWN,47.84916715234023,LEVEL THREE HUNDRED BY RAPET LUFTHANSA SEVEN FIVE SEVEN ROGER,Routine,
2364,2.41,C:\Users\tssmi\OneDrive\Desktop\nlp\processed_audio\audio_3123_seg_0.wav,UNKNOWN,70.05581188966201,CSA EIGHT ZERO THREE DESCEND FLIGHT LEVEL ONE ONE ZERO,Elevated Risk,High Stress (Score: 70)
2365,0.74,C:\Users\tssmi\OneDrive\Desktop\nlp\processed_audio\audio_3124_seg_0.wav,UNKNOWN,100.0,SIX TWO THREE,EMERGENCY,Severe Stress Spike (Score: 100)
2366,3.67,C:\Users\tssmi\OneDrive\Desktop\nlp\processed_audio\audio_3125_seg_0.wav,UNKNOWN,37.58614903179097,CLIMBING THREE FOUR ZERO LIMA LIMA TANGO NINER ZERO ONE,Routine,
2367,5.51,C:\Users\tssmi\OneDrive\Desktop\nlp\processed_audio\audio_3126_seg_0.wav,UNKNOWN,15.960491095663656,CONTINUE APPROACH CSA SEVEN ALPHA JULIETT,Routine,
2368,4.94,C:\Users\tssmi\OneDrive\Desktop\nlp\processed_audio\audio_3127_seg_0.wav,UNKNOWN,71.78279144791347,CONTRACT ONE WHISKEY ALPHA PROCEED TO AGAVA,Elevated Risk,High Stress (Score: 71)
2369,2.6,C:\Users\tssmi\OneDrive\Desktop\nlp\processed_audio\audio_3128_seg_0.wav,UNKNOWN,20.04128317475482,SIERRA YANKEE LIMA SEVEN ZERO NINER DESCEND FLIGHT LEVEL TWO NINER ZERO WERE CLEARED LEVEL TWO NINER ZERO SIERRA YANKEE LIMA SEVEN ZERO FIVE,Minor Anomaly,Potential Communication Hesitation/Anomaly
2370,0.96,C:\Users\tssmi\OneDrive\Desktop\nlp\processed_audio\audio_3129_seg_0.wav,UNKNOWN,56.46728760472809,EIGHT FIVE SIX DESCEND FOUR THOUSAND FEET QNH ONE ZERO ONE NINER,Routine,
2371,4.11,C:\Users\tssmi\OneDrive\Desktop\nlp\processed_audio\audio_312_seg_0.wav,UNKNOWN,58.90868937131301,DESCEND FLIGHT LEVEL ONE THREE ZERO TURKISH ONE SEVEN SIX NINER,Routine,
2372,3.47,C:\Users\tssmi\OneDrive\Desktop\nlp\processed_audio\audio_3130_seg_0.wav,UNKNOWN,37.482392548562736,CLIMBING FLIGHT LEVEL ONE,Routine,
2373,0.81,C:\Users\tssmi\OneDrive\Desktop\nlp\processed_audio\audio_3131_seg_0.wav,UNKNOWN,79.57238111178923,SKYTRAVEL ONE ZERO THREE SIX LINE UP RUNWAY ONE THREE,Elevated Risk,High Stress (Score: 79)
2374,6.98,C:\Users\tssmi\OneDrive\Desktop\nlp\processed_audio\audio_3132_seg_0.wav,UNKNOWN,100.0,ONE THREE SIX FOUR,EMERGENCY,Severe Stress Spike (Score: 100)
2375,7.88,C:\Users\tssmi\OneDrive\Desktop\nlp\processed_audio\audio_3133_seg_0.wav,UNKNOWN,8.744576370742642,BLINE EIGHT HOTEL SIERRA LEFT HEADING ZERO FIVE ZERO,Minor Anomaly,Potential Communication Hesitation/Anomaly
2376,2.78,C:\Users\tssmi\OneDrive\Desktop\nlp\processed_audio\audio_3134_seg_0.wav,UNKNOWN,60.69537056792151,ONE TWO SEVEN ONE TWO FIVE FOUR SIX ECHO GOOD BYE,Routine,
2377,7.04,C:\Users\tssmi\OneDrive\Desktop\nlp\processed_audio\audio_3135_seg_0.wav,UNKNOWN,4.861790592587127,CSA THREE ZERO THREE ROGER TURN LEFT ONE ZERO DEGREES AND DESCEND TO FLIGHT LEVEL ONE THREE ZERO,Routine,
2378,7.37,C:\Users\tssmi\OneDrive\Desktop\nlp\processed_audio\audio_3136_seg_0.wav,UNKNOWN,12.528024639449429,ARRIVAL,Routine,
2379,3.28,C:\Users\tssmi\OneDrive\Desktop\nlp\processed_audio\audio_3137_seg_0.wav,UNKNOWN,24.656537033784648,MALEV EIGHT TWO ZERO RUNWAY THREE ONE CLEARED TO LAND WIND ONE NINER ZERO DEGREES,Routine,
2380,2.77,C:\Users\tssmi\OneDrive\Desktop\nlp\processed_audio\audio_3138_seg_0.wav,UNKNOWN,51.41005854137641,THREE THOUSAND THREE HUNDRED FEET,Routine,
2381,2.38,C:\Users\tssmi\OneDrive\Desktop\nlp\processed_audio\audio_3139_seg_0.wav,UNKNOWN,66.74067393399184,LUFTHANSA NINER JULIETT CHARLIE TURN LEFT HEADING THREE FOUR ZERO CLEARED ILS RUNWAY THREE ONE REPORT WHEN ESTABLISHED,Routine,
2382,1.5,C:\Users\tssmi\OneDrive\Desktop\nlp\processed_audio\audio_313_seg_0.wav,UNKNOWN,96.5916886966864,CLEARED FOR TAKEOFF RUNWAY THREE ONE GOOD BYE TURKISH ONE SEVEN SIX,EMERGENCY,Severe Stress Spike (Score: 96)
2383,3.84,C:\Users\tssmi\OneDrive\Desktop\nlp\processed_audio\audio_3140_seg_0.wav,UNKNOWN,97.1249990114852,CAMBER THREE FIVE TWO FOUR ONE MORE LANDING,EMERGENCY,Severe Stress Spike (Score: 97)
2384,5.19,C:\Users\tssmi\OneDrive\Desktop\nlp\processed_audio\audio_3141_seg_0.wav,UNKNOWN,62.56842559541998,ONE TWO SIX EIGHT TWO FIVE TALK TO YOU LATER NAV CHECKER FIVE ONE ONE,Routine,
2385,2.56,C:\Users\tssmi\OneDrive\Desktop\nlp\processed_audio\audio_3142_seg_0.wav,UNKNOWN,23.073831367500624,DESCENDING FLIGHT LEVEL ONE HUNDRED FREE SPEED CSA ONE DELTA ZULU,Routine,
2386,2.9,C:\Users\tssmi\OneDrive\Desktop\nlp\processed_audio\audio_3143_seg_0.wav,UNKNOWN,6.03720547116243,CHARLIE ZULU DIRECTION MONTANA CONFIRM,Routine,
2387,6.59,C:\Users\tssmi\OneDrive\Desktop\nlp\processed_audio\audio_3144_seg_0.wav,UNKNOWN,24.39242842880464,RIGHT THREE ONE CLEARED TO LAND DARK BLUE FIVE FOUR ROMEO,Routine,
2388,2.28,C:\Users\tssmi\OneDrive\Desktop\nlp\processed_audio\audio_3145_seg_0.wav,UNKNOWN,73.45297156773604,IS IT OKAY FOR YOU IF WE MAINTAIN FOUR NAUTICAL MILES LEFT-HAND TRACK ALL THE WAY DOWN TO BENESOV,Elevated Risk,High Stress (Score: 73)
2389,1.51,C:\Users\tssmi\OneDrive\Desktop\nlp\processed_audio\audio_3146_seg_0.wav,UNKNOWN,30.349031022963867,HOTEL FOXTROT HOTEL CONFIRM REQUESTED CRUISING LEVEL,Routine,
2390,3.11,C:\Users\tssmi\OneDrive\Desktop\nlp\processed_audio\audio_3147_seg_0.wav,UNKNOWN,46.61469526811348,PRAHA RADAR GOOD MORNING LUFTHANSA TWO FIVE TWO SIX LEVEL TWO FIVE SIX CLIMBING THREE ONE ZERO LUFTHANSA TWO FIVE TWO SIX PRAHA HELLO RADAR CONTACT,Routine,
2391,2.9,C:\Users\tssmi\OneDrive\Desktop\nlp\processed_audio\audio_3148_seg_0.wav,UNKNOWN,37.68366587717576,HOTEL BRAVO ZULU OSCAR BRAVO BERNE TOWER ENTER CONTROL ZONE VIA ROUTEWHISKEY AND SAY YOUR PROGRAM AGAIN,Routine,
2392,5.485,C:\Users\tssmi\OneDrive\Desktop\nlp\processed_audio\audio_3149_seg_0.wav,UNKNOWN,11.665186419147936,THANK YOU QNH IS ONE ZERO TWO THREE,Routine,
2393,2.45,C:\Users\tssmi\OneDrive\Desktop\nlp\processed_audio\audio_314_seg_0.wav,UNKNOWN,99.56686491482326,APPROVED BRAVO FOUR THANK YOU JETSTAR FOUR ZERO NINER,EMERGENCY,Severe Stress Spike (Score: 99)
2394,2.88,C:\Users\tssmi\OneDrive\Desktop\nlp\processed_audio\audio_3150_seg_0.wav,UNKNOWN,34.41692104191692,ESTABLISHED ILS THREE ONE SPEED ONE SIXTY,Routine,
2395,4.24,C:\Users\tssmi\OneDrive\Desktop\nlp\processed_audio\audio_3151_seg_0.wav,UNKNOWN,0.0,DESCEND LEVEL ONE THREE ZERO OSCAR COPY IT AND SPEED,Routine,
2396,6.84,C:\Users\tssmi\OneDrive\Desktop\nlp\processed_audio\audio_3152_seg_0.wav,UNKNOWN,37.2212848735639,REDUCING ONE SIX ZERO TOWER ONE TO ONE ONE EIGHT ONE,Routine,
2397,5.51,C:\Users\tssmi\OneDrive\Desktop\nlp\processed_audio\audio_3153_seg_0.wav,UNKNOWN,0.0,LUFTHANSA FOUR NOVEMBER LIMA DESCEND FLIGHT LEVEL TWO NINER ZERO CONTACT PRAHA ONE THREE FIVE DECIMAL ONE THREE FIVE GOOD BYE,Routine,
2398,5.34,C:\Users\tssmi\OneDrive\Desktop\nlp\processed_audio\audio_3154_seg_0.wav,UNKNOWN,3.6079730300566695,CSA SEVEN TANGO LINE UP RUNWAY THREE ONE BE READY FOR IMMEDIATE,Routine,
2399,0.96,C:\Users\tssmi\OneDrive\Desktop\nlp\processed_audio\audio_3155_seg_0.wav,UNKNOWN,0.0,LUFTHANSA SEVEN ONE FOUR HELLO RADAR CONTACT CONFIRM YOU REQUEST THREE TWO ZERO CORRECTION THREE THREE ZERO,Routine,
2400,2.72,C:\Users\tssmi\OneDrive\Desktop\nlp\processed_audio\audio_3156_seg_0.wav,UNKNOWN,39.50969222152767,CSA EIGHT ZERO THREE WHEN READY DESCEND FLIGHT LEVEL TWO NINER ZERO LEAVING NOW,Routine,
2401,2.73,C:\Users\tssmi\OneDrive\Desktop\nlp\processed_audio\audio_3157_seg_0.wav,UNKNOWN,44.67093994156421,SKYTRAVEL THREE FIVE JULIETT TURN RIGHT HEADING ONE EIGHT ZERO VECTORING FOR SPACING,Routine,
2402,2.21,C:\Users\tssmi\OneDrive\Desktop\nlp\processed_audio\audio_3158_seg_0.wav,UNKNOWN,76.27944498068783,HOTEL YANKEE HOTEL WIND ZERO FOUR ZERO DEGREES ONE ONE KNOTS RUNWAY ONE ZERO CLEARED TO LAND,Elevated Risk,High Stress (Score: 76)
2403,0.8,C:\Users\tssmi\OneDrive\Desktop\nlp\processed_audio\audio_3159_seg_0.wav,UNKNOWN,19.875150372203223,DESCEND FOUR THOUSAND FEET QNH ONE ZERO TWO THREE CLEARED ILS THREE ONE CSA,Routine,
2404,0.91,C:\Users\tssmi\OneDrive\Desktop\nlp\processed_audio\audio_315_seg_0.wav,UNKNOWN,60.77387096160383,SPEED ONE SIXTY UNTIL FOUR,Routine,
2405,3.07,C:\Users\tssmi\OneDrive\Desktop\nlp\processed_audio\audio_3160_seg_0.wav,UNKNOWN,33.442598720573315,CONFIRM REQUESTED DESCEND,Routine,
2406,3.92,C:\Users\tssmi\OneDrive\Desktop\nlp\processed_audio\audio_3161_seg_0.wav,UNKNOWN,51.44483541298352,DESCEND LEVEL NINER ZERO CSA EIGHT THREE EIGHT WHISKEY,Routine,
2407,1.3,C:\Users\tssmi\OneDrive\Desktop\nlp\processed_audio\audio_3162_seg_0.wav,UNKNOWN,97.44667683355178,ELMEK THEN NORKU TURKISH ONE NINER FIVE THREE,EMERGENCY,Severe Stress Spike (Score: 97)
2408,2.42,C:\Users\tssmi\OneDrive\Desktop\nlp\processed_audio\audio_3163_seg_0.wav,UNKNOWN,45.72007523603783,CONFIRM SIX ROMEO VICTOR AFFIRM,Routine,
2409,3.5,C:\Users\tssmi\OneDrive\Desktop\nlp\processed_audio\audio_3164_seg_0.wav,UNKNOWN,27.87935523279444,YES WE ARE APPROACHING TWO THOUSAND FEET LEFT DOWNWIND,Routine,
2410,2.67,C:\Users\tssmi\OneDrive\Desktop\nlp\processed_audio\audio_3165_seg_0.wav,UNKNOWN,28.09721249257105,CLIMBING LEVEL THREE THREE ZERO AEROFLOT ONE TWO TWO,Routine,
2411,7.2,C:\Users\tssmi\OneDrive\Desktop\nlp\processed_audio\audio_3166_seg_0.wav,UNKNOWN,16.259266327852984,THANK YOU,Routine,
2412,1.25,C:\Users\tssmi\OneDrive\Desktop\nlp\processed_audio\audio_3167_seg_0.wav,UNKNOWN,47.594287216986245,DELTA OSCAR VICTORIA YOU ARE STILL ON THE BERN ARRIVAL FREQUENCY,Routine,
2413,5.5,C:\Users\tssmi\OneDrive\Desktop\nlp\processed_audio\audio_3168_seg_0.wav,UNKNOWN,47.11397904779311,HELI INDIA ECHO LAND ON DISCRETION SWISS HELICOPTER WIND ZERO SEVEN ZERO DEGREES SIX KNOTS,Routine,
2414,4.02,C:\Users\tssmi\OneDrive\Desktop\nlp\processed_audio\audio_3169_seg_0.wav,UNKNOWN,16.79896466854931,CIMBER THREE FIVE TWO FIVE ON PRESENT HEADING CLEARED TO INTERCEPT AND CLEARED FOR ILS APPROACH RUNWAY THREE ONE,Routine,
2415,0.92,C:\Users\tssmi\OneDrive\Desktop\nlp\processed_audio\audio_316_seg_0.wav,UNKNOWN,30.958107478259585,SORRY SAY AGAIN,Minor Anomaly,Potential Communication Hesitation/Anomaly
2416,0.79,C:\Users\tssmi\OneDrive\Desktop\nlp\processed_audio\audio_3170_seg_0.wav,UNKNOWN,61.93771442914038,ONE THREE FOUR NINER TWO FIVE BELGIAN THREE HUNDRED BYE BYE,Routine,
2417,4.68,C:\Users\tssmi\OneDrive\Desktop\nlp\processed_audio\audio_3171_seg_0.wav,UNKNOWN,43.00700066932508,CONTINUE APPROACH TANGO THREE SIX SIX,Routine,
2418,1.17,C:\Users\tssmi\OneDrive\Desktop\nlp\processed_audio\audio_3172_seg_0.wav,UNKNOWN,21.64953894305134,THAT'S GREAT THANK YOU DESCEND FLIGHT LEVEL ONE ZERO ZERO EASY,Routine,
2419,2.14,C:\Users\tssmi\OneDrive\Desktop\nlp\processed_audio\audio_3173_seg_0.wav,UNKNOWN,30.517379731851047,CSA EIGHT ZERO THREE DESCEND FLIGHT LEVEL ONE ZERO ZERO,Routine,
2420,2.89,C:\Users\tssmi\OneDrive\Desktop\nlp\processed_audio\audio_3174_seg_0.wav,UNKNOWN,45.7193289934273,ROGER MAINTAIN FOR A WHILE TRAFFIC BELLOW,Routine,
2421,0.73,C:\Users\tssmi\OneDrive\Desktop\nlp\processed_audio\audio_3175_seg_0.wav,UNKNOWN,32.43970499128218,PRAHA GOOD AFTERNOON,Routine,
2422,0.88,C:\Users\tssmi\OneDrive\Desktop\nlp\processed_audio\audio_3176_seg_0.wav,UNKNOWN,45.47884197861909,CSA SEVEN ECHO CHARLIE TURN LEFT PROCEED DIRECT RAPET,Routine,
2423,3.23,C:\Users\tssmi\OneDrive\Desktop\nlp\processed_audio\audio_3177_seg_0.wav,UNKNOWN,31.85460416626489,STEFANIK TOWER OSCAR MIKE CHARLIE INDIA ALPHA REQUEST,Routine,
2424,5.37,C:\Users\tssmi\OneDrive\Desktop\nlp\processed_audio\audio_3178_seg_0.wav,UNKNOWN,25.099409029830674,LUFTHANSA TWO ALPHA CHARLIE COMMENCE DESCEND,Routine,
2425,5.78,C:\Users\tssmi\OneDrive\Desktop\nlp\processed_audio\audio_3179_seg_0.wav,UNKNOWN,69.56237065376345,LANDING ON DISCRETION FATOTWO FIVE CHARLIE ZULU,Routine,
2426,2.88,C:\Users\tssmi\OneDrive\Desktop\nlp\processed_audio\audio_317_seg_0.wav,UNKNOWN,55.6646381851877,DESCENDING FLIGHT LEVEL ONE THREE ZERO CSA SIX,Routine,
2427,2.76,C:\Users\tssmi\OneDrive\Desktop\nlp\processed_audio\audio_3180_seg_0.wav,UNKNOWN,40.19259303873911,TANGO OSCAR LEAVE THE FREQUENCY BYE BYE,Routine,
2428,6.05,C:\Users\tssmi\OneDrive\Desktop\nlp\processed_audio\audio_3181_seg_0.wav,UNKNOWN,19.93266940205264,NOVEMBER FOUR NINER XRAY LIMA TAXI VIA DELTA LINE UP ZERO FOUR REPORT READY,Routine,
2429,4.5,C:\Users\tssmi\OneDrive\Desktop\nlp\processed_audio\audio_3182_seg_0.wav,UNKNOWN,35.556911820273385,TANGO KILO ALPHA WIND ZERO FOUR ZERO DEGREES ONE ZERO KNOTS ON THE ONE ZERO CLEARED FOR TAKEOFF,Routine,
2430,5.2,C:\Users\tssmi\OneDrive\Desktop\nlp\processed_audio\audio_3183_seg_0.wav,UNKNOWN,29.580133999504525,LUFTHANSA SIX LIMA LIMA ONE THREE THREE THREE NINER ZERO GOOD BYE,Routine,
2431,4.035,C:\Users\tssmi\OneDrive\Desktop\nlp\processed_audio\audio_3184_seg_0.wav,UNKNOWN,78.76718663131183,AUSTRIAN SEVEN ZERO THREE,Elevated Risk,High Stress (Score: 78)
2432,4.31,C:\Users\tssmi\OneDrive\Desktop\nlp\processed_audio\audio_3185_seg_0.wav,UNKNOWN,9.199639367242677,LUFTHANSA SEVEN SIX ONE DESCEND FLIGHT LEVEL THREE ONE ZERO TO CROSS RAPET AT LEVEL,Routine,
2433,3.03,C:\Users\tssmi\OneDrive\Desktop\nlp\processed_audio\audio_3186_seg_0.wav,UNKNOWN,68.28568415809275,OSCAR KILO CHARLIE ALPHA PAPA SQUAWK SEVEN THOUSAND GOOD BYE,Routine,
2434,2.74,C:\Users\tssmi\OneDrive\Desktop\nlp\processed_audio\audio_3187_seg_0.wav,UNKNOWN,41.89552853244653,OSCAR KILO FOXTROT ALPHA OSCAR TAXI TO HOLDING POINT RUNWAY TWO SEVEN VIA ALPHA CHARLIE,Routine,
2435,3.72,C:\Users\tssmi\OneDrive\Desktop\nlp\processed_audio\audio_3188_seg_0.wav,UNKNOWN,33.34382032017945,LEVEL ONE SIX ZERO EASY SIX EIGHT KILO PAPA,Routine,
2436,0.83,C:\Users\tssmi\OneDrive\Desktop\nlp\processed_audio\audio_3189_seg_0.wav,UNKNOWN,21.054057318368365,DESCEND LEVEL ONE HUNDRED FINNAIR SEVEN FIVE WHISKEY,Routine,
2437,1.52,C:\Users\tssmi\OneDrive\Desktop\nlp\processed_audio\audio_318_seg_0.wav,UNKNOWN,100.0,QLINK FOUR ZERO TWO SYDNEY TOWER GOOD MORNING,EMERGENCY,Severe Stress Spike (Score: 100)
2438,4.72,C:\Users\tssmi\OneDrive\Desktop\nlp\processed_audio\audio_3190_seg_0.wav,UNKNOWN,17.25130877296033,ROGER BREAK BREAK HELI DELTA QUEBEC AFTER HOTEL WHISKEY CROSS VIA BERNE CITY THEN HOTEL ECHO,Routine,
2439,4.38,C:\Users\tssmi\OneDrive\Desktop\nlp\processed_audio\audio_3191_seg_0.wav,UNKNOWN,59.653906888522144,REDUCING TWO FIFTY CSA EIGHT THREE FOXTROT,Routine,
2440,2.81,C:\Users\tssmi\OneDrive\Desktop\nlp\processed_audio\audio_3192_seg_0.wav,UNKNOWN,55.97586272055055,HOTEL GOLF DELTA WIND ZERO FOUR ZERO DEGREES SEVEN KNOTS RUNWAY ONE FOUR CLEARED FOR TAKEOFF,Routine,
2441,6.57,C:\Users\tssmi\OneDrive\Desktop\nlp\processed_audio\audio_3193_seg_0.wav,UNKNOWN,0.574881700527925,CATHAY ZERO SIX EIGHT,Routine,
2442,0.79,C:\Users\tssmi\OneDrive\Desktop\nlp\processed_audio\audio_3194_seg_0.wav,UNKNOWN,34.911083668027786,RYANAIR THREE,Routine,
2443,0.85,C:\Users\tssmi\OneDrive\Desktop\nlp\processed_audio\audio_3195_seg_0.wav,UNKNOWN,27.052341895969544,PUSH AND START APPROVED ON POSITION THREE FOXTROT ON SQUAWK FOUR FOUR ZERO TWO EUROTRANS ONE THREE JULIETT,Routine,
2444,1.35,C:\Users\tssmi\OneDrive\Desktop\nlp\processed_audio\audio_3196_seg_0.wav,UNKNOWN,25.88706193612552,NOVEMBER FOUR CHARLIE GOLF CONTACT TOWER ONE ONE EIGHT DECIMAL ONE ZERO FIVE,Routine,
2445,3.42,C:\Users\tssmi\OneDrive\Desktop\nlp\processed_audio\audio_3197_seg_0.wav,UNKNOWN,14.198926295642607,DESCENDING FLIGHT LEVEL NINER ZERO CSA THREE FOXTROT,Routine,
2446,1.65,C:\Users\tssmi\OneDrive\Desktop\nlp\processed_audio\audio_3198_seg_0.wav,UNKNOWN,100.0,PRAHA GOOD MORNING LUFTHANSA TWO FOUR MIKE LEVEL TWO SEVEN SEVEN CLIMBING TWO EIGHT ZERO,EMERGENCY,Severe Stress Spike (Score: 100)
2447,2.68,C:\Users\tssmi\OneDrive\Desktop\nlp\processed_audio\audio_3199_seg_0.wav,UNKNOWN,28.38861288035165,CSA FOUR EIGHT ZERO TURN RIGHT PROCEED DIRECT TO ARTUP,Routine,
2448,0.676,C:\Users\tssmi\OneDrive\Desktop\nlp\processed_audio\audio_319_seg_0.wav,UNKNOWN,100.0,AIRFRANS TWO FOUR EIGHT TWO DESCEND FOUR THOUSAND FEET QNH ONE ZERO ONE EIGHT,EMERGENCY,Severe Stress Spike (Score: 100)
2449,3.73,C:\Users\tssmi\OneDrive\Desktop\nlp\processed_audio\audio_31_seg_0.wav,UNKNOWN,61.54441328496394,DESCEND LEVEL NINER ZERO AND,Routine,
2450,0.76,C:\Users\tssmi\OneDrive\Desktop\nlp\processed_audio\audio_3200_seg_0.wav,UNKNOWN,25.67453103433567,ONE SIX RIGHT CLEARED TO LAND JETEX SEVEN FOUR THREE FOUR,Routine,
2451,3.01,C:\Users\tssmi\OneDrive\Desktop\nlp\processed_audio\audio_3201_seg_0.wav,UNKNOWN,0.0,LEFT HEADING ONE THREE ZERO QUALITY EIGHT NINER SIERRA,Minor Anomaly,Potential Communication Hesitation/Anomaly
2452,1.13,C:\Users\tssmi\OneDrive\Desktop\nlp\processed_audio\audio_3202_seg_0.wav,UNKNOWN,31.40967781204289,YOU NEED TO BACKTRACK YES,Routine,
2453,2.53,C:\Users\tssmi\OneDrive\Desktop\nlp\processed_audio\audio_3203_seg_0.wav,UNKNOWN,19.05116203988928,FRACTION ONE ZERO THREE MIKE WIND ONE FOUR ZERO DEGREES FOUR KNOTS RUNWAY TWO EIGHT CLEARED FOR TAKEOFF,Routine,
2454,3.07,C:\Users\tssmi\OneDrive\Desktop\nlp\processed_audio\audio_3204_seg_0.wav,UNKNOWN,73.43701846164213,ROGER MILES COPIED AND FOUR THOUSAND,Elevated Risk,High Stress (Score: 73)
2455,0.83,C:\Users\tssmi\OneDrive\Desktop\nlp\processed_audio\audio_3205_seg_0.wav,UNKNOWN,62.91510016376199,ONE TWO SEVEN ONE,Routine,
2456,2.59,C:\Users\tssmi\OneDrive\Desktop\nlp\processed_audio\audio_3206_seg_0.wav,UNKNOWN,95.8120968979268,COPY CONTINUE TO FINAL RUNWAY ONE THREE CSA FIVE PAPA CHARLIE,EMERGENCY,Severe Stress Spike (Score: 95)
2457,1.75,C:\Users\tssmi\OneDrive\Desktop\nlp\processed_audio\audio_3207_seg_0.wav,UNKNOWN,40.08469940548963,BAUHINIA TWO ZERO ONE EIGHT CONTACT DEPARTURE GOOD NIGHT,Routine,
2458,3.29,C:\Users\tssmi\OneDrive\Desktop\nlp\processed_audio\audio_3208_seg_0.wav,UNKNOWN,21.23815027118645,LOT FIVE TWO SIX TURN LEFT DIRECT TO AGAVA,Routine,
2459,4.46,C:\Users\tssmi\OneDrive\Desktop\nlp\processed_audio\audio_3209_seg_0.wav,UNKNOWN,0.0,CLEARED TO LAND RUNWAY TWO FIVE MOSQUITO ONE FIVE BRAVO,Routine,
2460,1.05,C:\Users\tssmi\OneDrive\Desktop\nlp\processed_audio\audio_320_seg_0.wav,UNKNOWN,58.93150360687489,HOTEL ECHO XRAY FINAL TWO FIVE FOR TOUCH AND GO,Routine,
2461,0.72,C:\Users\tssmi\OneDrive\Desktop\nlp\processed_audio\audio_3210_seg_0.wav,UNKNOWN,100.0,SIX TWO MILES AND DESCEND FLIGHT LEVEL ONE ZERO ZERO,EMERGENCY,Severe Stress Spike (Score: 100)
2462,1.95,C:\Users\tssmi\OneDrive\Desktop\nlp\processed_audio\audio_3211_seg_0.wav,UNKNOWN,50.46774440866338,LUFTHANSA ONE UNIFORM XRAY CLIMB FLIGHT LEVEL THREE THREE ZERO,Routine,
2463,1.39,C:\Users\tssmi\OneDrive\Desktop\nlp\processed_audio\audio_3212_seg_0.wav,UNKNOWN,23.996408010603243,OSCAR KILO DELTA SIERRA INDIA TURN LEFT HEADING ONE ZERO ZERO,Minor Anomaly,Potential Communication Hesitation/Anomaly
2464,3.6,C:\Users\tssmi\OneDrive\Desktop\nlp\processed_audio\audio_3213_seg_0.wav,UNKNOWN,31.909235743718156,ONE THREE THREE THREE NINER ZERO WITH THE HEADING SIX ONE EIGHT,Routine,
2465,1.25,C:\Users\tssmi\OneDrive\Desktop\nlp\processed_audio\audio_3214_seg_0.wav,UNKNOWN,19.95225432809753,BEELINE THREE PAPA PAPA DESCEND FLIGHT LEVEL ONE THREE ZERO DESCENDING ONE THREE ZERO BEELINE THREE PAPA PAPA,Routine,
2466,0.79,C:\Users\tssmi\OneDrive\Desktop\nlp\processed_audio\audio_3215_seg_0.wav,UNKNOWN,36.96620249048395,LUFTHANSA NINER VICTOR VICTOR DESCEND FLIGHT LEVEL TWO NINER ZERO NINER VICTOR VICTOR DESCENDING TWO NINER ZERO,Routine,
2467,5.34,C:\Users\tssmi\OneDrive\Desktop\nlp\processed_audio\audio_3216_seg_0.wav,UNKNOWN,46.580623361093984,KLM FIVE SIX TANGO RUNWAY THREE ONE CLEARED FOR TAKEOFF WIND CALM BYE BYE,Routine,
2468,3.49,C:\Users\tssmi\OneDrive\Desktop\nlp\processed_audio\audio_3217_seg_0.wav,UNKNOWN,21.79108936056443,OK THERE THERE IS SOME VFR TRAFFIC REALLY CALL YOU IN TWO MINUTES FOR DESCEND,Routine,
2469,2.91,C:\Users\tssmi\OneDrive\Desktop\nlp\processed_audio\audio_3218_seg_0.wav,UNKNOWN,7.087055204077785,GERMANWINGS TWO ONE FOUR ZERO CLIMB FLIGHT LEVEL THREE FOUR ZERO,Routine,
2470,2.5,C:\Users\tssmi\OneDrive\Desktop\nlp\processed_audio\audio_3219_seg_0.wav,UNKNOWN,38.42342261759342,QUALITY EIGHT NINER ZERO TURN LEFT HEADING ZERO FOUR ZERO TO BASE,Routine,
2471,3.7,C:\Users\tssmi\OneDrive\Desktop\nlp\processed_audio\audio_321_seg_0.wav,UNKNOWN,100.0,DESCENDING FLIGHT LEVEL NINER ZERO,EMERGENCY,Severe Stress Spike (Score: 100)
2472,4.74,C:\Users\tssmi\OneDrive\Desktop\nlp\processed_audio\audio_3220_seg_0.wav,UNKNOWN,12.936154087119595,FLIGHT LEVEL THREE FIVE ZERO,Routine,
2473,3.4,C:\Users\tssmi\OneDrive\Desktop\nlp\processed_audio\audio_3221_seg_0.wav,UNKNOWN,57.9595310608342,LUFTHANSA,Routine,
2474,0.76,C:\Users\tssmi\OneDrive\Desktop\nlp\processed_audio\audio_3222_seg_0.wav,UNKNOWN,100.0,ROGER THANK YOU,EMERGENCY,Severe Stress Spike (Score: 100)
2475,4.75,C:\Users\tssmi\OneDrive\Desktop\nlp\processed_audio\audio_3223_seg_0.wav,UNKNOWN,78.31314512842695,TANGO THREE ONE THREE SION GROUND HELLO AGAIN TAXI APPROVED,Elevated Risk,High Stress (Score: 78)
2476,2.4,C:\Users\tssmi\OneDrive\Desktop\nlp\processed_audio\audio_3224_seg_0.wav,UNKNOWN,40.09237577636017,ONE EIGHT ZERO OR LESS,Routine,
2477,2.62,C:\Users\tssmi\OneDrive\Desktop\nlp\processed_audio\audio_3225_seg_0.wav,UNKNOWN,39.22444345804083,LUFT TRANSPORT ONE FIVE FIVE CONTACT RHEIN ONE THREE THREE DECIMAL EIGHT SIX ZERO GOOD BYE,Routine,
2478,1.78,C:\Users\tssmi\OneDrive\Desktop\nlp\processed_audio\audio_3226_seg_0.wav,UNKNOWN,77.51837223219016,HOTEL ECHO XRAY RECLEARED FULL STOP LANDING RUNWAY TWO FIVE,Elevated Risk,High Stress (Score: 77)
2479,4.77,C:\Users\tssmi\OneDrive\Desktop\nlp\processed_audio\audio_3227_seg_0.wav,UNKNOWN,18.601463921839063,DEPARTURE OWN DISCRETION TWO FIVE NEXT ZERO SEVEN SORRY FOR LEAVING HELI HOTEL YANKEE,Routine,
2480,3.15,C:\Users\tssmi\OneDrive\Desktop\nlp\processed_audio\audio_3228_seg_0.wav,UNKNOWN,61.20339335038965,IT IS BALTU FOUR ALPHA TO CLIMB FIVE THOUSAND FEET,Routine,
2481,2.31,C:\Users\tssmi\OneDrive\Desktop\nlp\processed_audio\audio_3229_seg_0.wav,UNKNOWN,13.552208394553084,SKYTRAVEL ONE TWO ZERO ONE YOU MAY EXPECT RUNWAY THREE ONE,Routine,
2482,2.39,C:\Users\tssmi\OneDrive\Desktop\nlp\processed_audio\audio_322_seg_0.wav,UNKNOWN,100.0,STANDBY,EMERGENCY,Severe Stress Spike (Score: 100)
2483,6.15,C:\Users\tssmi\OneDrive\Desktop\nlp\processed_audio\audio_3230_seg_0.wav,UNKNOWN,16.629990536040587,ONE ONE SEVEN HELLO BUT CALL US ON ONE THREE THREE DECIMAL THREE NINER ZERO,Routine,
2484,6.65,C:\Users\tssmi\OneDrive\Desktop\nlp\processed_audio\audio_3231_seg_0.wav,UNKNOWN,37.45089100204135,VISTA JET FOUR SIX SEVEN,Routine,
2485,4.33,C:\Users\tssmi\OneDrive\Desktop\nlp\processed_audio\audio_3232_seg_0.wav,UNKNOWN,52.102644245399496,CLIMB LEVEL THREE FOUR ZERO NINER EIGHT HOTEL,Routine,
2486,1.17,C:\Users\tssmi\OneDrive\Desktop\nlp\processed_audio\audio_3233_seg_0.wav,UNKNOWN,56.80395589175442,CSA FIVE KILO PAPA SPEED TWO FIVE ZERO KNOTS,Routine,
2487,0.8,C:\Users\tssmi\OneDrive\Desktop\nlp\processed_audio\audio_3234_seg_0.wav,UNKNOWN,100.0,LUFTHANSA EIGHT LIMA JULIETT CALL ME ON ONE THREE TWO EIGHT NINER ZERO,EMERGENCY,Severe Stress Spike (Score: 100)
2488,3.34,C:\Users\tssmi\OneDrive\Desktop\nlp\processed_audio\audio_3235_seg_0.wav,UNKNOWN,25.23234563103924,LUFTHANSA SEVEN THREE EIGHT CONFIRM THREE THREE ZERO REQUESTED,Routine,
2489,5.36,C:\Users\tssmi\OneDrive\Desktop\nlp\processed_audio\audio_3236_seg_0.wav,UNKNOWN,30.505110191681904,GOOD DAY ONE TWO ZERO FIVE TWO FIVE BYE,Routine,
2490,2.32,C:\Users\tssmi\OneDrive\Desktop\nlp\processed_audio\audio_3237_seg_0.wav,UNKNOWN,18.602768894255476,CLIMB FLIGHT LEVEL THREE FOUR ZERO EASY FOUR SIX ZERO BRAVO,Routine,
2491,0.97,C:\Users\tssmi\OneDrive\Desktop\nlp\processed_audio\audio_3238_seg_0.wav,UNKNOWN,80.93548995434062,GERMAN WINGS SEVEN PAPA ESTABLISHED INBOUND TRACK,Elevated Risk,High Stress (Score: 80)
2492,3.23,C:\Users\tssmi\OneDrive\Desktop\nlp\processed_audio\audio_3239_seg_0.wav,UNKNOWN,61.48048462989394,ONE ONE NINER TWO,Routine,
2493,2.04,C:\Users\tssmi\OneDrive\Desktop\nlp\processed_audio\audio_323_seg_0.wav,UNKNOWN,46.50196054599685,QUALITY EIGHT NINER SIERRA TAXI ZULU HOTEL HOLD SHORT OF LIMA,Minor Anomaly,Potential Communication Hesitation/Anomaly
2494,3.19,C:\Users\tssmi\OneDrive\Desktop\nlp\processed_audio\audio_3240_seg_0.wav,UNKNOWN,24.97190740763046,CSA FIVE KILO PAPA DESCEND FLIGHT LEVEL NINER ZERO DESCEND FLIGHT LEVEL ONE NINER ZERO CSA FIVE KILO PAPA,Routine,
