segment_index,duration,file_path,speaker_role,stress_score,transcript,alert_level,alert_reason
1661,0.96,C:\Users\tssmi\OneDrive\Desktop\nlp\processed_audio\audio_2492_seg_0.wav,UNKNOWN,23.927529154868616,OK DESCEND FOUR THOUSAND FEET QNH ONE ZERO ONE EIGHT AND DESCEND,Routine,
1662,3.61,C:\Users\tssmi\OneDrive\Desktop\nlp\processed_audio\audio_2493_seg_0.wav,UNKNOWN,20.68068664847218,AEROFLOT ONE TWO THREE LEAVING TWO FOUR ZERO LEVEL TWO NINER ZERO,Routine,
1663,5.43,C:\Users\tssmi\OneDrive\Desktop\nlp\processed_audio\audio_2494_seg_0.wav,UNKNOWN,43.98952555712068,OSCAR SIERRA JULIETT CONTACT PRAHA ONE THREE THREE DECIMAL THREE NINER ZERO,Minor Anomaly,Potential Communication Hesitation/Anomaly
1664,5.54,C:\Users\tssmi\OneDrive\Desktop\nlp\processed_audio\audio_2495_seg_0.wav,UNKNOWN,54.93471516213776,ROGER CONTINUE APPROACH EXPECT TO LAND VACATE GOLF DYNASTY ZERO FIVE ONE,Routine,
1665,2.5,C:\Users\tssmi\OneDrive\Desktop\nlp\processed_audio\audio_2496_seg_0.wav,UNKNOWN,65.40121521360464,EASY THREE ZERO SIX FIVE RUNWAY ONE THREE CLEARED TO LAND WIND ZERO SIX ZERO SEVEN KNOTS,Routine,
1666,4.09,C:\Users\tssmi\OneDrive\Desktop\nlp\processed_audio\audio_2497_seg_0.wav,UNKNOWN,32.601163190445746,SIX ONE TWO PAPA EXPECT SHORTCUT IN FIVE OR SIX MINUTES,Routine,
1667,4.49,C:\Users\tssmi\OneDrive\Desktop\nlp\processed_audio\audio_2498_seg_0.wav,UNKNOWN,32.42770341563355,SLOVAK GOVERNMENT ZERO ZERO FOUR INFORMATION MIKE TIME FIVE SEVEN QNH ONE ZERO ZERO EIGHT CLEARED TO KOSICE FROM RUNWAY ONE THREE VIA NITRA ONE YANKEE DEPARTURE INITIALLY CLIMB ALTITUDE FIVE THOUSAND FEET STARTUP APPROVED SQUAWK SIX SEVEN FOUR SIX,Routine,
1668,6.39,C:\Users\tssmi\OneDrive\Desktop\nlp\processed_audio\audio_2499_seg_0.wav,UNKNOWN,0.0,NAV CHECKER FIVE ONE ONE ROGER QNH ONE ZERO ONE SEVEN REPORTED IN AND GO,Routine,
1669,3.4,C:\Users\tssmi\OneDrive\Desktop\nlp\processed_audio\audio_249_seg_0.wav,UNKNOWN,100.0,COPY SEVEN SEVEN TAXI ON ZULU AND BRAVO HOLD SHORT RUNWAY ONE SIX,EMERGENCY,Severe Stress Spike (Score: 100)
1670,0.74,C:\Users\tssmi\OneDrive\Desktop\nlp\processed_audio\audio_24_seg_0.wav,UNKNOWN,24.946293781759728,LOT THREE NINER PAPA PROCEED TO AGAVA SQUAWK ONE FOUR FIVE TWO,Routine,
1671,2.87,C:\Users\tssmi\OneDrive\Desktop\nlp\processed_audio\audio_2500_seg_0.wav,UNKNOWN,39.84911948883407,CLIMBING FLIGHT LEVEL NINER ZERO CSA SEVEN FOUR TWO,Routine,
1672,2.34,C:\Users\tssmi\OneDrive\Desktop\nlp\processed_audio\audio_2501_seg_0.wav,UNKNOWN,100.0,QATARI SIX ZERO FIVE SIX HELLO RADAR CONTACT SQUAWK FIVE ONE SEVEN FOUR FIVE ONE SEVEN FOUR QATARI SIX ZERO FIVE SIX,EMERGENCY,Severe Stress Spike (Score: 100)
1673,5.515,C:\Users\tssmi\OneDrive\Desktop\nlp\processed_audio\audio_2502_seg_0.wav,UNKNOWN,92.98351329783574,REDUCING ONE SIXTY,EMERGENCY,Severe Stress Spike (Score: 92)
1674,2.54,C:\Users\tssmi\OneDrive\Desktop\nlp\processed_audio\audio_2503_seg_0.wav,UNKNOWN,45.53088141707615,VIA DELTA AND GROUND TWO ONE NINER BYE BYE SEVENAIR EIGHT FIVE ZERO ZERO,Routine,
1675,3.69,C:\Users\tssmi\OneDrive\Desktop\nlp\processed_audio\audio_2504_seg_0.wav,UNKNOWN,49.38100868190575,BRITAIR NINER ZERO TWO,Routine,
1676,1.2,C:\Users\tssmi\OneDrive\Desktop\nlp\processed_audio\audio_2505_seg_0.wav,UNKNOWN,37.21800777181227,TANGO THREE THREE ONE NUMBER ONE IS NOW ON THE RIGHT BASE,Routine,
1677,0.82,C:\Users\tssmi\OneDrive\Desktop\nlp\processed_audio\audio_2506_seg_0.wav,UNKNOWN,25.865514340787925,LOMKI,Routine,
1678,1.95,C:\Users\tssmi\OneDrive\Desktop\nlp\processed_audio\audio_2507_seg_0.wav,UNKNOWN,31.12337223302843,THAI NINER TWO ZERO PRAHA GOOD MORNING RADAR CONTACT DESCEND TO FLIGHT LEVEL THREE ZERO ZERO REACH LEVEL BY RAPET,Routine,
1679,2.52,C:\Users\tssmi\OneDrive\Desktop\nlp\processed_audio\audio_2508_seg_0.wav,UNKNOWN,45.70121516068724,AIR BERLIN EIGHT SEVEN VICTOR PRAHA HELLO RADAR CONTACT,Routine,
1680,5.93,C:\Users\tssmi\OneDrive\Desktop\nlp\processed_audio\audio_2509_seg_0.wav,UNKNOWN,0.8627289108474798,ROGER,Routine,
1681,3.15,C:\Users\tssmi\OneDrive\Desktop\nlp\processed_audio\audio_250_seg_0.wav,UNKNOWN,49.55567677698169,EXPECT CLIMB IN TWO MINUTES OPPOSITE TRAFFIC,Routine,
1682,1.7,C:\Users\tssmi\OneDrive\Desktop\nlp\processed_audio\audio_2510_seg_0.wav,UNKNOWN,57.522640570257,RUNWAY ONE SIX RIGHT CLEARED TO LAND QANTAS SEVENTY SEVEN ZERO ONE,Routine,
1683,0.76,C:\Users\tssmi\OneDrive\Desktop\nlp\processed_audio\audio_2511_seg_0.wav,UNKNOWN,26.64894383521046,CLEARED TO LINE UP RUNWAY,Routine,
1684,4.66,C:\Users\tssmi\OneDrive\Desktop\nlp\processed_audio\audio_2512_seg_0.wav,UNKNOWN,24.081943948551853,SPEEDBIRD EIGHT SIX ZERO CONTACT RUZYNE GROUND ONE TWO ONE DECIMAL NINER BYE BYE,Routine,
1685,3.83,C:\Users\tssmi\OneDrive\Desktop\nlp\processed_audio\audio_2513_seg_0.wav,UNKNOWN,52.47578065474831,EIGHTEEN ONE CIMBER THREE FIVE TWO FIVE CSA FOUR NINER THREE DESCEND ALTITUDE FOUR THOUSAND FEET QNH ONE ZERO TWO ONE,Routine,
1686,1.11,C:\Users\tssmi\OneDrive\Desktop\nlp\processed_audio\audio_2514_seg_0.wav,UNKNOWN,16.289254279311038,ONE THREE FOUR FOUR SEVEN FIVE ARIANA SEVEN ZERO THREE GOOD BYE,Routine,
1687,1.66,C:\Users\tssmi\OneDrive\Desktop\nlp\processed_audio\audio_2515_seg_0.wav,UNKNOWN,47.98833930814143,TOWER HELLO AGAIN AIR PORTUGAL NINER TWO SIX APPROACHING RIGHT TWO EIGHT KILO,Routine,
1688,3.85,C:\Users\tssmi\OneDrive\Desktop\nlp\processed_audio\audio_2516_seg_0.wav,UNKNOWN,27.996668811753533,HOTEL ECHO XRAY DOWNWIND TWO FIVE FOR TOUCH AND GO,Routine,
1689,2.78,C:\Users\tssmi\OneDrive\Desktop\nlp\processed_audio\audio_2517_seg_0.wav,UNKNOWN,26.05121481862238,BAIR NINER FIVE ONE STAND BY CALL YOU BACK,Routine,
1690,1.39,C:\Users\tssmi\OneDrive\Desktop\nlp\processed_audio\audio_2518_seg_0.wav,UNKNOWN,25.531803818754163,EMIRATES ONE THREE NINER TAXI VIA FOXTROT CROSS RUNWAY ONE TWO GOLF JULIETT STAND ONE FOUR ALPHA,Routine,
1691,2.84,C:\Users\tssmi\OneDrive\Desktop\nlp\processed_audio\audio_2519_seg_0.wav,UNKNOWN,0.0,HOTEL CHARLIE PAPA BELOW FLIGHT LEVEL ONE HUNDRED,Routine,
1692,2.46,C:\Users\tssmi\OneDrive\Desktop\nlp\processed_audio\audio_251_seg_0.wav,UNKNOWN,1.7352476984245016,WIND TWO FIVE ZERO DEGREES TWO TWO KNOTS RUNWAY TWO FIVE CLEARED TO LAND,Routine,
1693,2.88,C:\Users\tssmi\OneDrive\Desktop\nlp\processed_audio\audio_2520_seg_0.wav,UNKNOWN,0.7051764115898251,TO EVENING,Routine,
1694,3.49,C:\Users\tssmi\OneDrive\Desktop\nlp\processed_audio\audio_2521_seg_0.wav,UNKNOWN,45.668985364832366,SIX ZERO,Routine,
1695,2.64,C:\Users\tssmi\OneDrive\Desktop\nlp\processed_audio\audio_2522_seg_0.wav,UNKNOWN,70.76243147589554,ONE THREE FOUR EIGHT SEVEN FIVE,Elevated Risk,High Stress (Score: 70)
1696,0.91,C:\Users\tssmi\OneDrive\Desktop\nlp\processed_audio\audio_2523_seg_0.wav,UNKNOWN,17.97533520799275,NAV CHECKER FIVE ONE ONE TOWER HELLO AGAIN REPORT GOING AROUND,Routine,
1697,4.31,C:\Users\tssmi\OneDrive\Desktop\nlp\processed_audio\audio_2524_seg_0.wav,UNKNOWN,54.30734871554329,LUFTHANSA EIGHT HOTEL HOTEL SQUAWK ONE FOUR SEVEN THREE CONTACT PRAHA ONE THREE THREE POINT THREE NINER ZERO GOOD BYE,Routine,
1698,3.3,C:\Users\tssmi\OneDrive\Desktop\nlp\processed_audio\audio_2525_seg_0.wav,UNKNOWN,18.819282648143588,HOTEL GOLF PAPA FREQUENCY CHANGE APPROVED GOOD BYE,Routine,
1699,2.85,C:\Users\tssmi\OneDrive\Desktop\nlp\processed_audio\audio_2526_seg_0.wav,UNKNOWN,62.9631667130238,FOXTROT LIMA DELTA SION BONJOUR QNH ONE ZERO TWO THREE WIND CALM RUNWAY TWO FIVE CLEARED FOR TAKEOFF REPORT NOVEMBER WHISKEY,Routine,
1700,1.39,C:\Users\tssmi\OneDrive\Desktop\nlp\processed_audio\audio_2527_seg_0.wav,UNKNOWN,81.75090797565291,NOR SHUTTLE ONE FIVE ONE FOUR TURN RIGHT HEADING TWO ONE ZERO,Elevated Risk,High Stress (Score: 81)
1701,1.36,C:\Users\tssmi\OneDrive\Desktop\nlp\processed_audio\audio_2528_seg_0.wav,UNKNOWN,100.0,LOOKING OUT FOR A TRAFFIC OSCAR MIKE KILO LIMA LIMA,EMERGENCY,Severe Stress Spike (Score: 100)
1702,0.88,C:\Users\tssmi\OneDrive\Desktop\nlp\processed_audio\audio_2529_seg_0.wav,UNKNOWN,72.09605334039257,LOOKING OUT HOTEL OSCAR DELTA,Elevated Risk,High Stress (Score: 72)
1703,3.44,C:\Users\tssmi\OneDrive\Desktop\nlp\processed_audio\audio_252_seg_0.wav,UNKNOWN,32.53240372988185,CLEARED TO LAND RUNWAY ONE FOUR DELTA HOTEL GOLF,Routine,
1704,2.03,C:\Users\tssmi\OneDrive\Desktop\nlp\processed_audio\audio_2530_seg_0.wav,UNKNOWN,50.12900642551022,ROGER JUST TRAFFIC IS ON YOUR ELEVEN O'CLOCK ONE MILE,Routine,
1705,2.06,C:\Users\tssmi\OneDrive\Desktop\nlp\processed_audio\audio_2531_seg_0.wav,UNKNOWN,25.09299783055204,ROGER HOTEL FOXTROT KILO REPORT WHISKEY QNH ONE ZERO TWO THREE,Routine,
1706,1.39,C:\Users\tssmi\OneDrive\Desktop\nlp\processed_audio\audio_2532_seg_0.wav,UNKNOWN,24.92738876913892,DESCENDING FLIGHT LEVEL ONE ZERO ZERO KEEP SPEED,Routine,
1707,5.54,C:\Users\tssmi\OneDrive\Desktop\nlp\processed_audio\audio_2533_seg_0.wav,UNKNOWN,53.44351693350907,ROGER START AND PUSH APPROVED,Routine,
1708,5.68,C:\Users\tssmi\OneDrive\Desktop\nlp\processed_audio\audio_2534_seg_0.wav,UNKNOWN,11.838766942386933,AT FLIGHT LEVEL ONE ZERO ZERO NO SPEED RESTRICTIONS AND,Routine,
1709,7.095,C:\Users\tssmi\OneDrive\Desktop\nlp\processed_audio\audio_2535_seg_0.wav,UNKNOWN,13.215670173212146,BEAIR ONE FOUR ZERO INTERCEPT LOCALIZER RUNWAY THREE ONE,Routine,
1710,1.83,C:\Users\tssmi\OneDrive\Desktop\nlp\processed_audio\audio_2536_seg_0.wav,UNKNOWN,46.32582025372957,CLIMB FLIGHT LEVEL ONE THREE ZERO,Routine,
1711,4.31,C:\Users\tssmi\OneDrive\Desktop\nlp\processed_audio\audio_2537_seg_0.wav,UNKNOWN,41.44470087613789,EASY SIX EIGHT KILO PAPA TURN LEFT HEADING THREE ONE ZERO,Routine,
1712,3.45,C:\Users\tssmi\OneDrive\Desktop\nlp\processed_audio\audio_2538_seg_0.wav,UNKNOWN,34.55892766461481,FIVE HUNDRED OR MORE SHAMROCK SIX SEVEN XRAY,Routine,
1713,1.73,C:\Users\tssmi\OneDrive\Desktop\nlp\processed_audio\audio_2539_seg_0.wav,UNKNOWN,56.39800950068063,LUFTHANSA SEVEN ONE FOUR ONE THREE FOUR EIGHT SEVEN FIVE GOOD DAY,Routine,
1714,6.225,C:\Users\tssmi\OneDrive\Desktop\nlp\processed_audio\audio_253_seg_0.wav,UNKNOWN,55.14565209569968,THREE ZERO AIRFRANS,Routine,
1715,6.64,C:\Users\tssmi\OneDrive\Desktop\nlp\processed_audio\audio_2540_seg_0.wav,UNKNOWN,4.103157149396076,CLIMB FLIGHT LEVEL EIGHT ZERO,Routine,
1716,5.885,C:\Users\tssmi\OneDrive\Desktop\nlp\processed_audio\audio_2541_seg_0.wav,UNKNOWN,44.56184661128579,LUFTHANSA SEVEN TWO SEVEN ONE THREE TWO FIVE FIVE ZERO GOOD DAY,Routine,
1717,3.83,C:\Users\tssmi\OneDrive\Desktop\nlp\processed_audio\audio_2542_seg_0.wav,UNKNOWN,8.555233802069438,LUFTHANSA FOUR YANKEE MIKE RUNWAY ONE THREE CLEARED TO LAND WIND ZERO FIVE ZERO DEGREES FOUR KNOTS,Routine,
1718,1.46,C:\Users\tssmi\OneDrive\Desktop\nlp\processed_audio\audio_2543_seg_0.wav,UNKNOWN,44.51571515259522,TWO LUFTHANSA FIVE TWO FIVE FIVE ZERO,Routine,
1719,3.18,C:\Users\tssmi\OneDrive\Desktop\nlp\processed_audio\audio_2544_seg_0.wav,UNKNOWN,3.635531519242441,CSA NINER TWO ONE SPEED ONE EIGHT ZERO KNOTS,Routine,
1720,1.78,C:\Users\tssmi\OneDrive\Desktop\nlp\processed_audio\audio_2545_seg_0.wav,UNKNOWN,54.95932524382313,CSA FOUR NINER FIVE DESCEND FLIGHT LEVEL NINER ZERO AND CONTACT RUZYNE RADAR ONE ONE NINER DECIMAL,Routine,
1721,3.06,C:\Users\tssmi\OneDrive\Desktop\nlp\processed_audio\audio_2546_seg_0.wav,UNKNOWN,0.0,CLIMB FLIGHT LEVEL THREE THREE ZERO CSA FOUR ZERO SIX,Routine,
1722,4.59,C:\Users\tssmi\OneDrive\Desktop\nlp\processed_audio\audio_2547_seg_0.wav,UNKNOWN,49.8284393365815,LUFTHANSA TWO UNIFORM XRAY TURN LEFT HEADING ZERO EIGHT ZERO,Routine,
1723,5.4,C:\Users\tssmi\OneDrive\Desktop\nlp\processed_audio\audio_2548_seg_0.wav,UNKNOWN,0.8003673260246842,LUFTHANSA FOUR CHARLIE KILO CONTACT BRATISLAVA ON ONE THREE FOUR FOUR SEVEN FIVE,Routine,
1724,2.42,C:\Users\tssmi\OneDrive\Desktop\nlp\processed_audio\audio_2549_seg_0.wav,UNKNOWN,39.426566741815854,THANK YOU THREE ZERO FIVE VICTOR,Routine,
1725,3.11,C:\Users\tssmi\OneDrive\Desktop\nlp\processed_audio\audio_254_seg_0.wav,UNKNOWN,71.46057552700326,KLM THREE FIVE ONE SPEED TWO THREE ZERO KNOTS OR LESS BASE LEG IN ONE MINUTE,Elevated Risk,High Stress (Score: 71)
1726,3.135,C:\Users\tssmi\OneDrive\Desktop\nlp\processed_audio\audio_2550_seg_0.wav,UNKNOWN,66.05330951116584,LOT THREE NINER TWO PROCEED DIRECT AGAVA CONTACT PRAHA ONE THREE THREE DECIMAL THREE NINER ZERO GOOD BYE,Routine,
1727,3.44,C:\Users\tssmi\OneDrive\Desktop\nlp\processed_audio\audio_2551_seg_0.wav,UNKNOWN,37.6510048161789,LOT THREE SIX ONE CLIMB FLIGHT LEVEL THREE FOUR ZERO,Routine,
1728,1.12,C:\Users\tssmi\OneDrive\Desktop\nlp\processed_audio\audio_2552_seg_0.wav,UNKNOWN,32.647190049863866,CLIMB FLIGHT LEVEL THREE FOUR ZERO AND PRAHA ONE THREE THREE THREE NINER ZERO BYE KLM ONE EIGHT FOUR FIVE,Routine,
1729,4.94,C:\Users\tssmi\OneDrive\Desktop\nlp\processed_audio\audio_2553_seg_0.wav,UNKNOWN,35.48255433419821,CONDOR ZERO FOUR TWO CONTACT PRAHA ONE THREE FOUR DECIMAL FIVE NINER ZERO GOOD BYE,Routine,
1730,3.22,C:\Users\tssmi\OneDrive\Desktop\nlp\processed_audio\audio_2554_seg_0.wav,UNKNOWN,6.921054841898879,FLIGHT LEVEL THREE FOUR ZERO RYANAIR,Routine,
1731,2.94,C:\Users\tssmi\OneDrive\Desktop\nlp\processed_audio\audio_2555_seg_0.wav,UNKNOWN,34.37265020720896,HELLO EASY FIVE FOUR NINER EIGHT RUZYNE TOWER LINE UP RUNWAY ONE THREE,Routine,
1732,1.29,C:\Users\tssmi\OneDrive\Desktop\nlp\processed_audio\audio_2556_seg_0.wav,UNKNOWN,22.501277673251284,DESCENDING FOUR THOUSAND FEET QNH ONE ZERO TWO THREE CLEARED THE ILS APPROACH,Routine,
1733,2.53,C:\Users\tssmi\OneDrive\Desktop\nlp\processed_audio\audio_2557_seg_0.wav,UNKNOWN,57.35501013642127,MAJESTIC ONE THREE TWO STANDBY CONTINUE VIA FLIGHT PLAN ROUTE,Routine,
1734,2.72,C:\Users\tssmi\OneDrive\Desktop\nlp\processed_audio\audio_2558_seg_0.wav,UNKNOWN,55.48030167454839,YES I THINK SO BUT THANK YOU,Routine,
1735,4.3,C:\Users\tssmi\OneDrive\Desktop\nlp\processed_audio\audio_2559_seg_0.wav,UNKNOWN,64.97195037588033,TWO ONE FIVE,Routine,
1736,2.32,C:\Users\tssmi\OneDrive\Desktop\nlp\processed_audio\audio_255_seg_0.wav,UNKNOWN,100.0,AFFIRM CLEARED ILS APPROACH,EMERGENCY,Severe Stress Spike (Score: 100)
1737,5.58,C:\Users\tssmi\OneDrive\Desktop\nlp\processed_audio\audio_2560_seg_0.wav,UNKNOWN,5.351922122723771,CLEARED FOR TAKEOFF RUNWAY THREE ONE AUSTRIAN SEVEN ZERO EIGHT PAPA,Routine,
1738,4.41,C:\Users\tssmi\OneDrive\Desktop\nlp\processed_audio\audio_2561_seg_0.wav,UNKNOWN,20.561420903881142,ROGER NOW CONTACT PRAHA ON ONE THREE FOUR FIVE NINER ZERO PLEASE GOOD,Routine,
1739,4.57,C:\Users\tssmi\OneDrive\Desktop\nlp\processed_audio\audio_2562_seg_0.wav,UNKNOWN,51.32759272347592,AIR BERLIN ONE ONE FIVE QUEBEC PROCEED TO RAPET,Routine,
1740,3.88,C:\Users\tssmi\OneDrive\Desktop\nlp\processed_audio\audio_2563_seg_0.wav,UNKNOWN,44.14479971214798,RHEIN RADAR VIETNAM FIVE TWO FOUR HELLO FLIGHT LEVEL THREE THREE ZERO,Routine,
1741,2.29,C:\Users\tssmi\OneDrive\Desktop\nlp\processed_audio\audio_2564_seg_0.wav,UNKNOWN,22.945138743191457,SWISS ONE TWO FIVE VICTOR RUZYNE TOWER ROGER SO TAXI HOLDING POINT RUNWAY THREE ONE VIA TAXIWAY ROMEO VIA ROMEO TO THREE ONE SWISS ONE TWO FIVE VICTOR,Routine,
1742,0.77,C:\Users\tssmi\OneDrive\Desktop\nlp\processed_audio\audio_2565_seg_0.wav,UNKNOWN,34.49690809688858,ROGER RIGHT HEADING TWO NINER ZERO FURTHER CLIMB FOUR THOUSAND FEET BLINE EIGHT HOTEL TANGO,Routine,
1743,1.57,C:\Users\tssmi\OneDrive\Desktop\nlp\processed_audio\audio_2566_seg_0.wav,UNKNOWN,74.38713900086996,PRAHA RADAR CSA NINER DELTA SIERRA,Elevated Risk,High Stress (Score: 74); Potential Communication Hesitation/Anomaly
1744,5.47,C:\Users\tssmi\OneDrive\Desktop\nlp\processed_audio\audio_2567_seg_0.wav,UNKNOWN,15.567717474120954,NINER ONE ROMEO LEFT HEADING TWO FOUR ZERO,Routine,
1745,1.35,C:\Users\tssmi\OneDrive\Desktop\nlp\processed_audio\audio_2568_seg_0.wav,UNKNOWN,92.24380493795545,LINING UP RUNWAY THREE ONE AND WAIT,EMERGENCY,Severe Stress Spike (Score: 92)
1746,0.89,C:\Users\tssmi\OneDrive\Desktop\nlp\processed_audio\audio_2569_seg_0.wav,UNKNOWN,43.793018218033765,LUFTHANSA EIGHT KILO ALPHA PROCEED DIRECT RAPET,Routine,
1747,3.44,C:\Users\tssmi\OneDrive\Desktop\nlp\processed_audio\audio_256_seg_0.wav,UNKNOWN,20.90653387915016,TWO HOTEL,Routine,
1748,3.13,C:\Users\tssmi\OneDrive\Desktop\nlp\processed_audio\audio_2570_seg_0.wav,UNKNOWN,6.959924258238928,SPEED TWO SIX ZERO CSA FIVE THREE SEVEN MAINTAINING FLIGHT LEVEL ONE HUNDRED,Routine,
1749,5.29,C:\Users\tssmi\OneDrive\Desktop\nlp\processed_audio\audio_2571_seg_0.wav,UNKNOWN,83.0594464764338,GOOD EVENING PRAHA,Elevated Risk,High Stress (Score: 83)
1750,5.61,C:\Users\tssmi\OneDrive\Desktop\nlp\processed_audio\audio_2572_seg_0.wav,UNKNOWN,64.4279035034383,SIERRA PAPA SIERRA APPROACHING NINER ZERO,Minor Anomaly,Potential Communication Hesitation/Anomaly
1751,1.42,C:\Users\tssmi\OneDrive\Desktop\nlp\processed_audio\audio_2573_seg_0.wav,UNKNOWN,100.0,DESCEND LEVEL ONE THREE ZERO SWISS FOUR SEVEN TWO ECHO NOR SHUTTLE THREE FIVE EIGHT ZERO TURN RIGHT HEADING TWO FOUR ZERO,EMERGENCY,Severe Stress Spike (Score: 100)
1752,2.22,C:\Users\tssmi\OneDrive\Desktop\nlp\processed_audio\audio_2574_seg_0.wav,UNKNOWN,100.0,OK IF ITS CONVENIENT SO MAINTAIN THREE FOUR ZERO,EMERGENCY,Severe Stress Spike (Score: 100)
1753,3.35,C:\Users\tssmi\OneDrive\Desktop\nlp\processed_audio\audio_2575_seg_0.wav,UNKNOWN,57.46363690880256,CONTINUE CLIMB ONE TWO ZERO OPERA THREE HUNDRED,Routine,
1754,2.19,C:\Users\tssmi\OneDrive\Desktop\nlp\processed_audio\audio_2576_seg_0.wav,UNKNOWN,45.40597271289157,RUNWAY ZERO FOUR ONE TWO ONE DECIMAL NINER CSA ONE DELTA ZULU,Routine,
1755,6.19,C:\Users\tssmi\OneDrive\Desktop\nlp\processed_audio\audio_2577_seg_0.wav,UNKNOWN,16.232780706592933,TWO SEVEN EIGHT,Routine,
1756,1.85,C:\Users\tssmi\OneDrive\Desktop\nlp\processed_audio\audio_2578_seg_0.wav,UNKNOWN,47.20733545455081,COPY IT LOT FIVE TWO SEVEN,Routine,
1757,3.5,C:\Users\tssmi\OneDrive\Desktop\nlp\processed_audio\audio_2579_seg_0.wav,UNKNOWN,62.31762358420018,ONE FOUR NINER,Routine,
1758,3.31,C:\Users\tssmi\OneDrive\Desktop\nlp\processed_audio\audio_257_seg_0.wav,UNKNOWN,19.40767986140015,GOSEK SAY AGAIN PLEASE,Minor Anomaly,Potential Communication Hesitation/Anomaly
1759,4.62,C:\Users\tssmi\OneDrive\Desktop\nlp\processed_audio\audio_2580_seg_0.wav,UNKNOWN,39.53472027969557,SKYTRAVEL EIGHT TWO FOUR LINE UP RUNWAY ONE THREE,Routine,
1760,2.14,C:\Users\tssmi\OneDrive\Desktop\nlp\processed_audio\audio_2581_seg_0.wav,UNKNOWN,59.89360960692592,WE CONTINUE,Routine,
1761,0.75,C:\Users\tssmi\OneDrive\Desktop\nlp\processed_audio\audio_2582_seg_0.wav,UNKNOWN,75.91054606685938,SEVEN EIGHT SEVEN RIGHT VIA DELTA AND ONE TWO ONE NINER SEE YOU LATER,Elevated Risk,High Stress (Score: 75)
1762,2.91,C:\Users\tssmi\OneDrive\Desktop\nlp\processed_audio\audio_2583_seg_0.wav,UNKNOWN,73.82774543230028,PRAHA HELLO,Elevated Risk,High Stress (Score: 73)
1763,3.57,C:\Users\tssmi\OneDrive\Desktop\nlp\processed_audio\audio_2584_seg_0.wav,UNKNOWN,48.95994931359724,CSA SEVEN SIX FOUR TURN RIGHT PROCEED DIRECT TO RAPET,Routine,
1764,1.12,C:\Users\tssmi\OneDrive\Desktop\nlp\processed_audio\audio_2585_seg_0.wav,UNKNOWN,30.263963495780843,LAND RUNWAY THREE ONE CALIBRA FOUR ZERO,Routine,
1765,5.12,C:\Users\tssmi\OneDrive\Desktop\nlp\processed_audio\audio_2586_seg_0.wav,UNKNOWN,24.536206555176143,LUFTHANSA TWO FIVE THREE ZERO SQUAWK ONE FOUR SIX THREE CLIMB TO FLIGHT LEVEL THREE FOUR ZERO,Routine,
1766,7.73,C:\Users\tssmi\OneDrive\Desktop\nlp\processed_audio\audio_2587_seg_0.wav,UNKNOWN,29.17452390564044,LIMA CHARLIE OUT OF THREE THOUSAND FEET CLIMBING FIVE THOUSAND,Routine,
1767,5.6,C:\Users\tssmi\OneDrive\Desktop\nlp\processed_audio\audio_2588_seg_0.wav,UNKNOWN,13.249053449011171,FLIGHT LEVEL THREE FIVE ZERO IS AVAILABLE WITH MACH POINT EIGHT FOUR OR LESS,Routine,
1768,4.67,C:\Users\tssmi\OneDrive\Desktop\nlp\processed_audio\audio_2589_seg_0.wav,UNKNOWN,21.77532042503149,RUZYNE TOWER,Routine,
1769,3.12,C:\Users\tssmi\OneDrive\Desktop\nlp\processed_audio\audio_258_seg_0.wav,UNKNOWN,0.0,CONTINUE APPROACH,Routine,
1770,1.02,C:\Users\tssmi\OneDrive\Desktop\nlp\processed_audio\audio_2590_seg_0.wav,UNKNOWN,56.29759179311575,SKYSHUTTLE ONE ONE FOUR ZERO HELLO RADAR CONTACT DESCEND FLIGHT LEVEL THREE ONE ZERO,Routine,
1771,5.74,C:\Users\tssmi\OneDrive\Desktop\nlp\processed_audio\audio_2591_seg_0.wav,UNKNOWN,28.640365947890647,DESCENDING THREE HUNDRED ONE THOUSAND EIGHT HUNDRED PER MINUTE LUFTHANSA SEVEN SEVEN,Routine,
1772,5.74,C:\Users\tssmi\OneDrive\Desktop\nlp\processed_audio\audio_2592_seg_0.wav,UNKNOWN,80.85822363510027,DELTA CHARLIE CHARLIE FOXTROT FOXTROT HELLO RADAR CONTACT DESCEND FLIGHT LEVEL THREE FOUR ZERO,Elevated Risk,High Stress (Score: 80)
1773,1.81,C:\Users\tssmi\OneDrive\Desktop\nlp\processed_audio\audio_2593_seg_0.wav,UNKNOWN,29.792765664286865,TANGO PAPA DESCENDING NINER ZERO ON PRESENT HEADING,Routine,
1774,1.75,C:\Users\tssmi\OneDrive\Desktop\nlp\processed_audio\audio_2594_seg_0.wav,UNKNOWN,13.408728086704272,CLEARED TO LAND ONE THREE CIMBER THREE FIVE,Routine,
1775,3.26,C:\Users\tssmi\OneDrive\Desktop\nlp\processed_audio\audio_2595_seg_0.wav,UNKNOWN,25.642564325922923,QUALITY EIGHT NINER SIERRA CONTACT TOWER ONE ONE EIGHT DECIMAL ONE GOOD DAY TOWER EIGHT DECIMAL ONE GOOD DAY QUALITY EIGHT,Minor Anomaly,Potential Communication Hesitation/Anomaly
1776,1.14,C:\Users\tssmi\OneDrive\Desktop\nlp\processed_audio\audio_2596_seg_0.wav,UNKNOWN,49.56181628578342,TWO ZERO DEGREES TO THE RIGHT LUFTHANSA NINER LIMA CHARLIE,Routine,
1777,3.06,C:\Users\tssmi\OneDrive\Desktop\nlp\processed_audio\audio_2597_seg_0.wav,UNKNOWN,13.298345804057035,CSA EIGHT MIKE TWO TURN LEFT PROCEED DIRECT TO CERNO,Routine,
1778,3.22,C:\Users\tssmi\OneDrive\Desktop\nlp\processed_audio\audio_2598_seg_0.wav,UNKNOWN,6.823603578342521,LINE UP RUNWAY ONE THREE AND WAIT CSA NINER THREE ZERO,Routine,
1779,6.485,C:\Users\tssmi\OneDrive\Desktop\nlp\processed_audio\audio_2599_seg_0.wav,UNKNOWN,19.70677104439209,WHAT LEVEL DO YOU REQUEST,Routine,
1780,4.46,C:\Users\tssmi\OneDrive\Desktop\nlp\processed_audio\audio_259_seg_0.wav,UNKNOWN,53.46503050560304,CSA TWO MIKE DELTA CONTINUE PRESENT HEADING,Routine,
1781,3.01,C:\Users\tssmi\OneDrive\Desktop\nlp\processed_audio\audio_25_seg_0.wav,UNKNOWN,100.0,THREE NINER ZERO QUALITY ZERO TWO SEVEN HAVE A GOOD DAY,EMERGENCY,Severe Stress Spike (Score: 100)
1782,3.71,C:\Users\tssmi\OneDrive\Desktop\nlp\processed_audio\audio_2600_seg_0.wav,UNKNOWN,34.881251249043856,TWO BEAIR FIVE,Routine,
1783,4.9,C:\Users\tssmi\OneDrive\Desktop\nlp\processed_audio\audio_2601_seg_0.wav,UNKNOWN,5.648353423176609,CLIMB ONE TWO ZERO BEAIR ONE,Routine,
1784,3.24,C:\Users\tssmi\OneDrive\Desktop\nlp\processed_audio\audio_2602_seg_0.wav,UNKNOWN,100.0,SKYTRAVEL ONE ZERO THREE NINER WE REQUEST FURTHER DESCEND,EMERGENCY,Severe Stress Spike (Score: 100)
1785,4.54,C:\Users\tssmi\OneDrive\Desktop\nlp\processed_audio\audio_2603_seg_0.wav,UNKNOWN,68.22731628279499,LUFTHANSA CARGO EIGHT FIVE ZERO NINER DESCENDING LEVEL THREE HUNDRED TO BE LEVEL AT RAPET,Routine,
1786,2.54,C:\Users\tssmi\OneDrive\Desktop\nlp\processed_audio\audio_2604_seg_0.wav,UNKNOWN,23.62416155672954,ITS APPROVED PROCEED TO KOLAD,Routine,
1787,2.99,C:\Users\tssmi\OneDrive\Desktop\nlp\processed_audio\audio_2605_seg_0.wav,UNKNOWN,43.31713493600263,AUSTRIAN THREE TWO FOUR GOLF HELLO RADAR CONTACT,Routine,
1788,2.21,C:\Users\tssmi\OneDrive\Desktop\nlp\processed_audio\audio_2606_seg_0.wav,UNKNOWN,100.0,AFFIRM ONE TWO SEVEN EIGHT TWO FIVE,EMERGENCY,Severe Stress Spike (Score: 100)
1789,2.89,C:\Users\tssmi\OneDrive\Desktop\nlp\processed_audio\audio_2607_seg_0.wav,UNKNOWN,53.99905160852095,FOUR THREE THREE MAINTAINING THREE FOUR ZERO INBOUND,Routine,
1790,3.04,C:\Users\tssmi\OneDrive\Desktop\nlp\processed_audio\audio_2608_seg_0.wav,UNKNOWN,29.14676807654007,NOR SHUTTLE ONE FIVE ONE FOUR DESCEND FOUR THOUSAND FEET AND RIGHT HEADING ONE EIGHT ZERO,Routine,
1791,3.61,C:\Users\tssmi\OneDrive\Desktop\nlp\processed_audio\audio_2609_seg_0.wav,UNKNOWN,57.0906451171459,GOOD EVENING EL AL FIVE,Routine,
1792,1.295,C:\Users\tssmi\OneDrive\Desktop\nlp\processed_audio\audio_260_seg_0.wav,UNKNOWN,46.30098499531817,HELI CHARLIE ZULU ROGER REPORT GROUND COMPLETED,Routine,
1793,5.7,C:\Users\tssmi\OneDrive\Desktop\nlp\processed_audio\audio_2610_seg_0.wav,UNKNOWN,39.43440617771576,SION HELI HOTEL BRAVO ZULU CHARLIE ZULU WE JUST UPON VAL-D'ANNIVIER LOW ALTITUDE FOR HOOK MISSION ETABLISHED FOR ONE LOW ALTITUDE,Routine,
1794,4.37,C:\Users\tssmi\OneDrive\Desktop\nlp\processed_audio\audio_2611_seg_0.wav,UNKNOWN,100.0,PROCEED TO MIKOV QUALITY EIGHT TWO FIVE BRAVO,EMERGENCY,Severe Stress Spike (Score: 100)
1795,0.92,C:\Users\tssmi\OneDrive\Desktop\nlp\processed_audio\audio_2612_seg_0.wav,UNKNOWN,47.01875537662482,ROGER,Routine,
1796,4.79,C:\Users\tssmi\OneDrive\Desktop\nlp\processed_audio\audio_2613_seg_0.wav,UNKNOWN,48.20113481954687,THREE TWO ZERO,Routine,
1797,1.58,C:\Users\tssmi\OneDrive\Desktop\nlp\processed_audio\audio_2614_seg_0.wav,UNKNOWN,33.74619262991253,SION TOWER AT DEPARTURE ECHO TWO FOR TURN BRAVO PAPA ZULU,Routine,
1798,1.93,C:\Users\tssmi\OneDrive\Desktop\nlp\processed_audio\audio_2615_seg_0.wav,UNKNOWN,58.37211436997544,UNIFORM GOLF WIND TWO FOUR ZERO DEGREES ONE FOUR KNOTS RUNWAY TWO FIVE CLEAR TAKEOFF RIGHT TURN OUT CLIMB APPROVED REPORT LEAVING,Routine,
1799,3.44,C:\Users\tssmi\OneDrive\Desktop\nlp\processed_audio\audio_2616_seg_0.wav,UNKNOWN,53.38763775058743,RUZYNE TOWER VERY GOOD MORNING AUSTRIAN SEVEN ZERO THREE SPEED ONE SEVEN ZERO KNOTS ON THE ILS THREE ONE,Routine,
1800,2.76,C:\Users\tssmi\OneDrive\Desktop\nlp\processed_audio\audio_2617_seg_0.wav,UNKNOWN,41.185197235068536,SIX ZERO INBOUND,Routine,
1801,2.62,C:\Users\tssmi\OneDrive\Desktop\nlp\processed_audio\audio_2618_seg_0.wav,UNKNOWN,89.83708479438884,WIEN ONE THREE FOUR FOUR FOUR ZERO RYANAIR FIVE THREE FIVE SEVEN BYE THANK YOU,EMERGENCY,Severe Stress Spike (Score: 89)
